company,company_clean,domain,website,country_inferred,country_inference_source,region_inferred,tld,email,email_domain,email_type,role_email,free_email_provider,phone_raw,phone_normalized,contact_readiness,outreach_priority,recommended_channel,consent_status,verification_status,overall_score,raw_text_snippet
ITravelBest,I Travel Best,itravelbest.com,https://www.itravelbest.com,United States,text_hint,North America,com,info@itravelbest.com,itravelbest.com,company_domain,yes,no,972) 837-5009,+19728375009,email_and_phone,A,email_first,legitimate_interest,email_verified,24.98,"When it comes to embarking on a spiritual journey like Umrah or planning your dream vacation, you deserve nothing but the best. In the vibrant city of Dallas,"
Labbaik Hajj Umrah USA,Labbaik Hajj Umrah USA,labbaikhajjumrah.com,https://www.labbaikhajjumrah.com,United States,text_hint,North America,com,info@labbaikhajjumrah.com,labbaikhajjumrah.com,company_domain,yes,no,+17732321877,+17732321877,email_and_phone,A,email_first,legitimate_interest,email_verified,25.37,"Being a Leading USA Travel Agency, Labbaik Hajj Umrah offers Hajj and Umrah Packages according to your needs, Contact Us: (773) 232-1877"
Mafaza Travel and Hajj,Mafaza Travel and Hajj,mafazatours.com,https://www.mafazatours.com/mafaza-travel-for-hajj-and-umrah/hajj-umrah-tour-operations-mafaza-travel-usa,United States,text_hint,North America,com,mafaza@mafazatours.com,mafazatours.com,company_domain,no,no,+1- 202-247-1535,+12022471535,email_and_phone,A,email_first,unknown,email_verified,27.97,Explore Hajj & Umrah Tour operations with Mafaza Travel & Hajj Agency. Enjoy quality packages and reliable service for your sacred journey.
MARAM TOURS & TRAVEL,MARAM TOURS & TRAVEL,maramtravel.com,https://www.maramtravel.com/affordable-hajj-packages,United States,phone,North America,com,manager@maramtravel.com,maramtravel.com,company_domain,no,no,212-523-0314,+12125230314,email_and_phone,A,email_first,unknown,email_verified,25.61,Don't Let Money Stop You – Try Our Affordable Hajj Packages
Masartomecca,Masartomecca,masartomecca.com,https://masartomecca.com/umrah-packages-from-new-york,United States,text_hint,North America,com,info@masartomecca.com,masartomecca.com,company_domain,yes,no,+1 917-227-9341,+19172279341,email_and_phone,A,email_first,legitimate_interest,email_verified,25.20,"Book Umrah packages from New York with a trusted Umrah travel agency from New York. Affordable prices, flights, hotels, visa & full support."
Approved Islamic Travel Agents,Qiblatain,qiblatain.com,https://www.qiblatain.com,United States,text_hint,North America,com,info@qiblatain.com,qiblatain.com,company_domain,yes,no,+19145200581,+19145200581,email_and_phone,A,email_first,legitimate_interest,email_verified,27.77,"Book with a trusted Umrah travel agency in the USA. Approved Islamic travel agents offering visa assistance, flights, hotels, & customized Umrah packages. Contact us today."
Qibla Travel,Qibla Travel,qiblatravel.com,https://qiblatravel.com/umrah-packages-from-tampa,United States,text_hint,North America,com,info@qiblatravel.com,qiblatravel.com,company_domain,yes,no,+1 201-726-7525 12,+12017267525,email_and_phone,A,email_first,legitimate_interest,email_verified,26.23,Qibla Travel – Trusted Islamic Travel Services
Shery Travels,Shery Travels,sherytravels.com,https://sherytravels.com/umrah/usa-packages/chicago,United States,text_hint,North America,com,info@sherytravels.com,sherytravels.com,company_domain,yes,no,+1 667-439-1263,+16674391263,email_and_phone,A,email_first,legitimate_interest,email_verified,25.87,"Start your Umrah journey from Chicago with Shery Travels. Easy departures from O'Hare, group travel with Chicago's Muslim community, and full guidance for a smooth and spiritual pilgrimage."
Taibah Travels,Taibah Travels,taibahtravels.com,https://taibahtravels.com/detroit-mi,United States,text_hint,North America,com,info@taibahtravels.com,taibahtravels.com,company_domain,yes,no,+1 (206) 848-5272,+12068485272,email_and_phone,A,email_first,legitimate_interest,email_verified,25.31,"Experience top Umrah services in Detroit, MI, with Taibah Travels, offering visa assistance, direct flights, and convenient packages for your pilgrimage needs."
umrah and hajj travel agency,Ummah Travels,ummahtravels.org,https://ummahtravels.org/services,United States,phone,North America,org,info@ummahtravels.org,ummahtravels.org,company_domain,yes,no,+1-980-349-3280,+19803493280,email_and_phone,A,email_first,legitimate_interest,email_verified,25.06,Ummah Travels offers safe and affordable Hajj and Umrah journeys for East African communities and the Muslim Ummah. Experience spiritually fulfilling travel with our dedicated services tailored to your needs.
Umrah Lane,Umrah Lane,umrahlane.com,https://umrahlane.com/hajj-packages,United States,text_hint,North America,com,info@umrahlane.com,umrahlane.com,company_domain,yes,no,+1 (203) 401-8765,+12034018765,email_and_phone,A,email_first,legitimate_interest,email_verified,24.75,"Complete your Hajj obligations as a Muslim and embark on a spiritually nourishing journey with Umrah Lane Hajj Packages from the USA for 2026. Choose from our diverse array of package options, designed to suit every pilgrim’s spiritual needs. Being a trusted hajj travel agency in the USA, Umrah Lane takes great care in"
Umrah and Islamic Tours,Zashaworld Travel,zashaworldtravel.com,https://zashaworldtravel.com/islamic,United States,text_hint,North America,com,sales@zashaworldtravel.com,zashaworldtravel.com,company_domain,yes,no,+1-614-218-6667,+16142186667,email_and_phone,A,email_first,legitimate_interest,email_verified,24.64,"Umrah, Saudi, Makkah, Madinah, Jeddah, Riyadh, Islamic tour, Halal tour, AlUla, Saudi Arabia, Turkey, Istanbul, Qatar, Doha, Oman, Spain, Anadalusia, Granada, AlHambra, Malaga, Morocco, muslim owned, ohio, usa, hotels, visa,  Wellness, spiritual, incentive, family, groups, faith-based, pilgrimage, umrah preparation, um"
Al Itqan Hajj Umrah,Al Itqan Hajj Umrah,alitqanhajjumrah.com.au,https://alitqanhajjumrah.com.au/hajj-packages,Australia,domain_tld,APAC,au,info@alitqanhajjumrah.com.au,alitqanhajjumrah.com.au,company_domain,yes,no,+61 413 490 688,+61413490688,email_and_phone,B,email_first,legitimate_interest,email_verified,21.25,"Hajj is one of the five pillars of Islam, and all able-bodied Muslims are required to perform it at least once in their lifetime. It represents an opportunity to cleanse past sins and start anew. Many seek to deepen their faith during Hajj, and despite the physical challenges it presents, people from all corners of the"
Hajj And Umrah,Hajj And Umrah,bestwesttravel.com.au,https://bestwesttravel.com.au/hajj-and-umrah,Australia,domain_tld,APAC,au,inquiry@bestwesttravel.com,bestwesttravel.com,external_domain,no,no,0449965678,+61449965678,email_and_phone,B,email_then_phone,unknown,email_verified,26.23,Experience Spiritual Serenity with Trusted Pilgrimage Services
Hajj Packages – ZamZam Hajj,Hajj Packages – ZamZam Hajj,hajj.com.au,https://hajj.com.au/packages,Australia,domain_tld,APAC,au,info@hajj.com.au,hajj.com.au,company_domain,yes,no,1300 730 693,+611300730693,email_and_phone,B,email_first,legitimate_interest,email_verified,21.25,Hajj Packages
Haramain Travels,Haramain Travels,haramain.com.au,https://www.haramain.com.au,Australia,domain_tld,APAC,au,umrah@haramain.com.au,haramain.com.au,company_domain,yes,no,+61 424033098,+61424033098,email_and_phone,B,email_first,unknown,email_verified,23.92,Don't miss out on the experience of a lifetime with our unbeatable Umrah packages. Contact us now to plan your perfect trip.
Globalzone Travel S,Globalzone Travels,globalzonetravels.com,https://globalzonetravels.com/%E0%A6%B9%E0%A6%9C-%E0%A6%93-%E0%A6%93%E0%A6%AE%E0%A6%B0%E0%A6%BE%E0%A6%B9,Bangladesh,phone,APAC,com,info@globalzonetravels.com,globalzonetravels.com,company_domain,yes,no,+880 1637-417117,+8801637417117,email_and_phone,B,email_first,legitimate_interest,email_verified,21.25,রিটার্ন এয়ার টিকেট
যোগাযোগ,Haabbd,haabbd.com,https://haabbd.com/site/contact,Bangladesh,phone,APAC,com,info@haabbd.com,haabbd.com,company_domain,yes,no,01730073610,+8801730073610,email_and_phone,B,email_first,legitimate_interest,email_verified,21.25,00
Hajj & Umrah Booking Agency,Hajj Expressbd,hajjexpressbd.com,https://hajjexpressbd.com,Bangladesh,phone,APAC,com,contact@hajjexpressbd.com,hajjexpressbd.com,company_domain,yes,no,+880 1713 261112,+8801713261112,email_and_phone,B,email_first,legitimate_interest,email_verified,21.25,হজ ও ওমরাহ বুকিং এজেন্সি
lamarastravels.com,lamarastravels.com,lamarastravels.com,https://lamarastravels.com/%E0%A6%89%E0%A6%AE%E0%A6%B0%E0%A6%BE%E0%A6%B9-%E0%A6%AA%E0%A7%8D%E0%A6%AF%E0%A6%BE%E0%A6%95%E0%A7%87%E0%A6%9C,Bangladesh,phone,APAC,com,contact@lamarastravels.com,lamarastravels.com,company_domain,yes,no,01759215525,+8801759215525,email_and_phone,B,email_first,legitimate_interest,email_verified,23.92,আপনার নিয়ত যদি থাকে হজ্জ /ওমরাহ পালন আপনার নিয়তকে বাস্তবায়ন করতে আমাদের ২৩ বছরের অভিজ্ঞতা থেকে আমরা আপনাকে নিশ্চিত করবো শ্রেষ্ঠ সেবাটি
Zamzam Travels BD,Zamzam Travels BD,zamzamtravelsbd.com,https://zamzamtravelsbd.com,Bangladesh,text_hint,APAC,com,info@zamazamtravelsbd.com,zamazamtravelsbd.com,external_domain,yes,no,+44 1012 177 35101,+44101217735101,email_and_phone,B,email_then_phone,legitimate_interest,email_verified,26.58,"Explore trusted Hajj and Umrah packages in Bangladesh with Zamzam Travels BD. Compare package options, travel support, visa assistance, and pilgrimage guidance."
Bismillahtravels,Bismillah Travels,bismillahtravels.ca,https://www.bismillahtravels.ca/about.php,Canada,domain_tld,North America,ca,info@bismillahtravels.ca,bismillahtravels.ca,company_domain,yes,no,647-407-6492,+16474076492,email_and_phone,B,email_first,legitimate_interest,email_verified,21.25,desc
Bismillah Travels Canada,Bismillah Travels Canada,bismillahumrah.com,https://bismillahumrah.com/Packages/Contact,Canada,email_tld,North America,com,info@bismillahtravels.ca,bismillahtravels.ca,external_domain,yes,no,403-536-8328,+14035368328,email_and_phone,B,email_then_phone,legitimate_interest,email_verified,21.25,Cheap Economy to 5 Star Umrah Packages from Toronto Montreal Calgary Saskatoon Edmonton to Jeddah Madina with side trip to Pakistan India Dubai Cairo Istanbul
Al Buraq Travels Canada,Al Buraq Travels Canada,canada.alburaqtravels.com,https://canada.alburaqtravels.com,Canada,text_hint,North America,com,info@alburaqtravels.com,alburaqtravels.com,external_domain,yes,no,+1 208-208-3893,+12082083893,email_and_phone,B,email_then_phone,legitimate_interest,email_verified,23.92,"Book premium Umrah packages from Canada. Includes flights, hotels near Haram, visa help, and transport. Start your seamless spiritual journey today!"
HAJJ 2026,Hajj Montreal,hajjmontreal.com,https://www.hajjmontreal.com/premium,Canada,phone,North America,com,info@hajjmontreal.com,hajjmontreal.com,company_domain,yes,no,514-963-2792,+15149632792,email_and_phone,B,email_first,legitimate_interest,email_verified,21.25,Forfait premium au prix de 10 499$ CAD (vol en extra) Ã  l'hÃ´tel VOCO Ã  Makkah :Â https://maps.app.goo.gl/vvzbk6uVr4dEBcA59
Hm Tour S,Hm Tours,hmtours.ca,https://hmtours.ca/fr/omra,Canada,domain_tld,North America,ca,info@hmtours.ca,hmtours.ca,company_domain,yes,no,7 (514) 376-2777,+15143762777,email_and_phone,B,email_first,legitimate_interest,email_verified,21.25,"Omra depuis Montréal : hôtels proches du Haram, vols, transferts et accompagnement expérimenté. Dates flexibles, paiement sécurisé."
Kaabah Tours,Kaabah Tours,kaabahtours.com,https://www.kaabahtours.com/hajj-packages.html,Canada,text_hint,North America,com,info@kaabahtours.com,kaabahtours.com,company_domain,yes,no,437) 826-7786,+14378267786,email_and_phone,B,email_first,legitimate_interest,email_verified,21.25,"Join Kaabah Tours for cheap Hajj 2026 packages! Our all-inclusive packages from Canada cover flights, visas & more, with departures from Toronto and Montreal. Book today!"
Kasfah Hajj Travels,Kasfah Hajj Travels,kasfahhajj.com,https://kasfahhajj.com/umrah-packages,Canada,phone,North America,com,info@kasfahhajj.com,kasfahhajj.com,company_domain,yes,no,+1 (204)-505-5110,+12045055110,email_and_phone,B,email_first,legitimate_interest,email_verified,23.92,Umrah Packages
Kiswa Tours,Kiswa Tours,kiswatours.com,https://www.kiswatours.com/Umrah/umrah-package-january-2025,Canada,text_hint,North America,com,contact@kiswatours.com,kiswatours.com,company_domain,yes,no,+1 289 222 2786,+12892222786,email_and_phone,B,email_first,legitimate_interest,email_verified,21.25,"Umrah Package for January 2025 from Toronto, Edmonton, or Montreal. Get the best Umrah & Hajj 2025 packages, including visa from Canada."
Umrah Prices,Umrah Prices,umrah-prices.com,https://umrah-prices.com/%D8%A7%D8%B3%D8%B9%D8%A7%D8%B1-%D8%A7%D9%84%D8%B9%D9%85%D8%B1%D9%87-%D9%85%D9%86-%D9%83%D9%86%D8%AF%D8%A7,Canada,text_hint,North America,com,info@umrah-prices.com,umrah-prices.com,company_domain,yes,no,00966502892469,+966502892469,email_and_phone,B,email_first,legitimate_interest,email_verified,21.25,اسعار العمره من كندا مونتريال 2023 Omra Montréal Prix اشهر العطلة المدرسية رجب شعبان رمضان شوال الحج يناير جانفي شتنبر غشت اكتوبر دجنبر.
//arbatravel.com/,//arbatravel.com/,arbatravel.com,https://arbatravel.com,Egypt,phone,MENA,com,hi@arbatravel.com,arbatravel.com,company_domain,no,no,201401017044,+12014010170,email_and_phone,B,email_first,unknown,email_verified,23.92,Pakej Percutian Muslim 2026/2027 Dalam & Luar Negara ARBA Travel. Syarikat Dipercayai & Memenangi Anugerah Top 30 SME Corp & Top 30 Forbes Asia.
Hajj 2026 Pack Standard,Haramainvoyages,haramainvoyages.com,https://www.haramainvoyages.com/tour/hajj-court-sejour,Egypt,phone,MENA,com,contact@haramainvoyages.com,haramainvoyages.com,company_domain,yes,no,2 01 84 21 05 72,+20184210572,email_and_phone,B,email_first,legitimate_interest,email_verified,21.25,Hajj 2026 Pack Standard
Hajj 2026,Carnot Voyages,carnot-voyages.fr,https://carnot-voyages.fr/hajj2026,France,domain_tld,Europe,fr,carnotvoyages@orange.fr,orange.fr,external_domain,no,no,+33 4 77 92 60 31 4,+334779260314,email_and_phone,B,email_then_phone,unknown,email_verified,21.25,"Pour réserver votre Hajj 2026 avec Carnot voyages, il est indispensable de suivre attentivement toutes les étapes indiquées sur notre site avant de vous inscrire sur la plateforme officielle Nusuk."
Agence Hajj & Omra,Agence Hajj & Omra,doyouf.fr,http://doyouf.fr/contact.php,France,domain_tld,Europe,fr,contact@doyouf.fr,doyouf.fr,company_domain,yes,no,+33 7 51 50 06 54,+33751500654,email_and_phone,B,email_first,legitimate_interest,email_verified,21.25,Découvrez nos forfaits Omra et Hajj 2024 et réservez votre pèlerinage avec l'agence Doyouf
OMRA & HAJJ depuis la France,OMRA & HAJJ depuis la France,goodsafar.com,https://www.goodsafar.com,France,text_hint,Europe,com,hello@www.goodsafar.com,www.goodsafar.com,external_domain,yes,no,07 53 47 55 21,+33753475521,email_and_phone,B,email_then_phone,legitimate_interest,email_verified,21.25,Bienvenue chez GOOD SAFAR
HAJIR TOURS,HAJIR TOURS,hajirtours.com,https://hajirtours.com/forfaits-et-reservations-hajj,France,phone,Europe,com,agence@hajirtours.com,hajirtours.com,company_domain,no,no,+33 (0)3 88 39 57 65,+330388395765,email_and_phone,B,email_first,unknown,email_verified,21.25,"""Forfaits et réservations Hajj : découvrez tous les services inclus, les procédures de réservation et les options de remboursement pour préparer sereinement votre pèlerinage."
"Prix, forfaits et inscription pour le Hajj 2026",Islavoyages,islavoyages.com,https://islavoyages.com/contact,France,phone,Europe,com,contact@islavoyages.com,islavoyages.com,company_domain,yes,no,+33 (0) 1 47 39 91 86,+330147399186,email_and_phone,B,email_first,legitimate_interest,email_verified,21.25,Contact de notre agence de voyage hajj omra par téléphone ou en ligne. Venez à l'agence pour rencontrer l'équipe et découvrir nos séjours.
"Medin Voyages, Agence Omra & Hajj 2026",Medin Voyages,medinvoyages.com,https://medinvoyages.com,France,text_hint,Europe,com,contact@medinvoyages.com,medinvoyages.com,company_domain,yes,no,+33 (0)6 51 50 64 86,+330651506486,email_and_phone,B,email_first,legitimate_interest,email_verified,21.25,"Medin Voyages est une agence de voyages spécialisée dans l'organisation de Omras, toute l'année, au départ de Paris."
OMRADISCOUNT,OMRADISCOUNT,omradiscount.fr,https://www.omradiscount.fr/omra/prix-omra,France,domain_tld,Europe,fr,contact@omradiscount.fr,omradiscount.fr,company_domain,yes,no,01 77 37 36 99,+33177373699,email_and_phone,B,email_first,legitimate_interest,email_verified,21.25,Prix Omra 2025-2026 – Combien coûte une Omra tout compris ?​
Hajj 2026,Omrapourtous,omrapourtous.com,https://omrapourtous.com/hajj-2026,France,phone,Europe,com,contact@omrapourtous.com,omrapourtous.com,company_domain,yes,no,+33) 04 84 89 65 51 15,+33048489655115,email_and_phone,B,email_first,legitimate_interest,email_verified,21.25,"hajj 2026 pas cher à coté du Haram avec ariane voyages, forfait hajj 2026 avec des prix imbattables"
Agence Omra et Hajj,Agence Omra et Hajj,partirenomra.fr,https://partirenomra.fr/contact-us,France,domain_tld,Europe,fr,contact@partirenomra.fr,partirenomra.fr,company_domain,yes,no,+33) 1 80 90 39 89,+33180903989,email_and_phone,B,email_first,legitimate_interest,email_verified,21.25,Formulaire de Contact Veuillez activer JavaScript dans votre navigateur pour remplir ce formulaire.Veuillez activer JavaScript dans votre navigateur pour
Alamal Travel,Alamal Travel,alamaltravel.net,https://alamaltravel.net/%D8%B9%D8%B1%D9%88%D8%B6-%D8%B1%D8%AD%D9%84%D8%A7%D8%AA-%D8%A7%D9%84%D8%B9%D9%85%D8%B1%D8%A9-%D9%85%D9%86-%D8%A3%D9%84%D9%85%D8%A7%D9%86%D9%8A%D8%A7,Germany,phone,Europe,net,info@alamaltravel.net,alamaltravel.net,company_domain,yes,no,+49 (176) 62495894,+4917662495894,email_and_phone,B,email_first,legitimate_interest,email_verified,21.25,إذا كنت تبحث عن عروض رحلات العمرة من ألمانيا وجميع الدول الأوروبية، فيمكن أن تسأل عروض شركة الأمل ترافل وتقوم بحجز رحلة تتناسبك
Alsfir Neu,Alsfir Neu,alsafir-neu.de,https://alsafir-neu.de,Germany,domain_tld,Europe,de,info@alsafar-neu.de,alsafar-neu.de,external_domain,yes,no,0049 17655007999,+4917655007999,email_and_phone,B,email_then_phone,legitimate_interest,email_verified,21.25,"Alsafir nue bietet maßgeschneiderte Pakete für wirtschaftliche und luxuriöse Umrah-Reisen von Europa nach Mekka und Medina. Unsere Dienstleistungen umfassen exklusive Unterkünfte, umfassende Betreuung und die Anwesenheit erfahrener religiöser Führer, die Ihre spirituelle Reise begleiten. Vertrauen Sie auf uns, um Ihnen"
buildertravelgmbh.de,buildertravelgmbh.de,buildertravel.de,https://buildertravel.de/ar/%D8%A7%D9%84%D8%AD%D8%AC,Germany,domain_tld,Europe,de,m.elwy@buildertravel.com,buildertravel.com,external_domain,no,no,004915560807942,+4915560807942,email_and_phone,B,email_then_phone,unknown,email_verified,23.92,22 مايو – 24 ذو القعدة الرحلة: كولن → القاهرة → جدة
"El Bashair für Hajj, Umra und Reisen",El Bashair für Hajj,el-bashair.de,https://www.el-bashair.de/impressum,Germany,domain_tld,Europe,de,info@el-bashair.de,el-bashair.de,company_domain,yes,no,49-176-62039183,+14917662039,email_and_phone,B,email_first,legitimate_interest,email_verified,21.25,"Verantwortlich für den Inhalt im Sinne von §5 TMG: El Bashair für Hajj, Umra und Reisen GmbH Glockenblumenweg 59A 12357 Berlin Deutschland"
Hajj Umrah,Hajj Umrah,hajj-umrah-check.com,https://hajj-umrah-check.com/en/umrah-package-from-germany,Germany,phone,Europe,com,office@hajj-umrah-check.com,hajj-umrah-check.com,company_domain,yes,no,+49 1577 0255540,+4915770255540,email_and_phone,B,email_first,legitimate_interest,email_verified,21.25,Umrah Package from Germany 2026 - Browse. Compare. Book your Umrah 2025 – Easy Booking ✓ Cheap Packages ✓ inkl. Free Consultation ✓
Umrah Paket,Umrah Paket,idealgate.de,https://www.idealgate.de/kontakt,Germany,domain_tld,Europe,de,info@idealgate.de,idealgate.de,company_domain,yes,no,+49 160 5007727,+491605007727,email_and_phone,B,email_first,legitimate_interest,email_verified,21.25,BenÃ¶tigen Sie kompetente Beratung oder Vermittlung von GeschÃ¤ftspartnern ? Wir sind fÃ¼r Sie da.
travels.de,Ihsan Travels,ihsan-travels.de,https://ihsan-travels.de,Germany,domain_tld,Europe,de,info@ihsan-travels.com,ihsan-travels.com,external_domain,yes,no,+49 17666869080,+4917666869080,email_and_phone,B,email_then_phone,legitimate_interest,email_verified,23.92,"Buche jetzt deine Umrah Reise ab Deutschland. Komplettpaket mit Flug, Hotel, Visa, Transfers & Betreuung. Persönlich & professionell."
Miqat Hajj and Umrah trips,Miqat Hajj and Umrah trips,miqat.eu,https://www.miqat.eu/en,Germany,phone,Europe,eu,info@miqat.eu,miqat.eu,company_domain,yes,no,+49 176 23633672,+4917623633672,email_and_phone,B,email_first,legitimate_interest,email_verified,21.25,"Exclusive HAJJ and UMRAH trips from Germany. Miqat's focus: style, outstanding service and first-class hotels such as the Mecca Clock Tower."
My Umrah Ug,My Umrah Ug,myumrah-ug.de,https://www.myumrah-ug.de,Germany,domain_tld,Europe,de,myumrah@web.de,web.de,external_domain,no,no,+49 1719565060,+491719565060,email_and_phone,B,email_then_phone,unknown,email_verified,21.25,"Wir begleiten dich mit Erfahrung, Herz und Wissen auf deiner spirituellen Reise nach Mekka und Medina. Ob als Einzelperson oder in der Gruppe – mit myUmrah reist du sicher, organisiert und mit spiritueller Begleitung.

Unsere Umrah-Pakete beinhalten Flüge, Hotels, Transfers, Visa-Service und die persönliche Betreuung"
Reisebüro Bouhjar GmbH,Reisebüro Bouhjar GmbH,reisebuero-bouhjar.de,https://www.reisebuero-bouhjar.de/kontakt,Germany,domain_tld,Europe,de,info@reisebuero-bouhjar.de,reisebuero-bouhjar.de,company_domain,yes,no,0231-8630689,+492318630689,email_and_phone,B,email_first,legitimate_interest,email_verified,21.25,"Reisbüro Bouhjar,"
Hajj und Umra Reisen,Hajj und Umra Reisen,soultreat.de,https://www.soultreat.de/makarim,Germany,domain_tld,Europe,de,info@makarim.de,makarim.de,external_domain,yes,no,0151 - 14 57 58 59,+15114575859,email_and_phone,B,email_then_phone,legitimate_interest,email_verified,21.25,Makarim - Hajj und Umra Reisen
Tarik Ben Ziad,Tarik Ben Ziad,tarikbenziad.com,https://tarikbenziad.com/en,Germany,phone,Europe,com,info@tarikbenziad.com,tarikbenziad.com,company_domain,yes,no,+49 173 6074894,+491736074894,email_and_phone,B,email_first,legitimate_interest,email_verified,21.25,"In 2005, Tarik Ben Ziad Company was established to organize Hajj and Umrah trips from Germany to visit the most honorable places on earth, the Grand Mosque and the Prophet’s Mosque."
yusr umrah,yusr umrah,yusr-umrah.de,https://yusr-umrah.de,Germany,domain_tld,Europe,de,info@yusr-umrah.de,yusr-umrah.de,company_domain,yes,no,01521 460 30 60,+15214603060,email_and_phone,B,email_first,legitimate_interest,email_verified,21.25,DEINE UMRAH MIT YUSR
IV Travel,IV Travel,ivtravel.org,https://ivtravel.org/contact,Indonesia,phone,APAC,org,info@ivtravel.ie,ivtravel.ie,external_domain,yes,no,087 374 5622 62,+18737456226,email_and_phone,B,email_then_phone,legitimate_interest,email_verified,27.67,Contact
Pakej Haji Umrah Percutian Muslim,Alhijjrahvac,alhijjrahvac.com,https://www.alhijjrahvac.com,Malaysia,phone,APAC,com,info@alhijjrahvac.com,alhijjrahvac.com,company_domain,yes,no,+6016-661 3424,+60166613424,email_and_phone,B,email_first,legitimate_interest,email_verified,21.25,"Al Hijjrah Vacation Sdn Bhd Merupakan sebuah syarikat Bumiputera berstatus Muasasah dan Berpengalaman dalam mengendalikan Pakej Haji, Umrah serta Percutian Dalam & Luar Negara sejak Tahun 2005 [Pakej Haji Umrah Percutian Muslim],[Badal Haji & Upah Umrah],[Muslim Tour Package]"
Felda Travel,Felda Travel,feldatravel.com.my,https://feldatravel.com.my,Malaysia,domain_tld,APAC,my,salam@feldatravel.com.my,feldatravel.com.my,company_domain,no,no,+6019 279 0022,+60192790022,email_and_phone,B,email_first,unknown,email_verified,21.25,Kami menyediakan penyelesaian perjalanan korporat menyeluruh kepada pelanggan dari awal hingga akhir.
Felda Travel & Tours,Felda Travel & Tours,pakejhajiswasta.com,https://pakejhajiswasta.com,Malaysia,email_tld,APAC,com,salam@feldatravel.com.my,feldatravel.com.my,external_domain,no,no,60192790022,+60192790022,email_and_phone,B,email_then_phone,unknown,email_verified,25.25,Felda Travel merupakan agensi haji berlesen yang menyediakan pakej haji dengan perkhidmatan terbaik pada harga berpatutan.
1omra.com,1omra.com,1omra.com,https://1omra.com/about-us,Netherlands,phone,Europe,com,support@1omra.com,1omra.com,company_domain,yes,no,+31 6 57414540,+31657414540,email_and_phone,B,email_first,legitimate_interest,email_verified,21.25,"Nous nous engageons à aider les pèlerins à vivre le Hajj et l’Omra avec confort, clarté et confiance. Des vols à l’hébergement, en passant par l’accompagnement et l’assistance, nous nous occupons des détails afin que vous puissiez vous concentrer sur ce qui est le plus important : votre satifaction !"
AlTaqwa HADJ & UMRAH,AlTaqwa HADJ & UMRAH,altaqwa.nl,https://altaqwa.nl/ar,Netherlands,domain_tld,Europe,nl,info@altaqwa.nl,altaqwa.nl,company_domain,yes,no,31626650977,+31626650977,email_and_phone,B,email_first,legitimate_interest,email_verified,21.25,AlTaqwa HADJ & UMRAH
