company,company_clean,domain,website,country_inferred,country_inference_source,region_inferred,tld,email,email_domain,email_type,role_email,free_email_provider,phone_raw,phone_normalized,contact_readiness,outreach_priority,recommended_channel,consent_status,verification_status,overall_score,raw_text_snippet
ITravelBest,I Travel Best,itravelbest.com,https://www.itravelbest.com,United States,text_hint,North America,com,info@itravelbest.com,itravelbest.com,company_domain,yes,no,972) 837-5009,+19728375009,email_and_phone,A,email_first,legitimate_interest,email_verified,24.98,"When it comes to embarking on a spiritual journey like Umrah or planning your dream vacation, you deserve nothing but the best. In the vibrant city of Dallas,"
Labbaik Hajj Umrah USA,Labbaik Hajj Umrah USA,labbaikhajjumrah.com,https://www.labbaikhajjumrah.com,United States,text_hint,North America,com,info@labbaikhajjumrah.com,labbaikhajjumrah.com,company_domain,yes,no,+17732321877,+17732321877,email_and_phone,A,email_first,legitimate_interest,email_verified,25.37,"Being a Leading USA Travel Agency, Labbaik Hajj Umrah offers Hajj and Umrah Packages according to your needs, Contact Us: (773) 232-1877"
Mafaza Travel and Hajj,Mafaza Travel and Hajj,mafazatours.com,https://www.mafazatours.com/mafaza-travel-for-hajj-and-umrah/hajj-umrah-tour-operations-mafaza-travel-usa,United States,text_hint,North America,com,mafaza@mafazatours.com,mafazatours.com,company_domain,no,no,+1- 202-247-1535,+12022471535,email_and_phone,A,email_first,unknown,email_verified,27.97,Explore Hajj & Umrah Tour operations with Mafaza Travel & Hajj Agency. Enjoy quality packages and reliable service for your sacred journey.
MARAM TOURS & TRAVEL,MARAM TOURS & TRAVEL,maramtravel.com,https://www.maramtravel.com/affordable-hajj-packages,United States,phone,North America,com,manager@maramtravel.com,maramtravel.com,company_domain,no,no,212-523-0314,+12125230314,email_and_phone,A,email_first,unknown,email_verified,25.61,Don't Let Money Stop You – Try Our Affordable Hajj Packages
Masartomecca,Masartomecca,masartomecca.com,https://masartomecca.com/umrah-packages-from-new-york,United States,text_hint,North America,com,info@masartomecca.com,masartomecca.com,company_domain,yes,no,+1 917-227-9341,+19172279341,email_and_phone,A,email_first,legitimate_interest,email_verified,25.20,"Book Umrah packages from New York with a trusted Umrah travel agency from New York. Affordable prices, flights, hotels, visa & full support."
Approved Islamic Travel Agents,Qiblatain,qiblatain.com,https://www.qiblatain.com,United States,text_hint,North America,com,info@qiblatain.com,qiblatain.com,company_domain,yes,no,+19145200581,+19145200581,email_and_phone,A,email_first,legitimate_interest,email_verified,27.77,"Book with a trusted Umrah travel agency in the USA. Approved Islamic travel agents offering visa assistance, flights, hotels, & customized Umrah packages. Contact us today."
Qibla Travel,Qibla Travel,qiblatravel.com,https://qiblatravel.com/umrah-packages-from-tampa,United States,text_hint,North America,com,info@qiblatravel.com,qiblatravel.com,company_domain,yes,no,+1 201-726-7525 12,+12017267525,email_and_phone,A,email_first,legitimate_interest,email_verified,26.23,Qibla Travel – Trusted Islamic Travel Services
Shery Travels,Shery Travels,sherytravels.com,https://sherytravels.com/umrah/usa-packages/chicago,United States,text_hint,North America,com,info@sherytravels.com,sherytravels.com,company_domain,yes,no,+1 667-439-1263,+16674391263,email_and_phone,A,email_first,legitimate_interest,email_verified,25.87,"Start your Umrah journey from Chicago with Shery Travels. Easy departures from O'Hare, group travel with Chicago's Muslim community, and full guidance for a smooth and spiritual pilgrimage."
Taibah Travels,Taibah Travels,taibahtravels.com,https://taibahtravels.com/detroit-mi,United States,text_hint,North America,com,info@taibahtravels.com,taibahtravels.com,company_domain,yes,no,+1 (206) 848-5272,+12068485272,email_and_phone,A,email_first,legitimate_interest,email_verified,25.31,"Experience top Umrah services in Detroit, MI, with Taibah Travels, offering visa assistance, direct flights, and convenient packages for your pilgrimage needs."
umrah and hajj travel agency,Ummah Travels,ummahtravels.org,https://ummahtravels.org/services,United States,phone,North America,org,info@ummahtravels.org,ummahtravels.org,company_domain,yes,no,+1-980-349-3280,+19803493280,email_and_phone,A,email_first,legitimate_interest,email_verified,25.06,Ummah Travels offers safe and affordable Hajj and Umrah journeys for East African communities and the Muslim Ummah. Experience spiritually fulfilling travel with our dedicated services tailored to your needs.
Umrah Lane,Umrah Lane,umrahlane.com,https://umrahlane.com/hajj-packages,United States,text_hint,North America,com,info@umrahlane.com,umrahlane.com,company_domain,yes,no,+1 (203) 401-8765,+12034018765,email_and_phone,A,email_first,legitimate_interest,email_verified,24.75,"Complete your Hajj obligations as a Muslim and embark on a spiritually nourishing journey with Umrah Lane Hajj Packages from the USA for 2026. Choose from our diverse array of package options, designed to suit every pilgrim’s spiritual needs. Being a trusted hajj travel agency in the USA, Umrah Lane takes great care in"
Umrah and Islamic Tours,Zashaworld Travel,zashaworldtravel.com,https://zashaworldtravel.com/islamic,United States,text_hint,North America,com,sales@zashaworldtravel.com,zashaworldtravel.com,company_domain,yes,no,+1-614-218-6667,+16142186667,email_and_phone,A,email_first,legitimate_interest,email_verified,24.64,"Umrah, Saudi, Makkah, Madinah, Jeddah, Riyadh, Islamic tour, Halal tour, AlUla, Saudi Arabia, Turkey, Istanbul, Qatar, Doha, Oman, Spain, Anadalusia, Granada, AlHambra, Malaga, Morocco, muslim owned, ohio, usa, hotels, visa,  Wellness, spiritual, incentive, family, groups, faith-based, pilgrimage, umrah preparation, um"
