company,contact_name,role,email,phone,domain,source_url,source_label,consent_status,verification_status,overall_score,raw_text_snippet
Qibla Travels,,Procurement Manager,info@qiblatravels.com,020 8558 4848,qiblatravels.com,https://www.qiblatravels.com/trusted-umrah-agency-in-leicester-all-inclusive-2026-deals,Public website crawl,legitimate_interest,email_verified,23.92,Looking for Umrah agents in Leicester? Qibla Travels offers premium and economy Umrah packages with flights from EMA/BHX and luxury Makkah stays.
Salah Travels,,Procurement Manager,info@salahtravels.com,+1 224 244 5040,salahtravels.com,https://salahtravels.com/umrah-packages-from-chicago,Public website crawl,legitimate_interest,email_verified,23.92,"Salah Travels provides Umrah Packages from Chicago, committed to making your holy journey easy for you. we aim at doing everything for you."
Sukoon Travels,,Procurement Manager,info@sukoontravels.com,1-888-358-6724,sukoontravels.com,https://sukoontravels.com/hajj-packages-from-toronto,Public website crawl,legitimate_interest,email_verified,23.92,"Book your Hajj from Toronto with Sukoon Travels. Enjoy expert guidance, visa assistance, and reliable service for a safe and fulfilling spiritual journey."
Taqwa Travel,,Procurement Manager,info@taqwatravel.co.uk,02036270209 7,taqwatravel.co.uk,https://taqwatravel.co.uk/umrah-packages-liverpool.php,Public website crawl,legitimate_interest,email_verified,23.92,"Answer the spiritual call of Umrah with our Liverpool Umrah Packages by Taqwa Travel. Affordable, trusted, and spiritual – book your sacred trip now!"
Twf Hajj,,Procurement Manager,am@ttw.co,+27 72 500 0188,twfhajj.com,https://www.twfhajj.com,Public website crawl,unknown,email_verified,23.92,"TWF Hajj packages (South Africa) are designed to offer a truly personalised and compassionate approach, making every traveller feel supported at every stage of their journey"
Twf Hajj,,Procurement Manager,ayyaz@flywell.co.za,+27 72 500 0188,twfhajj.com,https://www.twfhajj.com,Public website crawl,unknown,email_verified,23.92,"TWF Hajj packages (South Africa) are designed to offer a truly personalised and compassionate approach, making every traveller feel supported at every stage of their journey"
Twf Hajj,,Procurement Manager,cpt5@flywell.co.za,+27 72 500 0188,twfhajj.com,https://www.twfhajj.com,Public website crawl,unknown,email_verified,23.92,"TWF Hajj packages (South Africa) are designed to offer a truly personalised and compassionate approach, making every traveller feel supported at every stage of their journey"
Twf Hajj,,Procurement Manager,gv@ttw.co,+27 72 500 0188,twfhajj.com,https://www.twfhajj.com,Public website crawl,unknown,email_verified,23.92,"TWF Hajj packages (South Africa) are designed to offer a truly personalised and compassionate approach, making every traveller feel supported at every stage of their journey"
Twf Hajj,,Procurement Manager,im@worldoftravel.co.za,+27 72 500 0188,twfhajj.com,https://www.twfhajj.com,Public website crawl,unknown,email_verified,23.92,"TWF Hajj packages (South Africa) are designed to offer a truly personalised and compassionate approach, making every traveller feel supported at every stage of their journey"
UmrahHosting,,Procurement Manager,info@umrahhosting.com,+966 56 648 3994,umrahhosting.com,https://umrahhosting.com/packages/usa/orlando,Public website crawl,legitimate_interest,email_verified,23.92,"Start your sacred path from Orlando. We provide MCO pilgrims with luxury accommodations, private transfers, and the spiritual security of traveling with seasoned Makkah experts."
UmrahHosting,,Procurement Manager,taxi@umrahhosting.com,+966 56 648 3994,umrahhosting.com,https://umrahhosting.com/packages/usa/orlando,Public website crawl,unknown,email_verified,23.92,"Start your sacred path from Orlando. We provide MCO pilgrims with luxury accommodations, private transfers, and the spiritual security of traveling with seasoned Makkah experts."
UmrahHosting,,Procurement Manager,umra@umrahhosting.com,+966 56 648 3994,umrahhosting.com,https://umrahhosting.com/packages/usa/orlando,Public website crawl,unknown,email_verified,23.92,"Start your sacred path from Orlando. We provide MCO pilgrims with luxury accommodations, private transfers, and the spiritual security of traveling with seasoned Makkah experts."
UmrahHosting,,Procurement Manager,umrah@umrahhosting.com,+966 56 648 3994,umrahhosting.com,https://umrahhosting.com/packages/usa/orlando,Public website crawl,unknown,email_verified,23.92,"Start your sacred path from Orlando. We provide MCO pilgrims with luxury accommodations, private transfers, and the spiritual security of traveling with seasoned Makkah experts."
Umrah Traveller,,Procurement Manager,info@umrahtraveller.co.uk,02031952836,umrahtraveller.co.uk,https://umrahtraveller.co.uk/umrah-packages-glasgow,Public website crawl,legitimate_interest,email_verified,23.92,"Book your Umrah Packages Glasgow 2025 with the best agency Umrah Traveller. Offering Top-tier accommodation, flight, transport and customer support."
Ziyufalrahman,,Procurement Manager,info@ziyufalrahman.co.uk,+44 161 949 4499,ziyufalrahman.co.uk,https://ziyufalrahman.co.uk/hajj-packages,Public website crawl,legitimate_interest,email_verified,23.92,"Hajj packages 2026 from UK. Get affordable Hajj plans, hotels, transport, and guidance for your pilgrimage. Book now with Ziyuf Al Rahman UK."
Alfalah Travel and Tourism,,Procurement Manager,info@alfalahtravelandtourism.com,,alfalahtravelandtourism.com,https://alfalahtravelandtourism.com/about-us,Public website crawl,legitimate_interest,email_verified,23.20,Discover the Essence of Alfalah Travel & Tours.
Sadat Hajj & Umrah,,Procurement Manager,admin@agentrav.com,,agentrav.in,https://agentrav.in/about,Public website crawl,unknown,email_verified,23.04,"Building the world's most trusted directory of travel agencies. Connecting travelers with 88,000+ verified experts worldwide."
Sadat Hajj & Umrah,,Procurement Manager,admin@agentrav.com,01254 368193,agentrav.in,https://agentrav.in/company/15228-sadat-hajj-umrah,Public website crawl,unknown,email_verified,22.08,"Sadat Hajj and Umrah is a leading provider of group arranged fully inclusive Hajj packages and tailo • Located in Blackburn, England • Specializing in Isla..."
Dar El Mecca,,Procurement Manager,darelmecca94@gmail.com,+1 919-410-9557,darelmecca.com,https://darelmecca.com/houston-umrah-packages,Public website crawl,unknown,email_verified,21.25,"Explore trusted Umrah Packages from Houston with expert support, premium accommodations, and personalized planning—guided by Dar El Mecca."
Dar El Mecca,,Procurement Manager,info@darelmecca.com,+1 (919) 310 4065,darelmecca.com,https://darelmecca.com/contact-us,Public website crawl,legitimate_interest,email_verified,21.25,12th July is the last day to register on a Pakistani passport for 2026 Hajj
Dar El Mecca,,Procurement Manager,darelmecca94@gmail.com,+1 (919) 310 4065,darelmecca.com,https://darelmecca.com/contact-us,Public website crawl,unknown,email_verified,21.25,12th July is the last day to register on a Pakistani passport for 2026 Hajj
Dar El Mecca,,Procurement Manager,darelmecca@gmail.com,+1 (919) 310 4065,darelmecca.com,https://darelmecca.com/contact-us,Public website crawl,unknown,email_verified,21.25,12th July is the last day to register on a Pakistani passport for 2026 Hajj
Alhaq Tours,,Procurement Manager,info@alhaqtours.com,312) 923 - 7866,alhaqtours.com,https://alhaqtours.com/chicago-umrah-packages.html,Public website crawl,legitimate_interest,email_verified,21.25,"Book all-inclusive Chicago Umrah Packages 2026 with Alhaq Tours. Get flights, visa, transport, and hotels near Haramain at the best prices."
Haleema Limited,,Procurement Manager,sales@haleema.co.uk,0158 234 3075,haleema.co.uk,https://www.haleema.co.uk/about,Public website crawl,legitimate_interest,email_verified,21.25,"Haleema Limited, office based in Luton to make your Umrah and Hajj tours unforgettable by providing exceptional packages since 2007."
Hisar Tour Hajj Umrah,,Procurement Manager,hisartour@uama.us,07013 (201) 201 8992,hisartour.com,https://hisartour.com/package/hajj-package-chicago-ord-gold,Public website crawl,unknown,email_verified,21.25,"Join our 14-day Hajj 2026 Gold Package from Chicago. Stay at Sheraton Makkah, View Hotel Madinah & Mina camp. Pre-register free."
Kiswa Tours,,Procurement Manager,contact@kiswatours.com,+1 289 222 2786,kiswatours.com,https://www.kiswatours.com/Umrah/umrah-package-january-2025,Public website crawl,legitimate_interest,email_verified,21.25,"Umrah Package for January 2025 from Toronto, Edmonton, or Montreal. Get the best Umrah & Hajj 2025 packages, including visa from Canada."
Labayk Hajj,,Procurement Manager,info@labaykhajj.ca,3695 3795 3995,labaykhajj.ca,https://labaykhajj.ca/hajj-umrah,Public website crawl,legitimate_interest,email_verified,21.25,"Umrah Visa from Canada : The only Umrah visa company licensed by the Ministry of Hajj, Saudi Embassy, IATA and TICO, located in Ottawa."
Accurate Travel S,,Procurement Manager,booking@accuratetravels.com,416-264-9299,accuratetravels.com,https://accuratetravels.com/umrah-package-from-montreal.php,Public website crawl,unknown,email_verified,21.25,Here are our best Umrah Package from Montreal Canada. Book now limited seats Contact us by email or call us for more info +1-416-264-9299
Ayesha Hajj & Umrah Services,,Procurement Manager,info@ahus.co.nz,+14083246340,ahus.co.nz,https://ahus.co.nz/umrah,Public website crawl,legitimate_interest,email_verified,21.25,Umrah
Umrah from San Francisco,,Procurement Manager,info@safwatours.com,+1 (872) 263-9805,alsafwatours.com,https://alsafwatours.com/umrah-from-san-francisco,Public website crawl,legitimate_interest,email_verified,21.25,Umrah from San Francisco
AlSafwa Tours,,Procurement Manager,info@alsafwatours.com,+1 (872) 263-9805,alsafwatours.com,https://alsafwatours.com/about,Public website crawl,legitimate_interest,email_verified,21.25,About
Agence agréée omra et Hajj,,Procurement Manager,info.alsirate@gmail.com,+33 3 74 09 06 39 229,alsiratevoyage.com,https://www.alsiratevoyage.com/omra-marseille,Public website crawl,unknown,email_verified,21.25,"Omra Marseille avec votre agence agrée Omra et Hajj, Alsirate Voyage, implantée dans différentes villes de France. Prix pas cher! Réservez!"
Bismillah Travels,,Procurement Manager,info@bismillahtravels.ca,647-407-6492,bismillahtravels.ca,http://www.bismillahtravels.ca/about.php,Public website crawl,legitimate_interest,email_verified,21.25,desc
Bismillah Travels,,Procurement Manager,info@bismillahtravels.com,647-407-6492,bismillahtravels.ca,http://www.bismillahtravels.ca/about.php,Public website crawl,legitimate_interest,email_verified,21.25,desc
specialising in Hajj & Umrah Tours,,Procurement Manager,admin@barakahtravel.co.za,+27 74 046 4101,barakahtravel.co.za,https://barakahtravel.co.za,Public website crawl,unknown,email_verified,21.25,Embark on an Unforgettable Journey
Bismillah Travels Canada,,Procurement Manager,info@bismillahtravels.ca,403-536-8328,bismillahumrah.com,https://bismillahumrah.com/Packages/Contact,Public website crawl,legitimate_interest,email_verified,21.25,Cheap Economy to 5 Star Umrah Packages from Toronto Montreal Calgary Saskatoon Edmonton to Jeddah Madina with side trip to Pakistan India Dubai Cairo Istanbul
Bukhari Tours,,Procurement Manager,info@bukharitours.co.uk,+44 7513 311939,bukharitours.co.uk,https://bukharitours.co.uk,Public website crawl,legitimate_interest,email_verified,21.25,"Manchester's #1 Umrah & Hajj Agency. 30+ Years Experience. Exclusive Feb Half-Term Ramadan 2026 deals, Hajj on Pakistani Passport & Direct Flights from Manchester (MAN). ATOL Protected."
Canada Hajj Services,,Procurement Manager,info@canadahajjservices.com,+1 778-323-0577,canadahajjservice.com,https://canadahajjservice.com,Public website crawl,legitimate_interest,email_verified,21.25,Hajj 2026 Made Easy for Overseas Pakistani's in Canada & The United States
Hajj & Umrah Tours,,Procurement Manager,info@cumberlandtours.ca,416-250-6200,cumberlandtours.ca,https://cumberlandtours.ca,Public website crawl,legitimate_interest,email_verified,21.25,Hajj & Umrah  Tours.
Hajj & Umrah Tours,,Procurement Manager,info@cumberlandtours.ca,+1 416-573-3544,cumberlandtours.ca,https://cumberlandtours.ca/contact-us,Public website crawl,legitimate_interest,email_verified,21.25,Contact Us
Elrisalah,,Procurement Manager,info@elrisaalah.com,+31 617413886,elrisaalah.com,https://elrisaalah.com,Public website crawl,legitimate_interest,email_verified,21.25,"2 Persoonskamer Saudi Airlines:
Amsterdam Jeddah –
Jeddah Amsterdam Makkah 15-02 t/m 22-02 Madinah 22-02 t/m 03-03 Makkah 03-03 t/m 28-03 € 4750 p.p."
Elrisalah,,Procurement Manager,amr@elrisaalah.com,+31 617413886,elrisaalah.com,https://elrisaalah.com,Public website crawl,unknown,email_verified,21.25,"2 Persoonskamer Saudi Airlines:
Amsterdam Jeddah –
Jeddah Amsterdam Makkah 15-02 t/m 22-02 Madinah 22-02 t/m 03-03 Makkah 03-03 t/m 28-03 € 4750 p.p."
Elrisalah,,Procurement Manager,emad_abuzaid@elrisaalah.com,+31 617413886,elrisaalah.com,https://elrisaalah.com,Public website crawl,unknown,email_verified,21.25,"2 Persoonskamer Saudi Airlines:
Amsterdam Jeddah –
Jeddah Amsterdam Makkah 15-02 t/m 22-02 Madinah 22-02 t/m 03-03 Makkah 03-03 t/m 28-03 € 4750 p.p."
Pakker for Umrah,,Procurement Manager,info@ditsamfund.dk,0001066408,ditsamfund.dk,https://ditsamfund.dk/kontakt,Public website crawl,legitimate_interest,email_verified,21.25,Kontakt Dansk Islamisk Trossamfunds sekretariatet. Skriv en mail info@ditsamfund.dk eller ring direkte på hovednummeret: 41 33 33 04. Vi bestræber os i at besvare alle skriftlige henvendelser hurtigst muligt.
Agence Hajj Omra Lyon,,Procurement Manager,contact@france-makkah.com,+33 6 26 96 64 38,france-makkah.com,https://www.france-makkah.com/agence-hajj-omra-lyon,Public website crawl,legitimate_interest,email_verified,21.25,Agence Hajj Omra Lyon
Agence Hajj Omra Lyon,,Procurement Manager,jeveuxunsiteweb.fr@gmail.com,+33 6 26 96 64 38,france-makkah.com,https://www.france-makkah.com/agence-hajj-omra-lyon,Public website crawl,unknown,email_verified,21.25,Agence Hajj Omra Lyon
Hadj en Umrah Vergelijken,,Procurement Manager,info@hadjenumrah.nl,+316 17420624,hadjenumrahvergelijken.nl,https://hadjenumrahvergelijken.nl/umrah,Public website crawl,legitimate_interest,email_verified,21.25,Bekijk Umrah 2026 prijzen. Een complete Umrah reis kost tussen de €1800 en €2500 per persoon. Umrah in de Ramadan of in April.
Hadj en Umrah Vergelijken,,Procurement Manager,info@hadjenumrahvergelijken.nl,+316 17420624,hadjenumrahvergelijken.nl,https://hadjenumrahvergelijken.nl/umrah,Public website crawl,legitimate_interest,email_verified,21.25,Bekijk Umrah 2026 prijzen. Een complete Umrah reis kost tussen de €1800 en €2500 per persoon. Umrah in de Ramadan of in April.
OMRA & HAJJ depuis la France,,Procurement Manager,hello@www.goodsafar.com,07 53 47 55 21,goodsafar.com,https://www.goodsafar.com,Public website crawl,legitimate_interest,email_verified,21.25,Bienvenue chez GOOD SAFAR
Agence Omra & Hajj à Bruxelles,,Procurement Manager,info@go2omra.be,+32 497 85 48 73,go2omra.be,https://www.go2omra.be,Public website crawl,legitimate_interest,email_verified,21.25,"Go2Omra, agence Omra & Hajj à Bruxelles, vous accompagne pour vos voyages 2025-2026 : vols, 5★, demi-pension & encadrement spirituel."
Agence Omra & Hajj à Bruxelles,,Procurement Manager,info@go2omra.be,+966 556 985 582,go2omra.be,https://www.go2omra.be/contact,Public website crawl,legitimate_interest,email_verified,21.25,Contactez-nous pour toutes questions ou informations.
Hajj Packages – ZamZam Hajj,,Procurement Manager,info@hajj.com.au,1300 730 693,hajj.com.au,https://hajj.com.au/packages,Public website crawl,legitimate_interest,email_verified,21.25,Hajj Packages
Hajj Packages – ZamZam Hajj,,Procurement Manager,info@uma.org.au,1300 730 693,hajj.com.au,https://hajj.com.au/packages,Public website crawl,legitimate_interest,email_verified,21.25,Hajj Packages
ZamZam Hajj,,Procurement Manager,info@hajj.com.au,0406 926 926,hajj.com.au,https://hajj.com.au/contact,Public website crawl,legitimate_interest,email_verified,21.25,Contact Us
ZamZam Hajj,,Procurement Manager,info@uma.org.au,0406 926 926,hajj.com.au,https://hajj.com.au/contact,Public website crawl,legitimate_interest,email_verified,21.25,Contact Us
Hajjochumra,,Procurement Manager,hajjochomra@gmail.com,070-4955657,hajjochumra.com,https://www.hajjochumra.com,Public website crawl,unknown,email_verified,21.25,"Välkommen till Hajjochumra.com, din expert på Hajj och Umrah-resor från Sverige. Upplev en personlig och andlig resa till Mekka och Medina med våra skräddarsydda paket, inklusive bekväma hotell och omfattande stöd under din resa. Planera din andliga färd med oss och försäkra dig om en minnesvärd och trygg pilgrimsfärd"
Hajjochumra,,Procurement Manager,hajjochomra@gmail.com,070-495 56 57,hajjochumra.com,https://www.hajjochumra.com/kontakt,Public website crawl,unknown,email_verified,21.25,Mail : hajjochomra@gmail.com
Hadj Omra Resor,,Procurement Manager,bokning@hajj.se,072- 890 73 34,hajj.se,http://hajj.se/kontakta-oss,Public website crawl,unknown,email_verified,21.25,"BEHÖVER DU HJÄLP

Kontakta oss nu! 
Behöver du hjälp? eller har du frågor och funderingar kring Omra eller Hadj? Tveka inte att höra av dig till oss, du kan alltid nå oss via telefon, mail eller komma och besöka oss på våra kontor, varmt"
Hajj Umrah Hub,,Procurement Manager,info@hajjumrahhub.com,571-800-0706 10,hajjumrahhub.com,https://www.hajjumrahhub.com/new-york-umrah-packages.html,Public website crawl,legitimate_interest,email_verified,21.25,"Book All-Inclusive New York Umrah Packages 2026 with flights, hotels near Haram, visas, and transport. Affordable, customized deals for families, groups, and solo pilgrims."
Hajjumrahhub,,Procurement Manager,info@hajjumrahhub.com,571-800-0706,hajjumrahhub.com,https://www.hajjumrahhub.com/contact-us.html,Public website crawl,legitimate_interest,email_verified,21.25,Contact Us
Hajj Umrah Services,,Procurement Manager,info@hajjumrahservices.co.uk,02) 038 921 821,hajjumrahservices.co.uk,https://hajjumrahservices.co.uk/leeds-umrah-packages,Public website crawl,legitimate_interest,email_verified,21.25,We have helped thousands of pilgrims fulfil their spiritual journey through leeds umrah packages. Enjoy special discounts on booking with us!
Hajj Umrah Services,,Procurement Manager,sales@hajjumrahservices.co.uk,02) 038 921 821,hajjumrahservices.co.uk,https://hajjumrahservices.co.uk/leeds-umrah-packages,Public website crawl,legitimate_interest,email_verified,21.25,We have helped thousands of pilgrims fulfil their spiritual journey through leeds umrah packages. Enjoy special discounts on booking with us!
Hajj Umrah Package,,Procurement Manager,info@hajjumrahpackage.com,020-8124-8088 4,hajjumrahpackage.com,https://www.hajjumrahpackage.com,Public website crawl,legitimate_interest,email_verified,21.25,"Umrah Packages for individual pilgrims, families, kids, and senior citizens from UK. Book all-inclusive Umrah deals with flights, hotels, visas, and transport."
Hajj Umrah Package,,Procurement Manager,info@hajjumrahpackage.com,442081248088,hajjumrahpackage.com,https://www.hajjumrahpackage.com/contact-us.html,Public website crawl,legitimate_interest,email_verified,21.25,Cheap Hajj Umrah Packages
Hilal Hajj and Umrah,,Procurement Manager,hilalhajj@gmail.com,75074 (945) 900-2333,hilalhajj.com,https://hilalhajj.com,Public website crawl,unknown,email_verified,21.25,"We strive to provide the best services to the guests of Allah. At Hilal Hajj & Umrah, our goal is to maintain, and exceed the highest quality  services offered by any licensed Hajj Agent in the United States. For over 20 years, we established ourselves as a market leaders in offering exceptional Hajj packages. Our uniq"
Hilal Hajj and Umrah,,Procurement Manager,zehra@hilalhajj.com,75074 (945) 900-2333,hilalhajj.com,https://hilalhajj.com,Public website crawl,unknown,email_verified,21.25,"We strive to provide the best services to the guests of Allah. At Hilal Hajj & Umrah, our goal is to maintain, and exceed the highest quality  services offered by any licensed Hajj Agent in the United States. For over 20 years, we established ourselves as a market leaders in offering exceptional Hajj packages. Our uniq"
Huda Umrah,,Procurement Manager,hudaumrahservice@gmail.com,0434322656,hudaumrah.com.au,https://hudaumrah.com.au,Public website crawl,unknown,email_verified,21.25,Huda Umrah Service
International Hajj,,Procurement Manager,info@internationalhajj.com,10001 212-967-9797,internationalhajj.com,https://internationalhajj.com/umrah-packages,Public website crawl,legitimate_interest,email_verified,21.25,"Book Umrah packages from USA with flights, Umrah Visa, hotels, ground transportation, and Ziyarat tours. Call us now and book instantly."
Islamic Center of Maryland,,Procurement Manager,icmadmin@icomd.org,240) 715 1018,icomd.org,https://icomd.org/umrah,Public website crawl,unknown,email_verified,21.25,ICM Annual Umrah
Karawan Hajj & Umrah,,Procurement Manager,caravanhajj@hotmail.com,+1 (732) 225-4050 259,karwanhajj.com,https://karwanhajj.com/services/umrah-packages,Public website crawl,unknown,email_verified,21.25,Umrah Packages
Karawan Hajj & Umrah,,Procurement Manager,khajjusa@hotmail.com,+1 (732) 225-4050 259,karwanhajj.com,https://karwanhajj.com/services/umrah-packages,Public website crawl,unknown,email_verified,21.25,Umrah Packages
Kaabah Tours,,Procurement Manager,info@kaabahtours.com,437) 826-7786,kaabahtours.com,https://www.kaabahtours.com/toronto-umrah-packages.html,Public website crawl,legitimate_interest,email_verified,21.25,"Book Umrah packages from Toronto with Kaabah Tours. All-inclusive 3, 4 & 5 star packages with flights, visa, hotels & transport. Trusted Canadian agency."
Labbaik Hajj Umrah,,Procurement Manager,info@labbaikhajjumrah.co.uk,02038656950,labbaikhajjumrah.co.uk,https://www.labbaikhajjumrah.co.uk/umrah-packages-liverpool,Public website crawl,legitimate_interest,email_verified,21.25,"Umrah Packages Liverpool 2026 with special deals from £810 - Enjoy premium hotels, best flights, visa, 24/7 support & transport. Choose Labbaik Hajj Umrah."
Kasbah Holidays,,Procurement Manager,info@kasbahholidays.com,514) 225-3713,kasbahholidays.com,https://kasbahholidays.com,Public website crawl,legitimate_interest,email_verified,21.25,Kasbah Holidays est une agence de voyage à Montréal spécialiste du pèlerinage offrant un séjour personnalisé et des forfaits Hajj et Omra.
Last Stop Jannah,,Procurement Manager,admin@laststopjannah.com.au,+61 475 019 872,laststopjannah.com.au,https://laststopjannah.com.au/packages,Public website crawl,unknown,email_verified,21.25,"Explore 5-star Umrah packages from Melbourne for individuals, couples and youth groups. Limited spots for 2025."
London Hajj & Umrah,,Procurement Manager,sales@london-travels.co.uk,020 7993 0104,london-hajj-umrah.com,https://london-hajj-umrah.com/about-us,Public website crawl,legitimate_interest,email_verified,21.25,About Us
Madani Hajj,,Procurement Manager,mail@madanihajj.com,0203 581 2112,madanihajj.com,https://madanihajj.com,Public website crawl,unknown,email_verified,21.25,"The Prophet ﷺ said, “Whoever performs Hajj to this House and refrains from lewdness and sin returns as pure as on the day his mother gave birth to him.” (Bukhari & Muslim)"
Makkah Tour,,Procurement Manager,info@makkahtour.co.uk,0203-195-8700,makkahtour.co.uk,https://www.makkahtour.co.uk/umrah-packages-liverpool.php,Public website crawl,legitimate_interest,email_verified,21.25,"Book Liverpool Umrah Packages with flights, accommodations, visa support, and local transport. Limited availability – Grab your spot today!"
Makkah Tour,,Procurement Manager,complaint@makkahtour.co.uk,0203-195-8700,makkahtour.co.uk,https://www.makkahtour.co.uk/contact-us.php,Public website crawl,unknown,email_verified,21.25,"Contact us for cheapest hajj and Umrah packages. Call us for instant booking of Hajj, Umrah and hotels in Makkah and Medina. 020-195-8700."
madinatours.co.uk,,Procurement Manager,info@madinatours.co.uk,+44 7880 473440,madinatours.co.uk,https://madinatours.co.uk/st_location/sheffield,Public website crawl,legitimate_interest,email_verified,21.25,"Find the best Umrah & Hajj packages from Sheffield. Affordable deals, flights, and luxury stays. Book your spiritual journey today!"
Manitoba Dawah Center,,Procurement Manager,manitobadc@gmail.com,204 219 9100 368,manitobadc.com,https://manitobadc.com,Public website crawl,unknown,email_verified,21.25,March 20th 2026 Marks Eid Al-Fitr First Prayer at 8:30AM
Miqat Hajj and Umrah trips,,Procurement Manager,info@miqat.eu,+49 176 23633672,miqat.eu,https://www.miqat.eu/en,Public website crawl,legitimate_interest,email_verified,21.25,"Exclusive HAJJ and UMRAH trips from Germany. Miqat's focus: style, outstanding service and first-class hotels such as the Mecca Clock Tower."
Hajj och Umrah,,Procurement Manager,info@mforesor.com,46 010 300 10 70,mforesor.com,https://www.mforesor.com/kontakta-oss,Public website crawl,legitimate_interest,email_verified,21.25,Behöver du hjälp med något specifikt eller har du några frågor som inte har besvarat på hemsidan är du välkommen att kontakta oss.
https,,Procurement Manager,info@mashaallahtrips.com,+44 2045 557 373 3,mashaallahtrips.com,https://mashaallahtrips.com/umrah/luton,Public website crawl,legitimate_interest,email_verified,21.25,Book cheap Luton Umrah packages with the UK’s most trusted agents. Perfect offers & affordable deals starting from £775. Book now.
