company,contact_name,role,email,phone,domain,source_url,source_label,consent_status,verification_status,overall_score,raw_text_snippet
"Medin Voyages, Agence Omra & Hajj 2026",,Procurement Manager,contact@medinvoyages.com,+33 (0)6 51 50 64 86,medinvoyages.com,https://medinvoyages.com,Public website crawl,legitimate_interest,email_verified,21.25,"Medin Voyages est une agence de voyages spécialisée dans l'organisation de Omras, toute l'année, au départ de Paris."
MK Hajj & Umrah Tours,,Procurement Manager,info@mktours.co.nz,021 025 32786,mkhajjumrah.co.nz,https://mkhajjumrah.co.nz,Public website crawl,legitimate_interest,email_verified,21.25,Premium Hajj & Umrah Tours
Department of Hajj And Umra,,Procurement Manager,hajjandumra@muscoosa.org,+27 83 749 8338,muscoosa.org,https://muscoosa.org/hajjandumra/contact-us,Public website crawl,unknown,email_verified,21.25,Contact Us
Department of Hajj And Umra,,Procurement Manager,qurban@muscoosa.org,+27 83 749 8338,muscoosa.org,https://muscoosa.org/hajjandumra/contact-us,Public website crawl,unknown,email_verified,21.25,Contact Us
Mishkaat Norge AS,,Procurement Manager,kundeservice@mishkaat.no,+47 91 22 11 00,mishkaat.no,https://mishkaat.no,Public website crawl,unknown,email_verified,21.25,Mishkaat Norge er et av Norges ledende tilbyder av reiser til Saudi Arabia i form av Umrah eller Hajj. Vi kan også tilby skreddersydde pakker etter dine behov
Mishkaat Norge AS,,Procurement Manager,post@mishkaat.no,+47 91 22 11 00,mishkaat.no,https://mishkaat.no,Public website crawl,unknown,email_verified,21.25,Mishkaat Norge er et av Norges ledende tilbyder av reiser til Saudi Arabia i form av Umrah eller Hajj. Vi kan også tilby skreddersydde pakker etter dine behov
Muslimdirectory,,Procurement Manager,info@muslimdirectory.co.nz,38-9009-0503270-00,muslimdirectory.co.nz,https://muslimdirectory.co.nz/listing-feature/umrah-packages,Public website crawl,legitimate_interest,email_verified,21.25,Umrah Packages
Pilgrimage to Saudi Arabia (Umrah and Hajj),,Procurement Manager,consular.riyadh@mfa.no,+966 (0)11 488 0854,norway.no,https://www.norway.no/en/saudi-arabia/norway-sa/pilgrimage-to-saudi-arabia-umrah-and-hajj,Public website crawl,unknown,email_verified,21.25,Services and information
Pilgrimage to Saudi Arabia (Umrah and Hajj),,Procurement Manager,emb.riyadh@mfa.no,+966 (0)11 488 0854,norway.no,https://www.norway.no/en/saudi-arabia/norway-sa/pilgrimage-to-saudi-arabia-umrah-and-hajj,Public website crawl,unknown,email_verified,21.25,Services and information
Pilgrimage to Saudi Arabia (Umrah and Hajj),,Procurement Manager,info.norwayksa@vfshelpline.com,+966 (0)11 488 0854,norway.no,https://www.norway.no/en/saudi-arabia/norway-sa/pilgrimage-to-saudi-arabia-umrah-and-hajj,Public website crawl,unknown,email_verified,21.25,Services and information
Pilgrimage to Saudi Arabia (Umrah and Hajj),,Procurement Manager,ahmed.al-athari@mfa.no,+966 (0)11 488 0854,norway.no,https://www.norway.no/en/saudi-arabia/norway-sa/about-embassy,Public website crawl,unknown,email_verified,21.25,Services and information
Pilgrimage to Saudi Arabia (Umrah and Hajj),,Procurement Manager,archive.riyadh@mfa.no,+966 (0)11 488 0854,norway.no,https://www.norway.no/en/saudi-arabia/norway-sa/about-embassy,Public website crawl,unknown,email_verified,21.25,Services and information
Pilgrimage to Saudi Arabia (Umrah and Hajj),,Procurement Manager,heba.deeb@mfa.no,+966 (0)11 488 0854,norway.no,https://www.norway.no/en/saudi-arabia/norway-sa/about-embassy,Public website crawl,unknown,email_verified,21.25,Services and information
Mithas Travel,,Procurement Manager,info@mithastravel.co.za,+27 21 018 0530,mithastravel.co.za,https://www.mithastravel.co.za/middle-east/umrah,Public website crawl,legitimate_interest,email_verified,21.25,"A journey to the holy city of Mecca in Saudi Arabia. Unlike Hajj, Umrah can be performed at any time of the year with our Umrah packages."
Mithas Travel,,Procurement Manager,ahmed@mithastravel.co.za,+27 21 018 0530,mithastravel.co.za,https://www.mithastravel.co.za/middle-east/umrah,Public website crawl,unknown,email_verified,21.25,"A journey to the holy city of Mecca in Saudi Arabia. Unlike Hajj, Umrah can be performed at any time of the year with our Umrah packages."
One More Holiday,,Procurement Manager,info@onemoreholiday.com,+1 (571) - 484 3683 54,onemoreholiday.com,https://onemoreholiday.com/city/umrah-packages-from-dallas,Public website crawl,legitimate_interest,email_verified,21.25,"Explore Umrah packages from Dallas with One More Holiday. Compare deals, customise your package, and get expert support for your journey."
Omra pour tous,,Procurement Manager,contact@omrapourtous.com,+33) 04 84 89 65 51 15,omrapourtous.com,https://omrapourtous.com,Public website crawl,legitimate_interest,email_verified,21.25,Ariane Voyages vous propose sur son site omrapourtous.com des forfaits Omra 2026 et 2027 pas chers avec une agence agréée
Pelerin Hajj,,Procurement Manager,pelerinhajj@gmail.com,09 81 10 86 15,pelerinhajj.com,https://pelerinhajj.com,Public website crawl,unknown,email_verified,21.25,"Omra 2026-2027 au départ de Paris, Marseille, Lyon, Bruxelles. Omra pas chère : découvrez nos meilleurs forfaits. Réservez vite au 09 81 10 86 15."
Plan Your Umrah,,Procurement Manager,sales@planyourumrah.co.uk,0203 376 7604,planyourumrah.co.uk,https://planyourumrah.co.uk/umrah-packages-luton,Public website crawl,legitimate_interest,email_verified,21.25,"Book cheap Umrah packages Luton 2025. Includes flights, visa, hotels, transportation, and more. Ideal for groups, families, couples, and women."
Plan Your Umrah,,Procurement Manager,sales@planyourumrah.co.uk,+44 7557 638317,planyourumrah.co.uk,https://planyourumrah.co.uk/contact-us,Public website crawl,legitimate_interest,email_verified,21.25,Contact us for personalized assistance with your Umrah and Hajj services in the UK. We are here to help you every step of the way.
qiblatain.com,,Procurement Manager,info@qiblatain.com,+19145200581,qiblatain.com,https://www.qiblatain.com/detroit-umrah-packages.html,Public website crawl,legitimate_interest,email_verified,21.25,"Explore budget-friendly Umrah deals from Detroit with Qiblatain USA. 10+ years of experience, complete packages, and expert support. Women-only groups are available."
Rawda Tours Belgium,,Procurement Manager,info@rawdatours.be,+32 492 475 686,rawdatours.be,https://www.rawdatours.be/contacteer-ons,Public website crawl,legitimate_interest,email_verified,21.25,"Rawda Tours Belgium
https://www.rawdatours.be
Contacteer ons"
Umrah Package Archive,,Procurement Manager,info@sadattravel.co.uk,01254 368193 87,sadathajjandumrah.com,https://sadathajjandumrah.com/umrah-packages,Public website crawl,legitimate_interest,email_verified,21.25,Umrah Package
Hajj & Umrah Services,,Procurement Manager,info@shahtravel.co.uk,078664 10109,shahtravel.co.uk,https://www.shahtravel.co.uk,Public website crawl,legitimate_interest,email_verified,21.25,Trusted Hajj & Umrah provider in Leeds since 2003 | We have helped thousands of pilgrims fulfil their spiritual journey. Book your tour with us today!
Haider Travel,,Procurement Manager,hello@sdgzero.net,07428732469,sdgzero.com,https://sdgzero.com/about-us,Public website crawl,legitimate_interest,email_verified,21.25,SDG:Zero helps UK SMEs grow by aligning with the UN Sustainable Development Goals while strengthening local SEO and digital visibility.
Sunnah Foundation Hajj & Umrah,,Procurement Manager,labbayk@sunnahhajj.com,+1300 850 250,sunnahhajj.com,https://sunnahhajj.com,Public website crawl,unknown,email_verified,21.25,"The Journey Of A Lifetime.
Hajj & Umrah Packages"
Tawhid Travel,,Procurement Manager,info@tawhidvoyages.be,1014169642,tawhid-travel.be,https://www.tawhid-travel.be,Public website crawl,legitimate_interest,email_verified,21.25,TAWHID VOYAGES est une Agence de Voyages spécialisée dans l'organisation du Hajj et de la Omra en groupe ou sur mesure.
Tawhid Travel,,Procurement Manager,hajj@tawhidvoyages.be,1014169642,tawhid-travel.be,https://www.tawhid-travel.be/contact.php,Public website crawl,unknown,email_verified,21.25,TAWHID VOYAGES est une Agence de Voyages spécialisée dans l'organisation du Hajj et de la Omra en groupe ou sur mesure.
Umrah & Hadj Pakketten 2026,,Procurement Manager,contact@tayseer.nl,+31 40 750 2534,tayseer.nl,https://www.tayseer.nl,Public website crawl,legitimate_interest,email_verified,21.25,"Boek uw betaalbare Umrah- of Hadj-reis vanuit Nederland & BelgiÃ« met Sunnah-gerichte begeleiding, kwalitatieve hotels en betrouwbare vliegtuigmaatschappijen. Reis zorgeloos naar Mekka en Medina."
Tarik Ben Ziad,,Procurement Manager,info@tarikbenziad.com,+49 173 6074894,tarikbenziad.com,https://tarikbenziad.com,Public website crawl,legitimate_interest,email_verified,21.25,"Im Jahr 2005 wurde die Tarik Ben Ziad Company gegründet, um von Deutschland aus Hadsch- und Umrah-Reisen zu den ehrenvollsten Orten der Welt, der Großen Moschee und der Prophetenmoschee, zu organisieren."
Tawfiq Hajj,,Procurement Manager,hajj@tawfiq.co.za,+27 71 4688 444,tawfiq.co.za,https://www.tawfiq.co.za/hajj-packages,Public website crawl,unknown,email_verified,21.25,
Taqwa Tours LTD,,Procurement Manager,info@taqwatours.co.uk,02071128005 4,taqwatours.co.uk,https://taqwatours.co.uk/umrah-packages-from-glasgow,Public website crawl,legitimate_interest,email_verified,21.25,"Book cheap Umrah package from Glasgow. 5-star for 7-night Umrah in £875/pp 10 N:£975. 3-5 stars 7,14 & 21 days. Book now for £49."
Taqwa Tours LTD,,Procurement Manager,info@taqwatours.co.uk,02071128005,taqwatours.co.uk,https://taqwatours.co.uk/about-us,Public website crawl,legitimate_interest,email_verified,21.25,About us
trips.pk,,Procurement Manager,info@trips.pk,+92-3104-449-553,trips.pk,https://www.trips.pk/umrah/germany,Public website crawl,legitimate_interest,email_verified,21.25,Page Not Found
De Trekvogel,,Procurement Manager,info@trekvogel.be,+32 3 235 76 14,trekvogel.be,https://trekvogel.be,Public website crawl,legitimate_interest,email_verified,21.25,"De Trekvogel info@trekvogel.be +32 3 235 76 14 Carnotstraat 129, 2060 Antwerpen, Belgium Home Umrah Ramadan Umrah Pakketten April Umrah Individual Umrah Reservation Hajj Tours Rotterdam Japan Safari Honeymoon Diensten Hajj & Umrah Vliegtickets Hotels Autoverhuur Stedentrips Resort-/All-inclusivevakanties B2B-Netwerk Co"
De Trekvogel,,Procurement Manager,info@trekvogel.be,+32 2 356 50 33,trekvogel.be,https://trekvogel.be/contact,Public website crawl,legitimate_interest,email_verified,21.25,Contact
Umra Hajj Advisor,,Procurement Manager,info@om-travels.com,3306 60 64 10 11,umrahajjadvisor.com,https://umrahajjadvisor.com/single-location-2/paris,Public website crawl,legitimate_interest,email_verified,21.25,Paris - Find the Best Trusted Hajj & Umrah Agency Near You All Agencies Dashboard All Categories All Locations Blog Forum About Us Contact Us Account × Username or Email Address Password Remember Me Recover Password Log In Don't have an account? Sign Up Lost your password? Please enter your email address. You will rece
Umra Hajj Advisor,,Procurement Manager,amg0215@hotmail.com,3306 60 64 10 11,umrahajjadvisor.com,https://umrahajjadvisor.com/single-location-2/paris,Public website crawl,unknown,email_verified,21.25,Paris - Find the Best Trusted Hajj & Umrah Agency Near You All Agencies Dashboard All Categories All Locations Blog Forum About Us Contact Us Account × Username or Email Address Password Remember Me Recover Password Log In Don't have an account? Sign Up Lost your password? Please enter your email address. You will rece
Umra Hajj Advisor,,Procurement Manager,fab.voyages75@gmail.com,3306 60 64 10 11,umrahajjadvisor.com,https://umrahajjadvisor.com/single-location-2/paris,Public website crawl,unknown,email_verified,21.25,Paris - Find the Best Trusted Hajj & Umrah Agency Near You All Agencies Dashboard All Categories All Locations Blog Forum About Us Contact Us Account × Username or Email Address Password Remember Me Recover Password Log In Don't have an account? Sign Up Lost your password? Please enter your email address. You will rece
Umra Hajj Advisor,,Procurement Manager,hassanimzil@gmail.com,3306 60 64 10 11,umrahajjadvisor.com,https://umrahajjadvisor.com/single-location-2/paris,Public website crawl,unknown,email_verified,21.25,Paris - Find the Best Trusted Hajj & Umrah Agency Near You All Agencies Dashboard All Categories All Locations Blog Forum About Us Contact Us Account × Username or Email Address Password Remember Me Recover Password Log In Don't have an account? Sign Up Lost your password? Please enter your email address. You will rece
Umra Hajj Advisor,,Procurement Manager,kdg.legal@gmail.com,3306 60 64 10 11,umrahajjadvisor.com,https://umrahajjadvisor.com/single-location-2/paris,Public website crawl,unknown,email_verified,21.25,Paris - Find the Best Trusted Hajj & Umrah Agency Near You All Agencies Dashboard All Categories All Locations Blog Forum About Us Contact Us Account × Username or Email Address Password Remember Me Recover Password Log In Don't have an account? Sign Up Lost your password? Please enter your email address. You will rece
Customized Umrah Package Builder,,Procurement Manager,support@umrahcompanions.com,+92 333 3862347,umrahcompanions.com,https://umrahcompanions.com/contact-us,Public website crawl,legitimate_interest,email_verified,21.25,"Get Umrah packages for Hotels, Transport, Flights Visa bookings and much more as per your needs. We are your companion in the spiritual journey of Umrah."
Customized Umrah Package Builder,,Procurement Manager,johndoe@email.com,+92 333 3862347,umrahcompanions.com,https://umrahcompanions.com/contact-us,Public website crawl,unknown,email_verified,21.25,"Get Umrah packages for Hotels, Transport, Flights Visa bookings and much more as per your needs. We are your companion in the spiritual journey of Umrah."
UmrahDirect,,Procurement Manager,info@umrahdirect.co.za,+27 21 555 2334,umrahdirect.co.za,https://umrahdirect.co.za/contact,Public website crawl,legitimate_interest,email_verified,21.25,Get in Touch
Umrah Dost,,Procurement Manager,info@umrahdost.com,+92 315 946 4767,umrahdost.com,https://umrahdost.com/umrah-packages-france-2025,Public website crawl,legitimate_interest,email_verified,21.25,"A seamless Umrah journey from France with Umrah Dost. Choose from 3, 4, or 5 star packages, including flights, hotels, and transport."
Umrah Mubarak,,Procurement Manager,info@umrahmubarak.co.uk,+44 20 3983 3065,umrahmubarak.co.uk,https://umrahmubarak.co.uk/umrah-packages/coventry,Public website crawl,legitimate_interest,email_verified,21.25,"Book from our Umrah Packages from Coventry, UK, in December 2025! Customize All-Inclusive deals with 3, 4, and 5-star options, including flights and visa, to get the cheapest OFF-PEAK rates"
Umrah International,,Procurement Manager,info@umrahinternational.com,214) 689-8139,umrahinternational.com,https://umrahinternational.com,Public website crawl,legitimate_interest,email_verified,21.25,"Umrah International we are dedicated to making the sacred journey of Umrah a seamless and unforgettable experience for our fellow Muslims. Based in America, we take pride in being your trusted partner in providing comprehensive Umrah solutions, including airline tickets, visas, and tour packages. Umrah International -"
Worldwide Travel Tour Ism,,Procurement Manager,info@worldwidetraveltourism.nz,+91 9711198463,worldwidetraveltourism.nz,https://www.worldwidetraveltourism.nz/umrah/packages-from-auckland,Public website crawl,legitimate_interest,email_verified,21.25,"Most popular and recommended Umrah packages from Auckland, NewZealand. Get all-inclusive Umrah packages with direct flights, hotels in Mecca, Medina"
Umrah Packages UK,,Procurement Manager,info@umrahpackagesuk.com,+44 7404 037532,umrahpackagesuk.com,https://umrahpackagesuk.com/umrah-packages-leicester,Public website crawl,legitimate_interest,email_verified,21.25,"Book all-inclusive Umrah Packages Leicester starting @ £250 with 3-5 star hotels near haram, Visa, flights, transport & ziyarat."
Alalaa Travel Hajj and Umrah Tours,,Procurement Manager,info@alalaatravel.com,,alalaatravel.com,https://www.alalaatravel.com/site/about.php,Public website crawl,legitimate_interest,email_verified,20.70,Alalaa Travel is your source for Hajj travel from the USA. Check out our comprehensive 2022 packages for Hajj and Umrah Tours
EELAFHAJJ,,Procurement Manager,ansergul@gmail.com,,leedshajj.com,https://leedshajj.com,Public website crawl,unknown,email_verified,20.25,"We don’t just arrange travel; we ensure you are spiritually prepared. From scholar-led training sessions, easy-to-follow guides, to heartfelt duʿās and"
The Travel Daily,,Procurement Manager,team@thetraveldaily.co.uk,,thetraveldaily.co.uk,https://www.thetraveldaily.co.uk/article/2024/03/28/three-best-travel-agencies-umrah-tours-manchester-affordable-packages,Public website crawl,legitimate_interest,email_verified,19.71,"Umrah is a spiritual journey which requires complete peace of mind. Also, the right travel agency can make all the difference by providing a seamless experience. Here are three travel agencies that provide affordable and tailored solutions for your Umrah journey, all departing from Manchester. You can start your journe"
Bismillah Travels,,Procurement Manager,info@bismillahtravels.ca,,bismillahtravels.ca,http://www.bismillahtravels.ca,Public website crawl,legitimate_interest,email_verified,18.92,"Explore trusted Umrah & Hajj packages with Bismillah Travels. Hassle-free services, expert guidance, and spiritual journeys you can rely on."
Hajj & Umrah Travel Agency,,Procurement Manager,,+1 909 910 6650,happyumrah.com,https://happyumrah.com,Public website crawl,unknown,phone_verified,16.75,Happy Umrah offers affordable umrah packages for 2025. Our pricing & 24/7 customer support make us top travel agency in U.S for umrah packages
Taqwa Tours,,Procurement Manager,info@taqwatours.us,,taqwatours.us,https://taqwatours.us/umrah-packages/dallas,Public website crawl,legitimate_interest,email_verified,16.25,"Efficient, affordable Umrah packages from Dallas with visa, flights, and halal hotels"
Bismillah Hajj and Umrah Services,,Procurement Manager,bismillahhajj2000@hotmail.com,,bismillahhajj.com,https://bismillahhajj.com,Public website crawl,unknown,email_verified,16.25,Home - Bismillah Hajj and Umrah Services 416.883.9693 bismillahhajj2000@hotmail.com Home About Us Umrah Packages November Umrah December Umrah Hajj 2025 How to Register Important Information Important Places Common Questions Articles to Pack Arabic Words to Know Seminar Details Hajj Visa Requirements Contact Us Select
Departures with Verified Imams,,Procurement Manager,support@go-together.co,,go-together.co,https://www.go-together.co/en-US/umrah-packages/from-tampa-fl,Public website crawl,legitimate_interest,email_verified,16.25,Book authentic Umrah packages departing from Tampa. Join verified local imams for your spiritual journey to Mecca and Medina.  Muslims served.
GoTogether,,Procurement Manager,investors@go-together.co,,go-together.co,https://www.go-together.co/en-US/about,Public website crawl,unknown,email_verified,16.25,"Learn about GoTogether, the pioneering Saudi tech startup connecting Muslims with trusted leaders for authentic Umrah and spiritual journeys."
Hajj & Umrah Trips,,Procurement Manager,info@hajjandumrahtrips.com,,hajjandumrahtrips.com,https://hajjandumrahtrips.com/umrah-packages/chicago,Public website crawl,legitimate_interest,email_verified,16.25,Umrah Packages From Chicago
Hajj Umrah Info,,Procurement Manager,info@hajjumrahinfo.co.za,,hajjumrahinfo.co.za,https://www.hajjumrahinfo.co.za,Public website crawl,legitimate_interest,email_verified,16.25,"Browse and compare Hajj and Umrah packages in South Africa. Compare by operator, stay length, hotel, package features. Find the perfect package to suit your needs."
Hajj/Umrah – ICC – Islamic Culture Centre,,Procurement Manager,hajj@islamic.no,,islamic.no,https://www.islamic.no/hajjumrah,Public website crawl,unknown,email_verified,16.25,Hajj/Umrah
Hajj/Umrah – ICC – Islamic Culture Centre,,Procurement Manager,umrah@islamic.no,,islamic.no,https://www.islamic.no/hajjumrah,Public website crawl,unknown,email_verified,16.25,Hajj/Umrah
Hajj/Umrah – ICC – Islamic Culture Centre,,Procurement Manager,info@islamic.no,,islamic.no,https://www.islamic.no/kontakt-oss,Public website crawl,legitimate_interest,email_verified,16.25,Kontakt oss
Hajj/Umrah – ICC – Islamic Culture Centre,,Procurement Manager,besok@islamic.no,,islamic.no,https://www.islamic.no/kontakt-oss,Public website crawl,unknown,email_verified,16.25,Kontakt oss
Hajj/Umrah – ICC – Islamic Culture Centre,,Procurement Manager,ikhlaq.ahmad@islamic.no,,islamic.no,https://www.islamic.no/kontakt-oss,Public website crawl,unknown,email_verified,16.25,Kontakt oss
Hajj/Umrah – ICC – Islamic Culture Centre,,Procurement Manager,pressekontakt@islamic.no,,islamic.no,https://www.islamic.no/kontakt-oss,Public website crawl,unknown,email_verified,16.25,Kontakt oss
Hajj/Umrah – ICC – Islamic Culture Centre,,Procurement Manager,vigsel@islamic.no,,islamic.no,https://www.islamic.no/kontakt-oss,Public website crawl,unknown,email_verified,16.25,Kontakt oss
Luton umrah Tours,,Procurement Manager,webmaster@lutonumrahtours.com,,lutonumrahtours.com,https://lutonumrahtours.com/cgi-sys/suspendedpage.cgi,Public website crawl,unknown,email_verified,16.25,Account Suspended Account Suspended This Account has been suspended. Contact your hosting provider for more information.
QAiD UMRAH,,Procurement Manager,post@qaid.no,,qaid.no,https://www.qaid.no/umrah,Public website crawl,unknown,email_verified,16.25,QAiD UMRAH PAKKEREISER
Sunnah Hajj,,Procurement Manager,labbayk@sunnahhajj.com,,sunnahhajj.com,https://sunnahhajj.com/about,Public website crawl,unknown,email_verified,16.25,About
Umrah Companions,,Procurement Manager,johndoe@email.com,,umrahcompanions.com,https://umrahcompanions.com/umrah_packages_canada,Public website crawl,unknown,email_verified,16.25,Book your Umrah packages for 2026 from Canada easily. We offer Affordable and convenient options designed to meet your needs.  Reserve your spot today!
Club Travel,,Procurement Manager,,0289 57 57 909,clubtravel.ie,https://www.clubtravel.ie/contact-us,Public website crawl,unknown,phone_verified,15.56,"Travel Agents Ireland, Travel Agents Dublin, Irish Travel Agents, Ireland Travel Agency, Dublin Travel Agency"
Approved Hajj Travel Agents,,Procurement Manager,,00971506506468,hajinformation.com,https://www.hajinformation.com/main/n72u01.htm,Public website crawl,unknown,phone_verified,15.56,USA - Approved Hajj Travel Agents
A Travel Agent In Moortown,,Procurement Manager,,07866 410109,yorkshire.com,https://www.yorkshire.com/moortown/services/travel-agents/shah-travel-hajj-umrah,Public website crawl,unknown,phone_verified,14.29,"<p>Shah Travel Hajj & Umrah is a well-regarded travel agency situated in Moortown, Leeds, specialising in expertly organised Hajj and Umrah pilgrimages. Wi..."
Hajj Umrah Travel Agents in London UK,,Procurement Manager,,0203-195-8700 24,7-continentstravel.co.uk,https://www.7-continentstravel.co.uk/hajj-umrah,Public website crawl,unknown,phone_verified,14.17,We are reliable hajj umrah travel agent in London 7 continents travel brings exclusive hajj umrah packages deals. Book now special hajj and umrah packages.
Hajj Umrah travel agents from UK,,Procurement Manager,,+442071839663,perfectumrah.us,https://perfectumrah.us/hajj-package-from-newark-new-jersey.php,Public website crawl,unknown,phone_verified,14.02,Looking for Hajj Packages from Newark New Jersey? Book with one of most trusted agent. We Deliver Best Value in lowest Prices.
"Alhijra Travel, Rotterdam",,Procurement Manager,,036 820 0226 4 (10,tratratravel.nl,https://tratratravel.nl/nl-nl/i/6388-alhijra-travel,Public website crawl,unknown,phone_verified,14.02,"Ontdek alle informatie over Alhijra Travel op TraTraTravel Nederland, de grootste Reisbureaus directory: contactgegevens, openingstijden en klantbeoordelingen."
Al Eimaan Travel,,Procurement Manager,,076 388 4133,aleimaantravel.co.za,https://aleimaantravel.co.za,Public website crawl,unknown,phone_verified,13.92,Al Eimaan Travel
IV Travel,,Procurement Manager,,087 374 5622 62,ivtravel.org,https://ivtravel.org,Public website crawl,unknown,phone_verified,13.92,Home
Hajj Umrah travel agents from UK,,Procurement Manager,,+442071835226,umrahpackagescanada.com,https://www.umrahpackagescanada.com,Public website crawl,unknown,phone_verified,13.86,"Book Economy to 5Star Umrah Packages Canada with Most Trusted Umrah Company. We have served more than 10,000 pilgrims and earned 5 Star Reviews."
Reaa Travel and Tours Inc,,Procurement Manager,,+1 (431) 997-3070,reaatravels.com,https://reaatravels.com,Public website crawl,unknown,phone_verified,13.50,Reaa Travel and Tours Inc
Sky Direct Travel,,Procurement Manager,,01204 665 668,skydirecttravel.co.uk,https://skydirecttravel.co.uk/locations/leicester,Public website crawl,unknown,phone_verified,13.50,Leicester
Sara International Travel,,Procurement Manager,,+1 718 848 1222 166,sarainternationaltravel.com,https://sarainternationaltravel.com/contact,Public website crawl,unknown,phone_verified,13.50,Contact Sara International Travel
USA Best Hajj and Umrah Travel Agency,,Procurement Manager,,929)-833-1717,alhateemtours.com,https://www.alhateemtours.com,Public website crawl,unknown,phone_verified,13.22,"Plan your Hajj and Umrah with AlHateem Tours, a trusted Islamic travel agency in the USA, for affordable services and seamless pilgrimage experiences."
Amax Travel,,Procurement Manager,,+966 59 288 315 2255,amaxtravel.ca,https://www.amaxtravel.ca/contact,Public website crawl,unknown,phone_verified,13.17,Send us a message
