company,contact_name,role,email,phone,domain,source_url,source_label,consent_status,verification_status,overall_score,raw_text_snippet
The Travel Registry,,Procurement Manager,admin@thetravelregistry.com,+447883412335,thetravelregistry.com,https://thetravelregistry.com,Public website crawl,unknown,email_verified,30.13,"Discover tailored travel experiences with The Travel Registry. Our expert team offers Umrah packages, holiday getaways, international flights, hotel bookings, and visa assistance. Enjoy competitive pricing and exceptional service for seamless and unforgettable travel experiences."
daralharamtravels.co.uk,,Procurement Manager,info@daralharamtravels.co.uk,0203 355 8850 65,daralharamtravels.co.uk,https://daralharamtravels.co.uk,Public website crawl,legitimate_interest,email_verified,29.17,"Explore Umrah & Hajj packages at Dar Al Haram Travels Agency UK. Enjoy personalized services, affordable pricing & expert support for your journey."
daralharamtravels.co.uk,,Procurement Manager,info@qarlharamtravels.co.uk,0203 355 8850 65,daralharamtravels.co.uk,https://daralharamtravels.co.uk,Public website crawl,legitimate_interest,email_verified,29.17,"Explore Umrah & Hajj packages at Dar Al Haram Travels Agency UK. Enjoy personalized services, affordable pricing & expert support for your journey."
Crest Travel,,Procurement Manager,info@cresttravel.co.za,031 303 2028,cresttravel.co.za,https://cresttravel.co.za/site,Public website crawl,legitimate_interest,email_verified,28.27,For more information on Covid-19 click here
🕋 Medina Travel,,Procurement Manager,info@mdinatravel.be,+32 494 31 30 00,medinatravel.be,https://medinatravel.be/about.php,Public website crawl,legitimate_interest,email_verified,28.24,Medina Travel
Dua Travels,,Procurement Manager,sales@duatravels.co.uk,+44 7407 897415,duatravels.co.uk,https://duatravels.co.uk/umrah-packages-cardiff,Public website crawl,legitimate_interest,email_verified,27.86,Dua Travels is an ATOL & IATA approved Umrah travel agent that can provide you the best Umrah Packages Cardiff and all over the UK. Book with confidence!
Al Badar Travel UK,,Procurement Manager,sales@albadartravel.co.uk,0121 773 4918,albadartravel.co.uk,https://albadartravel.co.uk,Public website crawl,legitimate_interest,email_verified,27.81,"Al Badar Travel is one of the West Midland's leading travel agents, located in the heart of Birmingham offering Hajj and Umrah packages at lowest possible rates."
Hajj & Umrah Travel Agency Cape Town,,Procurement Manager,info@shafiqstravel.co.za,+27 21 465 6260,shafiqstravel.co.za,https://shafiqstravel.co.za,Public website crawl,legitimate_interest,email_verified,27.69,This has been my travel agent for the last 15 yrs since his late dad Shafiq who encouraged me to write a book.
Hajj & Umrah Travel Agency Cape Town,,Procurement Manager,ridhaa@shafiqstravel.co.za,+27 21 465 6260,shafiqstravel.co.za,https://shafiqstravel.co.za,Public website crawl,unknown,email_verified,27.69,This has been my travel agent for the last 15 yrs since his late dad Shafiq who encouraged me to write a book.
IV Travel,,Procurement Manager,info@ivtravel.ie,087 374 5622 62,ivtravel.org,https://ivtravel.org/contact,Public website crawl,legitimate_interest,email_verified,27.67,Contact
A WAY TO MAKKAH,,Procurement Manager,info@awaytomakkah.com,07838648097,awaytomakkah.com,https://awaytomakkah.com,Public website crawl,legitimate_interest,email_verified,27.49,Find affordable Umrah Packages and spiritual travel services at Away to Makkah for a fulfilling pilgrimage experience.
Alhijra Travel BV,,Procurement Manager,booking@alhijratravel.com,+31 010 226 20 98,alhijratravel.nl,https://www.alhijratravel.nl/categorie/hadj,Public website crawl,unknown,email_verified,27.25,Hadj
Alhijra Travel BV,,Procurement Manager,booking@alhijratravel.nl,+31 010 226 20 98,alhijratravel.nl,https://www.alhijratravel.nl/categorie/hadj,Public website crawl,unknown,email_verified,27.25,Hadj
World of Travel by Irshad Malek,,Procurement Manager,sales@worldoftravel.co.za,082 333 6086,worldoftravel.co.za,https://worldoftravel.co.za,Public website crawl,legitimate_interest,email_verified,27.25,World of Travel by Irshad Malek
World of Travel by Irshad Malek,,Procurement Manager,enquiries@worldoftravel.co.za,082 333 6086,worldoftravel.co.za,https://worldoftravel.co.za,Public website crawl,unknown,email_verified,27.25,World of Travel by Irshad Malek
World of Travel by Irshad Malek,,Procurement Manager,irshad@worldoftravel.co.za,082 333 6086,worldoftravel.co.za,https://worldoftravel.co.za,Public website crawl,unknown,email_verified,27.25,World of Travel by Irshad Malek
World of Travel by Irshad Malek,,Procurement Manager,enquiries@worldoftravel.co.za,010 494 3475,worldoftravel.co.za,https://worldoftravel.co.za/about.html,Public website crawl,unknown,email_verified,27.25,World of Travel by Irshad Malek
Wakeel Worldwide Travel,,Procurement Manager,info@al-wakeelhajjandumrah.com,50 0225 1 0325 1000,al-wakeelhajjandumrah.com,https://www.al-wakeelhajjandumrah.com/umrah-packages,Public website crawl,legitimate_interest,email_verified,26.92,Umrah Packages
Wakeel Worldwide Travel,,Procurement Manager,alwakeelhajjumrah@gmail.com,50 0225 1 0325 1000,al-wakeelhajjandumrah.com,https://www.al-wakeelhajjandumrah.com/umrah-packages,Public website crawl,unknown,email_verified,26.92,Umrah Packages
Al Eimaan Travel » Contact Us,,Procurement Manager,info@aleimaantravel.co.za,+966 54 343 100 72,aleimaantravel.co.za,https://aleimaantravel.co.za/contact-us,Public website crawl,legitimate_interest,email_verified,26.92,Al Eimaan Travel
Al Eimaan Travel » Contact Us,,Procurement Manager,sayed@aleimaantravel.co.za,+966 54 343 100 72,aleimaantravel.co.za,https://aleimaantravel.co.za/contact-us,Public website crawl,unknown,email_verified,26.92,Al Eimaan Travel
Al Eimaan Travel » Contact Us,,Procurement Manager,shamiela@aleimaantravel.co.za,+966 54 343 100 72,aleimaantravel.co.za,https://aleimaantravel.co.za/contact-us,Public website crawl,unknown,email_verified,26.92,Al Eimaan Travel
🕋 Medina Travel,,Procurement Manager,info@medinatravel.be,+32 494 31 30 00,medinatravel.be,https://medinatravel.be,Public website crawl,legitimate_interest,email_verified,26.92,Reservez votre Omra
Salsabil Travel,,Procurement Manager,info@salsabiltravel.nl,010-4775614,salsabiltravel.nl,https://salsabiltravel.nl,Public website crawl,legitimate_interest,email_verified,26.92,All-round reisbureau in Rotterdam
Salsabil Travel,,Procurement Manager,info@salsabiltravel.nl,+31104775614,salsabiltravel.nl,https://salsabiltravel.nl/contact,Public website crawl,legitimate_interest,email_verified,26.92,All-round reisbureau in Rotterdam
SUPER EAGLE TRAVEL,,Procurement Manager,setravel2@gmail.com,410) 744-1222,supereagletravelinternational.com,https://supereagletravelinternational.com/about,Public website crawl,unknown,email_verified,26.92,ABOUT US
OnpointTravels,,Procurement Manager,admin@onpointtravels.com.au,1300 854 237,onpointtravels.com.au,https://www.onpointtravels.com.au/about-us,Public website crawl,unknown,email_verified,26.70,"Discover OnPoint Travels, Australia’s trusted Hajj & Umrah travel partner. Offering guided, reliable, and affordable pilgrimage tour packages."
Professional Travel Services,,Procurement Manager,info@madinatravelnottingham.co.uk,0115 837 8626,madinatravelnottingham.co.uk,https://madinatravelnottingham.co.uk,Public website crawl,legitimate_interest,email_verified,26.65,Your Journey Begins With Madina Travel
Your One Stop Travel Shop,,Procurement Manager,info@onestoptours.co.za,0860 109 500,onestoptours.co.za,https://onestoptours.co.za/categories/umrah,Public website crawl,legitimate_interest,email_verified,26.65,Talk to an expert
Hajj Umrah,,Procurement Manager,office@hajj-umrah-check.com,+49 1577 0255540,hajj-umrah-check.com,https://hajj-umrah-check.com/en/umrah-packages-from-australia,Public website crawl,legitimate_interest,email_verified,26.50,"Plan your Umrah packages from Australia the smart way: tailored , transparent pricing, and Umrah visa from Australia — Get your free quote now!"
"Travel Packages In Chicago, IL",,Procurement Manager,hello@hajjmakkahtours.com,60659 (773) 338-0720,hajjmakkahtours.com,https://www.hajjmakkahtours.com,Public website crawl,legitimate_interest,email_verified,26.43,"Welcome to Makkah Tours & Travel Inc. in Chicago, IL offering Tour Packages, Hajj Packages, Umrah Group, Umrah Packages and more."
Ababil Travel,,Procurement Manager,info@ababiltravel.com,01582 249559,ababiltravel.com,https://ababiltravel.com,Public website crawl,legitimate_interest,email_verified,26.42,Trusted Umrah &  Ticketing Solutions in Luton!
"Hajj, Umrah, Air Ticketing",,Procurement Manager,info@qadritravel.com,+92 333 5118584,qadritravel.com,https://www.qadritravel.com,Public website crawl,legitimate_interest,email_verified,26.42,Travel agency for Hajj and Umrah.
"Hajj, Umrah, Air Ticketing",,Procurement Manager,qadritravel@hotmail.com,+92 333 5118584,qadritravel.com,https://www.qadritravel.com,Public website crawl,unknown,email_verified,26.42,Travel agency for Hajj and Umrah.
Euro Bangla Tours,,Procurement Manager,info@eurobanglatours.com,0121 773 7700,eurobanglatours.co.uk,https://www.eurobanglatours.co.uk,Public website crawl,legitimate_interest,email_verified,26.29,"Trusted Hajj & Umrah travel agency in Birmingham. Premium pilgrimage packages, expert guidance, visa processing. Experience the spiritual journey of a lifetime. Book now!"
Hajj And Umrah,,Procurement Manager,inquiry@bestwesttravel.com,0449965678,bestwesttravel.com.au,https://bestwesttravel.com.au/hajj-and-umrah,Public website crawl,unknown,email_verified,26.23,Experience Spiritual Serenity with Trusted Pilgrimage Services
Hajj And Umrah,,Procurement Manager,inquiry@bestwesttravel.com.au,0449965678,bestwesttravel.com.au,https://bestwesttravel.com.au/hajj-and-umrah,Public website crawl,unknown,email_verified,26.23,Experience Spiritual Serenity with Trusted Pilgrimage Services
Noussouki Travel,,Procurement Manager,reservation.noussouki@gmail.com,+33 (0) 1 79 36 01 66,noussoukitravel.com,https://www.noussoukitravel.com/contact,Public website crawl,unknown,email_verified,26.23,Créer votre Omra sur mesure
Qibla Travel,,Procurement Manager,info@qiblatravel.com,+1 201-726-7525 12,qiblatravel.com,https://qiblatravel.com/umrah-packages-from-orlando,Public website crawl,legitimate_interest,email_verified,26.23,Qibla Travel – Trusted Islamic Travel Services
Qibla Travel,,Procurement Manager,sales@qiblatravel.com,+1 201-726-7525 12,qiblatravel.com,https://qiblatravel.com/umrah-packages-from-orlando,Public website crawl,legitimate_interest,email_verified,26.23,Qibla Travel – Trusted Islamic Travel Services
Qibla Travel,,Procurement Manager,example@info.com,+1 201-726-7525 12,qiblatravel.com,https://qiblatravel.com/umrah-packages-from-orlando,Public website crawl,unknown,email_verified,26.23,Qibla Travel – Trusted Islamic Travel Services
Terrific Travels,,Procurement Manager,office@terrifictravel.co.uk,+44 1215 291630,terrifictravel.co.uk,https://terrifictravel.co.uk,Public website crawl,legitimate_interest,email_verified,26.23,Best Umrah Travel Agency in Birmingham - Terrific Travel
Terrific Travels,,Procurement Manager,inquires@terrifictravel.co.uk,+44 1215 291630,terrifictravel.co.uk,https://terrifictravel.co.uk,Public website crawl,unknown,email_verified,26.23,Best Umrah Travel Agency in Birmingham - Terrific Travel
Islamic Travel,,Procurement Manager,info@islamictravel.com.au,1800 960 785,islamictravel.com.au,https://islamictravel.com.au/trip/group-umrah-packages,Public website crawl,legitimate_interest,email_verified,26.11,"Guided group Umrah packages. 10-day journey including flights, 5* hotels in Makkah and Madinah, Ziyarah, and visa support. Travel from anywhere."
Lakemba Travel – Cheap Flights,,Procurement Manager,info@lakembatravel.com.au,+61 2 9750 5000 8,lakembatravel.com.au,https://lakembatravel.com.au,Public website crawl,legitimate_interest,email_verified,26.07,Over 27 years Experience in the Travel Industry
Al Haram Travel and Tours,,Procurement Manager,info@alharamtravelntours.com,+1 (623) 404-4213,alharamtravelntours.com,https://alharamtravelntours.com/umrah-from-san-francisco,Public website crawl,legitimate_interest,email_verified,26.03,"Book Umrah from San Francisco with complete travel services, flights, hotels near Haram, visa assistance & group packages for US pilgrims."
Shery Travels,,Procurement Manager,info@sherytravels.com,+966-58-384-2090,sherytravels.com,https://sherytravels.com/umrah/usa-packages/chicago,Public website crawl,legitimate_interest,email_verified,25.87,"Start your Umrah journey from Chicago with Shery Travels. Easy departures from O'Hare, group travel with Chicago's Muslim community, and full guidance for a smooth and spiritual pilgrimage."
LMA Travel,,Procurement Manager,info@lma.org.au,74 874 168 589,lma.org.au,https://www.lma.org.au/lma-travel,Public website crawl,legitimate_interest,email_verified,25.87,"LMA Hajj & Umrah: Join our group pilgrimages to Mecca. Book your spiritual journey, register interest for upcoming trips. Trusted Muslim travel services in Australia since 1962."
Haider Travel,,Procurement Manager,hello@sdgzero.net,01254 659949,sdgzero.com,https://sdgzero.com/businesses/united-kingdom/england/blackburn/tourism-travel/haider-travel-travel-agency-blackburn-umrah-hajj-visa-flight-services,Public website crawl,legitimate_interest,email_verified,25.84,"Discover Haider Travel - Travel Agency Blackburn | Umrah, Hajj, Visa, & Flight Services, a trusted Tourism & Travel in Blackburn. View services, c"
Haleema,,Procurement Manager,sales@haleema.co.uk,07440 771 368 4,haleema.co.uk,https://www.haleema.co.uk/umrah-birmingham/birmingham-umrah-packages,Public website crawl,legitimate_interest,email_verified,25.81,"Birmingham Umrah Packages in 2026, lets travel with Haleema Limited for a secure and hassle-free journey."
Builder Travel S Gmbh,,Procurement Manager,n.elwy@buildertravel.com,015560807942,buildertravelsgmbh.de,https://buildertravelsgmbh.de,Public website crawl,unknown,email_verified,25.81,Hajj and Umrah trips_Germany
SUPER EAGLE TRAVEL,,Procurement Manager,setravel2@gmail.com,1-800-666-4999,supereagletravelinternational.com,https://supereagletravelinternational.com,Public website crawl,unknown,email_verified,25.81,PLEASE CLICK ON THE HAJJ & UMRAH TAB ABOVE FOR MORE INFORMATION!
Hajj and Umrah Experts,,Procurement Manager,info@hajjandumrahexperts.co.uk,020 3475 4003 3,hajjandumrahexperts.co.uk,https://hajjandumrahexperts.co.uk/birmingham-umrah-packages,Public website crawl,legitimate_interest,email_verified,25.70,Plan your pilgrimage with Birmingham Umrah Packages from UK 2026. Trusted Hajj and Umrah experts and smooth Birmingham departures.
Al Huda Travel and Umrah Services Ltd,,Procurement Manager,info@stcalhuda.com,+44 141 423 5400,stcalhuda.com,https://stcalhuda.com,Public website crawl,legitimate_interest,email_verified,25.70,"Your Trusted Specialists for Umrah, Hajj, Al Aqsa, and  Worldwide Packages"
Aa Travel,,Procurement Manager,info@aatravel.ca,+1416-335-6026,aatravel.ca,https://aatravel.ca,Public website crawl,legitimate_interest,email_verified,25.61,Best Hajj & Umrah packages for 2024 by A & A Travel & Tours (Formerly known as Baggia Travels)
Embassy Tours,,Procurement Manager,booking@embassytours.com,+1 121-356-95950,embassytourshajjandumrah.com,https://embassytourshajjandumrah.com/about,Public website crawl,unknown,email_verified,25.60,"Hajj & Umrah Packages from the USA – Embassy Tours Embassy Tours is your trusted partner for meaningful Hajj and Umrah experiences from the USA to the Holy Cities. With expertly designed pilgrimage packages departing from Los Angeles, New York, and other major cities, we guide you on every step of your sacred journey."
Azaan Travel,,Procurement Manager,info@azaantravel.com,+45 29 41 91 44,azaantravel.com,https://azaantravel.com,Public website crawl,legitimate_interest,email_verified,25.52,Vi har hos Azaan Travel mange års erfaring i at tilbyde rejser til forskellige destinationer.
islamictravelagency.co.uk,,Procurement Manager,info@islamictravelagency.co.uk,+447951138405,islamictravelagency.co.uk,https://www.islamictravelagency.co.uk/birmingham-umrah-packages.html,Public website crawl,legitimate_interest,email_verified,25.52,"Explore exclusive Birmingham Umrah Packages with Islamic Travel Agency. Perform Umrah from Birmingham, including flights, visa, hotels & transfers."
My Umrah,,Procurement Manager,info@myumrah.eu,21734063466503,myumrah.eu,https://myumrah.eu,Public website crawl,legitimate_interest,email_verified,25.52,"At MyUmrah, we are dedicated to making your sacred pilgrimage to Umrah and Hajj a seamless, spiritually enriching, and unforgettable experience. Based in"
Taqwa Travel,,Procurement Manager,info@taqwatravel.co.uk,0203 195 8700,taqwatravel.co.uk,https://taqwatravel.co.uk/about-us.php,Public website crawl,legitimate_interest,email_verified,25.52,"Discover Taqwa Travel, your trusted partner for affordable Umrah packages from the UK. Book your spiritual journey today!"
Umrah Leeds,,Procurement Manager,info@umrahleeds.co.uk,0113 3720012,umrahleeds.co.uk,https://www.umrahleeds.co.uk,Public website crawl,legitimate_interest,email_verified,25.52,"If you are looking for a trustworthy and affordable Islamic travel agency in the UK for Umrah, Umrah Packages Leeds can help."
Umrah Packages Blackburn,,Procurement Manager,info@umrahpackagesblackburn.co.uk,01254 460009,umrahpackagesblackburn.co.uk,https://umrahpackagesblackburn.co.uk,Public website crawl,legitimate_interest,email_verified,25.52,"If you are looking for a trustworthy and affordable Islamic travel agency in the UK for Umrah, Umrah Packages Blackburn can help."
Umrah Packages London,,Procurement Manager,info@umrahpackageslondon.com,020 30110793,umrahpackageslondon.com,https://umrahpackageslondon.com,Public website crawl,legitimate_interest,email_verified,25.52,"If you are looking for a trustworthy and affordable Islamic travel agency in the UK for Umrah, Umrah Packages London can help."
Miller's Travel and Tours,,Procurement Manager,info@millerstravels.co.za,,millerstravels.co.za,https://millerstravels.co.za,Public website crawl,legitimate_interest,email_verified,25.45,"Umrah packages from Cape Town â visa, flights & accommodation. Miller's Travel and Tours: trusted Saudi travel & international flights. Transparent pricing. Enquire on WhatsApp."
Miller's Travel and Tours,,Procurement Manager,admin@millerstravels.co.za,,millerstravels.co.za,https://millerstravels.co.za,Public website crawl,unknown,email_verified,25.45,"Umrah packages from Cape Town â visa, flights & accommodation. Miller's Travel and Tours: trusted Saudi travel & international flights. Transparent pricing. Enquire on WhatsApp."
Labayk Hajj,,Procurement Manager,info@labaykhajj.ca,+1 613 371-6363,labaykhajj.ca,https://labaykhajj.ca/about-us,Public website crawl,legitimate_interest,email_verified,25.44,"Labayk Hajj is the authorized Hajj and Umrah Travel agency for providing consular services for the Embassy of Saudi Arabia in Ottawa, Ontario, Canada."
Alhadi Travel,,Procurement Manager,info@alhaditravel.co.uk,0203 930 0817,alhaditravel.co.uk,https://alhaditravel.co.uk/city/sheffield-umrah-packages,Public website crawl,legitimate_interest,email_verified,25.44,Alhadi Travel offers top-rated Umrah Packages Sheffield. ATOL & IATA certified for reliability. Start your journey today with us.
Ikhlas Hajj & Umrah Services,,Procurement Manager,info@ikhlas.ca,+1-416-754-0347,ikhlas.ca,https://www.ikhlas.ca,Public website crawl,legitimate_interest,email_verified,25.44,"With 24+ years of experience, Ikhlas provides seamless Hajj & Umrah services. Travel with expert guidance and premium accommodations."
Ikhlas Hajj & Umrah Services,,Procurement Manager,sbaggia@ikhlas.ca,+1-416-754-0347,ikhlas.ca,https://www.ikhlas.ca,Public website crawl,unknown,email_verified,25.44,"With 24+ years of experience, Ikhlas provides seamless Hajj & Umrah services. Travel with expert guidance and premium accommodations."
Hajj Umrah Travels,,Procurement Manager,info@hajjumrahtravels.co.uk,99 020 3048 4411,hajjumrahtravels.co.uk,https://hajjumrahtravels.co.uk/glasgow-umrah-packages,Public website crawl,legitimate_interest,email_verified,25.44,Glasgow Umrah Packages​ is available at £739. We are a top-rated Umrah travel agency located in the UK. Get affordable Umrah packages in 2025
Saahal Travel,,Procurement Manager,info@saahaltravel.com,+45 50 46 90 13,saahaltravel.com,https://www.saahaltravel.com,Public website crawl,legitimate_interest,email_verified,25.44,"Welcome to Saahal Travel, your dedicated guide for one of the most profound journeys of your life. Based in the vibrant city of Mogadishu, Somalia, we specialize in crafting personalised Hajj and Umrah experiences that cater to your spiritual and logistical needs. Our mission is to make your pilgrimage as smooth and sp"
Explore Hajj & Umrah Tours,,Procurement Manager,info@explorehajjandumrah.com,7 (647) 537- 2840,explorehajjandumrah.com,https://explorehajjandumrah.com/best-umrah-travel-agency-in-toronto-2026-review-comparison,Public website crawl,legitimate_interest,email_verified,25.37,"Looking for the best Umrah travel agency in Toronto? Compare services, prices & reviews to choose a trusted Umrah agency for 2026."
Hajj Umrah,,Procurement Manager,info@hajjumrah.com.au,03) 9333-3079,hajjumrah.com.au,https://hajjumrah.com.au,Public website crawl,legitimate_interest,email_verified,25.37,Hajj Umrah Travel Agency Hajj Umrah tours Company Australia Melbourne Cheap Affordable Packages holiday specials packages airfare flights Tours Travel Operators Melbourne Hajj Packages Umrah Tours from Australia
Islamic Travel,,Procurement Manager,info@islamictravel.com.au,32 654 849 377,islamictravel.com.au,https://islamictravel.com.au/about-us,Public website crawl,legitimate_interest,email_verified,25.37,"Established in 2017, Islamic Travel Australia designs halal-conscious holidays, tours & Umrah packages with 226+ five-star reviews from happy travellers."
Labbaik Hajj Umrah USA,,Procurement Manager,info@labbaikhajjumrah.com,+17732321877,labbaikhajjumrah.com,https://www.labbaikhajjumrah.com,Public website crawl,legitimate_interest,email_verified,25.37,"Being a Leading USA Travel Agency, Labbaik Hajj Umrah offers Hajj and Umrah Packages according to your needs, Contact Us: (773) 232-1877"
Service Travel Agency,,Procurement Manager,info@naasirtravel.com,+1 (604) 330-0307,naasirtravel.com,https://naasirtravel.com,Public website crawl,legitimate_interest,email_verified,25.37,"Explore current packages, or plan your dream vacation with Naasir Travel. Specialists in Hajj, Umrah, and worldwide tours."
Ibadah Tours,,Procurement Manager,info@ibadahtours.com,+447440 474247,ibadahtours.com,https://www.ibadahtours.com/hajj-packages,Public website crawl,legitimate_interest,email_verified,25.31,Follow the Messanger of Allah's words and start your pilgrimage to the House of Allah. Ibadah Tours have created Hajj packages to make this easy.
Ibadah Tours,,Procurement Manager,sales@ibadahtours.com,+447440 474247,ibadahtours.com,https://www.ibadahtours.com/hajj-packages,Public website crawl,legitimate_interest,email_verified,25.31,Follow the Messanger of Allah's words and start your pilgrimage to the House of Allah. Ibadah Tours have created Hajj packages to make this easy.
Al Momin Travels,,Procurement Manager,info@almomintravel.co.uk,+442032890000 16,almomintravel.co.uk,https://almomintravel.co.uk/about-us,Public website crawl,legitimate_interest,email_verified,25.31,"Learn about Al Momin Travel, a UK-based agency offering reliable Umrah packages, expert guidance, and seamless travel experiences for pilgrims."
Al Raad Tours & Travel,,Procurement Manager,info@alraadtours.com,678-677-2807,alraadtours.com,http://www.alraadtours.com/contact-us,Public website crawl,legitimate_interest,email_verified,25.31,"Reach out to Al Raad Tours for Hajj & Umrah inquiries. Call 678-677-2807 or email info@alraadtours.com. Visit us in Atlanta, GA."
Umrah Travel Agency UK,,Procurement Manager,info@alzowartravel.co.uk,020 3504 2326 13,alzowartravel.co.uk,https://alzowartravel.co.uk,Public website crawl,legitimate_interest,email_verified,25.31,"Best Umrah Travel agency in UK, Al Zowar Travel offers Hajj and Umrah services, expert guidance, Dedicated support and ATOL protected."
Hajj and Umrah Experts,,Procurement Manager,info@cheapumrahdeals.co.uk,020 3475 4003,hajjandumrahexperts.co.uk,https://hajjandumrahexperts.co.uk/about-us,Public website crawl,legitimate_interest,email_verified,25.31,"Learn about Hajj and Umrah Expert, a trusted UK-based travel agency offering affordable, reliable, and tailored Umrah packages for every pilgrim."
Hajj and Umrah Experts,,Procurement Manager,info@hajjandumrahexperts.co.uk,020 3475 4003,hajjandumrahexperts.co.uk,https://hajjandumrahexperts.co.uk/about-us,Public website crawl,legitimate_interest,email_verified,25.31,"Learn about Hajj and Umrah Expert, a trusted UK-based travel agency offering affordable, reliable, and tailored Umrah packages for every pilgrim."
Indus Travel,,Procurement Manager,info@industravel.dk,+45 3393 3060,industravel.dk,https://industravel.dk/en/home-best-travel-agency,Public website crawl,legitimate_interest,email_verified,25.31,"Indus Travel leading travel agency for Hajj & Umrah in Denmark. We offer reliable umrah packages with flight, visa, hotel, transport & personal guidance."
Islamic Travel,,Procurement Manager,info@islamictravel.co.uk,0203-970-4500,islamictravel.co.uk,https://www.islamictravel.co.uk/cheap-hajj-packages.html,Public website crawl,legitimate_interest,email_verified,25.31,"Looking for Cheap Hajj Packages 2026? Islamic Travel offers ATOL-protected Hajj packages from London, Manchester & Birmingham. All-inclusive 5-star & shifting deals available."
