company,company_clean,domain,website,country_inferred,country_inference_source,region_inferred,tld,email,email_domain,email_type,role_email,free_email_provider,phone_raw,phone_normalized,contact_readiness,outreach_priority,recommended_channel,consent_status,verification_status,overall_score,raw_text_snippet
Noussouki Travel,Noussouki Travel,noussoukitravel.com,https://www.noussoukitravel.com/contact,France,phone,Europe,com,reservation.noussouki@gmail.com,gmail.com,free_provider,no,yes,+33 (0) 1 79 36 01 66,+330179360166,email_and_phone,C,email_then_phone,unknown,email_verified,26.23,Créer votre Omra sur mesure
PARIS HAJJ,PARIS HAJJ,parishajjomra.com,https://parishajjomra.com/contact,France,text_hint,Europe,com,,,missing,no,no,0178 99 42 23,+33178994223,phone_only,C,phone_first,unknown,phone_verified,7.50,"Contactez-nous, votre agence de voyage PARIS HAJJ à l'écoute.....programmes de OMRA et de HAJJ...Visite de Medine...... Contactez-nous.......contact....."
Pelerin Hajj,Pelerin Hajj,pelerinhajj.com,https://pelerinhajj.com,France,text_hint,Europe,com,pelerinhajj@gmail.com,gmail.com,free_provider,no,yes,09 81 10 86 15,+33981108615,email_and_phone,C,email_then_phone,unknown,email_verified,21.25,"Omra 2026-2027 au départ de Paris, Marseille, Lyon, Bruxelles. Omra pas chère : découvrez nos meilleurs forfaits. Réservez vite au 09 81 10 86 15."
Hajj en France,Hajj en France,precious-omra.com,https://precious-omra.com/quel-est-le-cout-du-hajj-en-france,France,text_hint,Europe,com,sofianebmde@gmail.com,gmail.com,free_provider,no,yes,,,email_only,C,email_first,unknown,email_verified,16.25,"Découvrez le coût du Hajj en France : prix moyens, frais d'agence, astuces pour optimiser votre budget et préparer votre pèlerinage sereinement."
Nusuk Hajj Package Prix,Nusuk Hajj Package Prix,tawaf.fr,https://www.tawaf.fr/nusuk-hajj-package-prix-comprendre-les-tarifs-officiels-du-hajj-2026-et-choisir-la-bonne-offre,France,domain_tld,Europe,fr,,,missing,no,no,01 75 43 43 39,+33175434339,phone_only,C,phone_first,unknown,phone_verified,7.50,Nusuk Hajj Package Prix : Comprendre les Tarifs Officiels du Hajj 2026 et Choisir la Bonne Offre
Umrah Imani by Nuh Travel & Tours,Umrah Imani by Nuh Travel & Tours,umrahimani.com,https://www.umrahimani.com/pakej-umrah,France,phone,Europe,com,,,missing,no,no,03-7731 2525,+33377312525,phone_only,C,phone_first,unknown,phone_verified,12.67,Pakej Umrah & Ziarah
Umrah Packages France,Umrah Packages France,umrahpackagesfrance.com,https://umrahpackagesfrance.com,France,text_hint,Europe,com,,,missing,no,no,+33 1 23 45 67 89,+33123456789,phone_only,C,phone_first,unknown,phone_verified,7.50,"Best Umrah packages from France 2026. Economy to Luxury options from €999. Direct flights, 3-5 star hotels near Haram, visa included. Ramadan packages available. Book today!"
Alhijaz Indowisata Travel Umroh Jakarta,Alhijaz,alhijaz.travel,https://alhijaz.travel,Indonesia,text_hint,APAC,travel,,,missing,no,no,006-0008-012-225,+60008012225,phone_only,C,phone_first,unknown,phone_verified,11.20,Terima kasih untuk tim Alhijaz Indowisata yang sudah membantu Laxmi dan keluarga menjadi tamu Allah yang terlayani dengan baik. Insyaallah jika ada rezeki
Travel Umroh Haji Terbaik,Alhijazindonesia,alhijazindonesia.com,https://alhijazindonesia.com/umroh,Indonesia,text_hint,APAC,com,,,missing,no,no,006-0008-012-225,+60008012225,phone_only,C,phone_first,unknown,phone_verified,11.35,Alhijaz Indowisata adalah agen travel Haji Plus dan Umroh resmi yang terdaftar di Kementerian Agama RI dengan predikat AKREDITASI “A” Terbaik
Biaya Haji Plus 2026/2027 Travel Haji Khusus Terpercaya,Biayahaji,biayahaji.com,https://www.biayahaji.com,Indonesia,text_hint,APAC,com,,,missing,no,no,021) 72781015,+622172781015,phone_only,C,phone_first,unknown,phone_verified,11.23,Paket Biaya Haji Plus 2023-2024 / Haji Khusus Kuota Resmi Kementerian Agama (Kemenag). DP US$ 4.500 langsung dapat nomor porsi. Mau?
Darulifta.info,Darulifta.info,darulifta.info,https://www.darulifta.info/d/jamiaturrasheed/fatwa/5KY/%D8%B9%D9%85%D8%B1%DB%81-%DA%A9%DB%92-%D9%84%DB%8C%DB%92-%D9%B9%D8%B1%DB%8C%D9%88%D9%84-%D8%A7%DB%8C%D8%AC%D9%86%D8%B3%DB%8C-%DA%A9%DB%8C-%D8%B7%DB%92-%DA%A9%D8%B1%D8%AF%DB%81-%D8%B4%D8%B1%D8%A7%D8%A6%D8%B7-%DA%A9%D8%A7-%D8%AD%DA%A9%D9%85,Indonesia,phone,APAC,info,,,missing,no,no,62987 2019-05-26,+16298720190,phone_only,C,phone_first,unknown,phone_verified,12.32,ruling regarding the terms and conditions set by a travel agency for umrah
Golden Rama Tours & Travel,Goldenrama,goldenrama.com,https://www.goldenrama.com/tours/country/IE,Indonesia,phone,APAC,com,,,missing,no,no,021) 2963 1999,+622129631999,phone_only,C,phone_first,unknown,phone_verified,11.35,"A poetic
  land where emerald hills roll, pub laughter fills the air, and every ruin
  tells a tale older than time."
"Paket Biaya Haji Plus 2026 Travel Haji Khusus Akreditasi ""A""","Paket Biaya Haji Plus 2026 Travel Haji Khusus Akreditasi ""A""",haji.plus,https://www.haji.plus,Indonesia,text_hint,APAC,plus,,,missing,no,no,0857-1692-6969,+15716926969,phone_only,C,phone_first,unknown,phone_verified,11.35,"Paket biaya haji plus 2026/2027 travel haji khusus terbaik dengan akreditasi ""A"". Segera hubungi kami untuk info dan pendaftaran!"
Travel Umroh Resmi Kemenag & Haji Khusus,Travel Alhijazindo,travelalhijazindo.com,https://travelalhijazindo.com,Indonesia,text_hint,APAC,com,,,missing,no,no,006-0008-012-225,+60008012225,phone_only,C,phone_first,unknown,phone_verified,11.50,"Daftar Umroh & Haji Khusus bersama travel resmi Kemenag. Keberangkatan tiap bulan, hotel dekat Masjidil Haram. Konsultasi gratis!"
Senarai Agensi Umrah Malaysia Dan Tips Memilih Agensi,Senarai Agensi Umrah Malaysia Dan Tips Memilih Agensi,blogfaiz.com,https://www.blogfaiz.com/senarai-agensi-umrah-malaysia-tips-memilih-agensi,Malaysia,phone,APAC,com,,,missing,no,no,+603-8927 1200 23,+6038927120023,phone_only,C,phone_first,unknown,phone_verified,7.50,Senarai Agensi Umrah Malaysia Dan Tips Memilih Agensi | Menunaikan ibadah umrah adalah impian setiap umat Islam. Ia merupakan peluang untuk mendekatkan diri
In Saff Travel & Tours Sdn. Bhd,Insaff Travel,insafftravel.com.my,https://insafftravel.com.my/pakej-umrah-9h-7m,Malaysia,domain_tld,APAC,my,insafftravel@gmail.com,gmail.com,free_provider,no,yes,+601131274002,+601131274002,email_and_phone,C,email_then_phone,unknown,email_verified,24.95,Rasai pengalaman menunaikan ibadah umrah dengan tenang dan teratur melalui pakej istimewa kami yang direka khusus untuk kemudahan dan keselesaan anda.
MKM Ticketing Travel & Tours,Mkm,mkm.my,https://mkm.my/about,Malaysia,domain_tld,APAC,my,,,missing,no,no,+6012-213 0579,+60122130579,phone_only,C,phone_first,unknown,phone_verified,12.90,03-7831 6740
Naurah Tour & Services,Naurah Tour & Services,naurahtours.com,https://naurahtours.com,Malaysia,phone,APAC,com,naurahtourservices20@gmail.com,gmail.com,free_provider,no,yes,+6011-2329 5193,+601123295193,email_and_phone,C,email_then_phone,unknown,email_verified,21.25,"Sejak tahun 2018 Naurah Tour & Services Sdn. Bhd. telah memberikan perkhidmatan haji, umrah dan pelancongan yang di percayai kepada pelanggan kami."
Pakej Haji By Azzuha Travel,Pakejhaji,pakejhaji.com.my,https://pakejhaji.com.my,Malaysia,domain_tld,APAC,my,,,missing,no,no,011-1078 3467,+601110783467,phone_only,C,phone_first,unknown,phone_verified,10.94,"Dapatkan Pakej Haji 2026 yang lengkap dan dipercayai dengan kemudahan penginapan strategik, mutawwif bertauliah, kursus persediaan haji dan jadual perjalanan tersusun. Tempahan telah dibuka untuk jemaah yang mencari keselesaan, bimbingan berkualiti dan pengalaman ibadah yang lancar."
TH Travel,TH Travel,thts.com.my,https://www.thts.com.my/haji,Malaysia,domain_tld,APAC,my,,,missing,no,no,+6019 289 7624,+60192897624,phone_only,C,phone_first,unknown,phone_verified,14.49,TH Travel
TITIM TRAVEL,TITIM TRAVEL,titimtravel.com,https://www.titimtravel.com,Malaysia,phone,APAC,com,titimsdnbhd@gmail.com,gmail.com,free_provider,no,yes,+60 18-965 4371,+60189654371,email_and_phone,C,email_then_phone,unknown,email_verified,26.65,"UMRAH MURAH, BERKAT, DEKAT"
USQ Travel & Tours,USQ Travel & Tours,usqtraveltours.com,https://usqtraveltours.com,Malaysia,phone,APAC,com,usqumrah@gmail.com,gmail.com,free_provider,no,yes,+6 0193300053,+60193300053,email_and_phone,C,email_then_phone,unknown,email_verified,25.02,"USQ Travel & Tours â Pakar dalam pakej Umrah & Ziarah dengan perkhidmatan lengkap, penginapan selesa, dan bimbingan mutawif berpengalaman. Tempah perjalanan ibadah anda hari ini!"
Aljazira Travel,Aljazira Travel,aljaziratravel.com,https://aljaziratravel.com/%D8%A7%D9%84%D8%AD%D8%AC-%D9%88%D8%A7%D9%84%D8%B9%D9%85%D8%B1%D8%A9,Morocco,phone,MENA,com,,,missing,no,no,+212-6718-72273,+212671872273,phone_only,C,phone_first,unknown,phone_verified,10.17,اكتشف باقاتنا المميزة للحج والعمرة عبر aljaziratravel.com، تشمل الإقامة، النقل، الإرشاد والخدمات المتكاملة لراحة وطمأنينة تامة.
Rahmah Tours Umrah,Rahmah Tours Umrah,isb.org,https://isb.org/umrah,Morocco,phone,MENA,org,,,missing,no,no,21244 (410) 747-4869,+12124441074,phone_only,C,phone_first,unknown,phone_verified,7.50,Al-Rahmah Tours Umrah: Registration
Celebrity Hajj,Celebrity Hajj,celebrityhajj.nl,https://celebrityhajj.nl,Netherlands,domain_tld,Europe,nl,,,missing,no,no,020 616 7899,+31206167899,phone_only,C,phone_first,unknown,phone_verified,7.50,"🕋 Celebrity Hajj, het hadj en umrah reisbureau van Nederland. 25 jaar ervaring met pelgrimreizen, pakketten voor ieder budget. Bekijk de website"
Darelhuda Hajj,Darelhuda Hajj,darelhudahajj.com,https://www.darelhudahajj.com,Netherlands,phone,Europe,com,darelhudahajj@gmail.com,gmail.com,free_provider,no,yes,0031638799779,+31638799779,email_and_phone,C,email_then_phone,unknown,email_verified,23.92,De mooiste herinneringen creëren we samen
tasheeltravel.nl,tasheeltravel.nl,tasheeltravel.nl,https://tasheeltravel.nl,Netherlands,domain_tld,Europe,nl,info@tasheeltravel.nl,tasheeltravel.nl,company_domain,yes,no,,,email_only,C,email_first,legitimate_interest,email_verified,20.20,"Boek jouw Umrah en Hadj Reizen bij Tasheel Travel - Complete reizen vanuit Nederland met betrouwbare begeleiding, comfort en toewijding."
Umrah Packagesnetherlands,Umrah Packagesnetherlands,umrahpackagesnetherlands.com,https://umrahpackagesnetherlands.com,Netherlands,phone,Europe,com,,,missing,no,no,+31 10 234 5678,+31102345678,phone_only,C,phone_first,unknown,phone_verified,8.20,"Book affordable Umrah packages from Netherlands to Makkah & Madinah. IATA certified, 5-star hotels, direct flights. Starting €1,995. Family & group discounts available."
Hajj & Umrah,Hajj & Umrah,sama.co.nz,https://sama.co.nz/hajj-umrah,New Zealand,domain_tld,APAC,nz,,,missing,no,no,+64 21 286 9786,+64212869786,phone_only,C,phone_first,unknown,phone_verified,7.50,©Copyright © 2025 SAMA . All Rights are Reserved. Powered By Sparkwave Group.
Karawan Hajj & Umrah,Karawan Hajj & Umrah,karwanhajj.com,https://karwanhajj.com/hajj-packages,North America,phone,Unknown,com,caravanhajj@hotmail.com,hotmail.com,free_provider,no,yes,+1 (732) 225-4050 259,+17322254050,email_and_phone,C,email_then_phone,unknown,email_verified,21.25,Hajj Packages
Myhera Travel,Myhera Travel,myheratravel.com,https://myheratravel.com,North America,phone,Unknown,com,heratravel2025@gmail.com,gmail.com,free_provider,no,yes,8250155982,,email_only,C,email_first,unknown,email_verified,21.25,বিশিষ্ট ব্যবসায়ী ও অভিজ্ঞ মুয়াল্লিম
Tabarak Travel S,Tabarak Travels,tabaraktravels.com,https://www.tabaraktravels.com,North America,phone,Unknown,com,tabaraktravels23@gmail.com,gmail.com,free_provider,no,yes,88 64 10 61 06,+18864106106,email_and_phone,C,email_then_phone,unknown,email_verified,21.25,"""رحلتك المقدسة، رعايتنا المخلصة."""
Banuri,Banuri,banuri.edu.pk,https://www.banuri.edu.pk/readquestion/haj-o-umrah-travel-agents-k-sath-dar-pesh-masail-ka-hukum/-0001-11-30,Pakistan,domain_tld,APAC,pk,,,missing,no,no,143101200163,+92143101200163,phone_only,C,phone_first,unknown,phone_verified,7.50,گزارش آپ کی خدمت میں عرض کرنا چاہتا ہوں جس کا جواب شریعت مطہرہ کے مطابق درکارہےہم ٹریول ایجنٹس حضرات جو حج و عمرہ کا کام کرتے ہیں اکثر اوقات مسائل ہمیں درپیش ہوتے ہیں جن کا شرعی حل ہمارے سامنے نہیں ہوتا جو درجہ ذیل ہیں:۱: سعودی حکومت اور ہر عمرہ پر جانے والے کے درمیان ایک عہد نامہ ویزہ ہو تا ہے جس کی شرائط میں یہ شامل
کاروان ملک (پرائویٹ لمٹیڈ),Karwan E Malik,karwan-e-malik.com,https://www.karwan-e-malik.com/ur/packages,Pakistan,phone,APAC,com,,,missing,no,no,+923 002922159,+923002922159,phone_only,C,phone_first,unknown,phone_verified,7.50,ٹریول ایجنسی ، حج اور عمرہ کی خدمات کراچی میں
Perfect Umrah,Perfect Umrah,perfectumrah.pk,https://perfectumrah.pk,Pakistan,domain_tld,APAC,pk,,,missing,no,no,+92 304 111 5530,+923041115530,phone_only,C,phone_first,unknown,phone_verified,7.50,"Book Best Star Umrah Packages from All Cities of Pakistan (Umrah Packages Lahore, Umrah Packages Islamabad, Umrah Packages Karachi. Make your Umrah Perfect with Perfect Umrah Pakistan."
eJourney,eJourney,ejourney.sa,https://ejourney.sa/about,Saudi Arabia,domain_tld,MENA,sa,support@ejourney.sa,ejourney.sa,company_domain,yes,no,,,email_only,C,email_first,legitimate_interest,email_verified,16.25,"About eJourney eJourney was launched by Digital Mobility Solutions, the investment arm of SAPTCO, a leader in transportation for over 40 years, to support Vision 2030 by providing an exceptional Umrah experience and high-quality services both locally and internationally Our mission We specialize in offering diverse Umr"
Almosafer,Almosafer,global.almosafer.com,https://global.almosafer.com/ar/offers,Saudi Arabia,phone,MENA,com,,,missing,no,no,+966 55 440 0000,+966554400000,phone_only,C,phone_first,unknown,phone_verified,7.50,اختر أفضل عروض السفر والعطلات إلى اشهر الوجهات في آسيا، اوروبا، افريقيا وأكثر، اكتشف المزيد وخطط لرحلتك مع المسافر
hajj.nusuk.sa,hajj.nusuk.sa,hajj.nusuk.sa,https://hajj.nusuk.sa/PackagesCategories,Saudi Arabia,domain_tld,MENA,sa,,,missing,no,no,20250824783,+20250824783,phone_only,C,phone_first,unknown,phone_verified,7.50,Nusuk Hajj Your Gateway to a Journey of a Lifetime
Nusuk Umrah Platform,Nusuk Umrah Platform,umrah.nusuk.sa,https://umrah.nusuk.sa,Saudi Arabia,domain_tld,MENA,sa,,,missing,no,no,20251021505,+20251021505,phone_only,C,phone_first,unknown,phone_verified,7.50,Nusuk Umrah Your Gateway to a Journey of a Lifetime
Hajj Umrah Info,Hajj Umrah Info,hajjumrahinfo.co.za,https://www.hajjumrahinfo.co.za,South Africa,domain_tld,Africa,za,info@hajjumrahinfo.co.za,hajjumrahinfo.co.za,company_domain,yes,no,,,email_only,C,email_first,legitimate_interest,email_verified,16.25,"Browse and compare Hajj and Umrah packages in South Africa. Compare by operator, stay length, hotel, package features. Find the perfect package to suit your needs."
Miller's Travel and Tours,Millers Travels,millerstravels.co.za,https://millerstravels.co.za,South Africa,domain_tld,Africa,za,info@millerstravels.co.za,millerstravels.co.za,company_domain,yes,no,,,email_only,C,email_first,legitimate_interest,email_verified,25.45,"Umrah packages from Cape Town â visa, flights & accommodation. Miller's Travel and Tours: trusted Saudi travel & international flights. Transparent pricing. Enquire on WhatsApp."
Oba Turizm,Oba Turizm,21obaturizm.com,https://www.21obaturizm.com/tours,Turkey,phone,MENA,com,,,missing,no,no,0532 169 67 88,+905321696788,phone_only,C,phone_first,unknown,phone_verified,7.50,"Oba Turizm ile güvenilir ve konforlu Umre ve Hac turları. 15+ yıllık deneyim, Mekke ve Medine'ye özel paketler, vize işlemleri ve 7/24 destek ile hizmetinizdeyiz."
Only Tourism,Only Tourism,onlytourism.com,https://onlytourism.com/umrah-ar,United Arab Emirates,phone,MENA,com,,,missing,no,no,+971501031771,+971501031771,phone_only,C,phone_first,unknown,phone_verified,11.77,4.9/52k+ المراجعات
Alkhair Travel,Alkhair Travel,alkhairtravel.co.uk,https://www.alkhairtravel.co.uk/offer/umrah-package-from-ireland,United Kingdom,domain_tld,Europe,uk,,,missing,no,no,+447481686598,+447481686598,phone_only,C,phone_first,unknown,phone_verified,11.35,AlKhair Travel is famous in the Ireland Umrah Travel Industry for organizing your holy trip with complete Umrah services to cater to your specific Umrah Travel needs. Book early to get the best prices for Umrah Packages from Ireland.
British Haj Travel,British Haj Travel,britishhajtravel.com,https://britishhajtravel.com,United Kingdom,text_hint,Europe,com,booking@britishhajtravel.com,britishhajtravel.com,company_domain,yes,no,,,email_only,C,email_first,unknown,email_verified,20.20,Welcome to British Haj Travel Ltd. Book Hajj and Umrah packages at Affordable price From the UK. We also provide Halal Holidays with flights and Hotels.
Agence Hajj et Omra 2026,Chaima Travel,chaimatravel.net,https://www.chaimatravel.net,United Kingdom,phone,Europe,net,,,missing,no,no,01 34 92 98 25,+44134929825,phone_only,C,phone_first,unknown,phone_verified,11.16,Découvrez nos forfaits Omra et Hajj 2026 et réservez votre pèlerinage avec l'agence Chaima Travel agréée par la Ministère du Hajj & Omra.
Hajj Umrah Journey,Hajj Umrah Journey,hajjumrahjourney.co.uk,https://www.hajjumrahjourney.co.uk/tr/hizmetler/umre-paketleri,United Kingdom,domain_tld,Europe,uk,,,missing,no,no,+44 7469063125,+447469063125,phone_only,C,phone_first,unknown,phone_verified,7.50,Umre Paketleri
Omra Sounnah Agence Hajj 2026 & Agence Omra 2025,Omrasounnah,omrasounnah.com,https://www.omrasounnah.com,United Kingdom,phone,Europe,com,omrasounnah93800@gmail.com,gmail.com,free_provider,no,yes,01 82 83 01 52,+44182830152,email_and_phone,C,email_then_phone,unknown,email_verified,21.25,HAJJ & OMRA
Umrah Master,Umrah Master,umrahmaster.co.uk,https://umrahmaster.co.uk,United Kingdom,domain_tld,Europe,uk,,,missing,no,no,835 0208 178 4411,+13502081784,phone_only,C,phone_first,unknown,phone_verified,7.50,"Your journey to the sacred, mastered."
Yuusr,Yuusr,yuusr.com,https://yuusr.com/en/about-us,United Kingdom,phone,Europe,com,,,missing,no,no,+44 333 355 5212 24,+44333355521224,phone_only,C,phone_first,unknown,phone_verified,7.50,"Learn about Yuusr, your trusted partner for premium Umrah packages. ATOL protected with years of experience serving pilgrims worldwide."
Alalaa Travel Hajj and Umrah Tours,Alalaa Travel Hajj and Umrah Tours,alalaatravel.com,https://www.alalaatravel.com/site/contact.php,United States,text_hint,North America,com,info@alalaatravel.com,alalaatravel.com,company_domain,yes,no,,,email_only,C,email_first,legitimate_interest,email_verified,20.70,Alalaa Travel is your source for Hajj travel from the USA. Check out our comprehensive 2022 packages for Hajj and Umrah Tours
Alhamd Travel,Alhamd Travel,alhamdtravel.com,https://www.alhamdtravel.com/umrah-from-houston.html,United States,text_hint,North America,com,,,missing,no,no,929)-833-1717,+19298331717,phone_only,C,phone_first,unknown,phone_verified,10.17,"Start your Umrah journey from Houston with Alhamd Travel. Packages start at $1290, including flights from IAH, visa, hotels, transport & 24/7 support."
USA Best Hajj and Umrah Travel Agency,Alhateem Tours,alhateemtours.com,https://www.alhateemtours.com,United States,text_hint,North America,com,,,missing,no,no,929)-833-1717,+19298331717,phone_only,C,phone_first,unknown,phone_verified,13.22,"Plan your Hajj and Umrah with AlHateem Tours, a trusted Islamic travel agency in the USA, for affordable services and seamless pilgrimage experiences."
Al Hoda Hajj Group Travel USA,Al Hoda Hajj Group Travel USA,alhodahajjgroup.com,https://alhodahajjgroup.com/hajj-packages,United States,text_hint,North America,com,,,missing,no,no,1-866-254-6321,+18662546321,phone_only,C,phone_first,unknown,phone_verified,13.21,"ALHoda Hajj Group USA is a trusted Islamic travel agency and Muslim travel agency in the USA offering Hajj packages, Umrah packages, Ramadan Umrah trips, Saudi visa services, and Islamic pilgrimage travel with 37 years of experience."
Trusted Umrah Agency in Maryland,Amlux Travels,amluxtravels.com,https://amluxtravels.com/umrah-service,United States,text_hint,North America,com,,,missing,no,no,+1 202-674-8688,+12026748688,phone_only,C,phone_first,unknown,phone_verified,10.17,"Perform Umrah with peace of mind. Amlux Travels, a trusted umrah agency in Maryland, offers all-inclusive Umrah packageswith visa assistance, flights, and hotel reservations for a seamless pilgrimage."
AQSAHAJJ.COM,AQSAHAJJ.COM,aqsahajj.com,https://aqsahajj.com,United States,text_hint,North America,com,,,missing,no,no,718)799-3998 418,+17187993998,phone_only,C,phone_first,unknown,phone_verified,7.50,"Aqsa Hajj: Plan your Umrah from Pennsylvania, USA. Affordable packages & visa services for a seamless spiritual journey. Book now!"
Bismillah Tours,Bismillah Tours,bismillahtours.com,https://www.bismillahtours.com/houston-umrah-packages.html,United States,text_hint,North America,com,,,missing,no,no,929)-833-1717,+19298331717,phone_only,C,phone_first,unknown,phone_verified,7.50,Discover Affordable Umrah Packages from Houston - Reserve Your Spiritual Journey Now for a Memorable Experience!
Dar El Mecca,Dar El Mecca,darelmecca.com,https://darelmecca.com,United States,text_hint,North America,com,darelmecca94@gmail.com,gmail.com,free_provider,no,yes,+1 919-410-9557,+19194109557,email_and_phone,C,email_then_phone,unknown,email_verified,21.25,"Discover premium Hajj and Umrah packages from the USA with Dar El Mecca. Trusted by thousands, we offer 5-star accommodations, guided tours, airfare, and visa services. Book your spiritual journey today!"
Chicago Sisters Umrah,Chicago Sisters Umrah,dstworldtravel.com,https://dstworldtravel.com/chicagosisters,United States,text_hint,North America,com,,,missing,no,no,1-866-327-7252,+18663277252,phone_only,C,phone_first,unknown,phone_verified,7.50,Chicago Sisters Umrah
South Africa Travel,South Africa Travel,gate1travel.com,https://www.gate1travel.com/africa/south-africa,United States,phone,North America,com,,,missing,no,no,1-215-572-7676,+12155727676,phone_only,C,phone_first,unknown,phone_verified,11.16,"Gate 1 Travel has provided quality, affordable escorted tours, river cruises and vacation packages for 40 years. We look forward to showing you More of the World for Less on your next vacation."
Departures with Verified Imams,Departures with Verified Imams,go-together.co,https://www.go-together.co/en-US/umrah-packages/from-tampa-fl,United States,text_hint,North America,co,support@go-together.co,go-together.co,company_domain,yes,no,,,email_only,C,email_first,legitimate_interest,email_verified,16.25,Book authentic Umrah packages departing from Tampa. Join verified local imams for your spiritual journey to Mecca and Medina.  Muslims served.
Approved Hajj Travel Agents,Hajinformation,hajinformation.com,https://www.hajinformation.com/main/n72u01.htm,United States,text_hint,North America,com,,,missing,no,no,00971506506468,+971506506468,phone_only,C,phone_first,unknown,phone_verified,15.56,USA - Approved Hajj Travel Agents
Hajj & Umrah Trips,Hajj & Umrah Trips,hajjandumrahtrips.com,https://hajjandumrahtrips.com/umrah-packages/dallas,United States,text_hint,North America,com,info@hajjandumrahtrips.com,hajjandumrahtrips.com,company_domain,yes,no,,,email_only,C,email_first,legitimate_interest,email_verified,16.25,Umrah Packages From Dallas
Hilal Hajj & Umrah Dallas,Hilal Hajj & Umrah Dallas,halalx.org,https://halalx.org/listing/hilal-hajj-umrah-dallas,United States,text_hint,North America,org,hilalhajj@gmail.com,gmail.com,free_provider,no,yes,800) 513-5836,+18005135836,email_and_phone,C,email_then_phone,unknown,email_verified,21.25,Hilal Hajj & Umrah Dallas
Hilal Hajj and Umrah,Hilal Hajj and Umrah,hilalhajj.com,https://hilalhajj.com,United States,text_hint,North America,com,hilalhajj@gmail.com,gmail.com,free_provider,no,yes,75074 (945) 900-2333,+17507494590,email_and_phone,C,email_then_phone,unknown,email_verified,21.25,"We strive to provide the best services to the guests of Allah. At Hilal Hajj & Umrah, our goal is to maintain, and exceed the highest quality  services offered by any licensed Hajj Agent in the United States. For over 20 years, we established ourselves as a market leaders in offering exceptional Hajj packages. Our uniq"
iLink Tours,iLink Tours,ilinktours.com,https://ilinktours.com,United States,text_hint,North America,com,,,missing,no,no,+1-516-347-1175 15,+15163471175,phone_only,C,phone_first,unknown,phone_verified,11.45,"Travel with iLink Tours—your trusted Islamic holiday, Hajj & Umrah agency in USA. Affordable packages with flights, hotels, visa processing & ground transport included."
Hajj Umrah travel agents from UK,Perfect Umrah,perfectumrah.us,https://www.perfectumrah.us/index.php,United States,domain_tld,North America,us,,,missing,no,no,+442071839663,+442071839663,phone_only,C,phone_first,unknown,phone_verified,13.86,"Book Economy to 5Star Umrah Packages From USA with Most Trusted Umrah Company. We have served more than 10,000 pilgrims and earned 5 Star Reviews."
Sama Tours,Sama Tours,samatoursusa.com,https://www.samatoursusa.com,United States,text_hint,North America,com,,,missing,no,no,714)-276-2623,+17142762623,phone_only,C,phone_first,unknown,phone_verified,7.50,Hajj 2025 from USA
