company,email,phone,domain,source_url,consent_status,verification_status,overall_score,raw_text_snippet
A & A Travel & Tour Inc (formerly known as Baggia Travel),info@aatravel.ca,+1416-335-6026,aatravel.ca,https://aatravel.ca/umrah,legitimate_interest,email_verified,25.70,Best Umrah packages for 2024 by A & A Travel & Tours (Formerly known as Baggia Travels)
Al Badar Travel UK,sales@albadartravel.co.uk,0121 773 4918,albadartravel.co.uk,https://albadartravel.co.uk,legitimate_interest,email_verified,27.81,"Al Badar Travel is one of the West Midland's leading travel agents, located in the heart of Birmingham offering Hajj and Umrah packages at lowest possible rates."
Alfalah Travel and Tourism,info@alfalahtravelandtourism.com,,alfalahtravelandtourism.com,https://alfalahtravelandtourism.com/about-us,legitimate_interest,email_verified,23.20,Discover the Essence of Alfalah Travel & Tours.
Alhadi Travel,info@alhaditravel.co.uk,0203 930 0817,alhaditravel.co.uk,https://alhaditravel.co.uk/city/leicester-umrah-packages,legitimate_interest,email_verified,25.44,"Book your Umrah Package from Leicester today with Alhadi Travel. Affordable, reliable, and ready for your pilgrimage. Reserve your spot today."
Alhaq Tours,info@alhaqtours.com,312) 923 - 7866,alhaqtours.com,https://alhaqtours.com/chicago-umrah-packages.html,legitimate_interest,email_verified,21.25,"Book all-inclusive Chicago Umrah Packages 2026 with Alhaq Tours. Get flights, visa, transport, and hotels near Haramain at the best prices."
Alhaq Travel,quotes@alhaqtravel.co.uk,020 34757513,alhaqtravel.co.uk,https://www.alhaqtravel.co.uk/contact-us,unknown,email_verified,26.42,Contact US | Alhaq Travel UK  | 020 34757513
Alharam travel,info@alharamtravel.co.uk,+447417471247,alharamtravel.co.uk,https://www.alharamtravel.co.uk/offers/umrah-packages-london,legitimate_interest,email_verified,24.73,"We offer Umrah packages from London with the arrangements of your choice at any time of 2026. Return flights from London. 5 star, 4 star, and 3 star hotel options in Makkah and Medina. We make your Umrah tour affordable with advance Umrah Services. Savings up to 30%, flexible payment options."
ATOL Protected Hajj & Umrah,info@alhijaztours.net,0121 777 2522 693,alhijaztours.net,https://alhijaztours.net,legitimate_interest,email_verified,25.25,"Book ATOL-protected Umrah Packages 2026 from the UK with flights, 5★–3★ hotels & transport included. Trusted Hajj & Umrah travel experts."
Almaknoontravels,info@almaknoontravels.co.uk,+44 208 4786 886,almaknoontravels.co.uk,https://almaknoontravels.co.uk/contact-us,legitimate_interest,email_verified,21.25,Contact Us
Hajj – AlSafwa Tours,info@safwatours.com,+1 (872) 263-9805,alsafwatours.com,https://alsafwatours.com/hajj,legitimate_interest,email_verified,21.25,Hajj
Shafie Travels,info@alshafietravels.com,+1(718) 973-9626,alshafietravels.com,https://alshafietravels.com/umrah-packages-houston,legitimate_interest,email_verified,23.92,"Explore Umrah packages from Houston 2026 with flights, hotels and visa support. Check Umrah packages Houston prices and plan your trip with Al Shafie Travels."
Bismillah Hajj and Umrah Services,bismillahhajj2000@hotmail.com,,bismillahhajj.com,https://bismillahhajj.com,unknown,email_verified,21.25,Home - Bismillah Hajj and Umrah Services 416.883.9693 bismillahhajj2000@hotmail.com Home About Us Umrah Packages November Umrah December Umrah Hajj 2025 How to Register Important Information Important Places Common Questions Articles to Pack Arabic Words to Know Seminar Details Hajj Visa Requirements Contact Us Select
Bismillah Travel,info@bismillahtravel.co.uk,0208 145 7860,bismillahtravel.co.uk,https://www.bismillahtravel.co.uk/umrah-from-leicester.html,legitimate_interest,email_verified,25.20,"Book your Umrah package from Leicester with Bismillah Travel. All-inclusive Umrah packages with flights, 3-5 star hotels, visa services, transport & ziyarat tours."
Bismillahtravels,info@bismillahtravels.ca,,bismillahtravels.ca,https://www.bismillahtravels.ca/about.php,legitimate_interest,email_verified,21.25,desc
Bismillah Travels Canada,info@bismillahtravels.ca,403-536-8328,bismillahumrah.com,https://bismillahumrah.com/Packages/Contact,legitimate_interest,email_verified,21.25,Cheap Economy to 5 Star Umrah Packages from Toronto Montreal Calgary Saskatoon Edmonton to Jeddah Madina with side trip to Pakistan India Dubai Cairo Istanbul
Bukhari Tours,info@bukharitours.com,+44 7513 311939,bukharitours.co.uk,https://bukharitours.co.uk/contact-us,legitimate_interest,email_verified,25.25,"Get in touch with Bukhari Tours, the UK’s trusted Hajj & Umrah travel agency. Serving Manchester, London & Birmingham with expert Islamic travel guidance."
Caravanhajjumrah,info@caravanhajjumrah.com,+44 7428 786445,caravanhajjumrah.com,https://www.caravanhajjumrah.com,legitimate_interest,email_verified,24.88,"Experience a seamless Hajj or Umrah pilgrimage with our expert guidance. We offer affordable packages from London, UK. Including flights, visa assistance, accommodation, and 24/7 support. Book your spiritual journey today by Caravan Hajj & Umrah."
Umrah Travel & Halal Tours Company,enquiry@crescenttours.com.au,0420 800 894,crescenttours.com.au,https://crescenttours.com.au/Home/ContactUs,unknown,email_verified,25.20,"With 78 years of experience, Crescent Tours offers premium, all-inclusive Halal & Umrah travel in Australia. Travel with experts who make every trip extraordinary!"
Dar El Mecca,darelmecca94@gmail.com,+1 919-426-2061,darelmecca.com,https://darelmecca.com/houston-umrah-packages,unknown,email_verified,21.25,"Explore trusted Umrah Packages from Houston with expert support, premium accommodations, and personalized planning—guided by Dar El Mecca."
Dawah Travels,info@dawahtravels.com,+1 (631) 772 0992,dawahtravels.com,https://dawahtravels.com/los-angeles-umrah-packages,legitimate_interest,email_verified,23.92,"Book Los Angeles Umrah Packages. We offer affordable packages from the USA with visa, flights & hotels included. Easy, fast, & service."
DawnTravels.com,sales@dawntravels.com,+1 212 244 1818,dawntravels.com,https://dawntravels.com/hajj.htm,legitimate_interest,email_verified,23.92,"Dawn Travels is offering the best Hajj packages from New York, Los Angeles, Houston and Chicago, USA. Book your affordable Hajj Package with us now."
Dua Travels,sales@duatravels.co.uk,+44 7407 897415,duatravels.co.uk,https://duatravels.co.uk/umrah-packages-london,legitimate_interest,email_verified,23.92,"Book the best and affordable online Umrah packages from London with the most trusted umrah agent of the UK. Visit us at Dunton Rd., London SE1 5UN, UK!"
Embassy Tours,booking@embassytours.com,+1 121-356-95950,embassytourshajjandumrah.com,https://embassytourshajjandumrah.com/about,unknown,email_verified,25.60,"Hajj & Umrah Packages from the USA – Embassy Tours Embassy Tours is your trusted partner for meaningful Hajj and Umrah experiences from the USA to the Holy Cities. With expertly designed pilgrimage packages departing from Los Angeles, New York, and other major cities, we guide you on every step of your sacred journey."
Euro Bangla Tours,info@eurobanglatours.com,0121 773 7700,eurobanglatours.co.uk,https://www.eurobanglatours.co.uk,legitimate_interest,email_verified,26.29,"Trusted Hajj & Umrah travel agency in Birmingham. Premium pilgrimage packages, expert guidance, visa processing. Experience the spiritual journey of a lifetime. Book now!"
Falcon Travel,info@falcontravel.ca,1-844-774-2828,falcontravel.ca,https://falcontravel.ca,legitimate_interest,email_verified,25.20,"Falcon Travel offers Hajj, Umrah, Saudi visa services, and Islamic tours for Muslims across Canada. Trusted travel agency serving pilgrims since 1980."
FJ Travel And Tours,fjtravels@yahoo.com,+1 905-461-0959 20,fjtravels.com,https://fjtravels.com/about-us,unknown,email_verified,26.92,Years of Experience
flywelltravel.co.uk,info@flywelltravel.co.uk,0116 273 9666,flywelltravel.co.uk,https://www.flywelltravel.co.uk,legitimate_interest,email_verified,23.92,"Specialist in Hajj, Umrah, Worldwide Flights, Package Tours, Holidays and Bespoke Honeymoon Packages"
Hajj Packages – ZamZam Hajj,info@hajj.com.au,1300 730 693,hajj.com.au,https://hajj.com.au/packages,legitimate_interest,email_verified,21.25,Hajj Packages
Hajj & Umrah Trips,info@hajjandumrahtrips.com,,hajjandumrahtrips.com,https://hajjandumrahtrips.com/umrah-packages/dallas,legitimate_interest,email_verified,16.25,Umrah Packages From Dallas
"Travel Packages In Chicago, IL",hello@hajjmakkahtours.com,60659 (773) 338-0720,hajjmakkahtours.com,https://www.hajjmakkahtours.com,legitimate_interest,email_verified,26.43,"Welcome to Makkah Tours & Travel Inc. in Chicago, IL offering Tour Packages, Hajj Packages, Umrah Group, Umrah Packages and more."
HAJJ 2026,info@hajjmontreal.com,514-963-2792,hajjmontreal.com,https://www.hajjmontreal.com/economy-package,legitimate_interest,email_verified,24.83,"Experience the sacred journey of Hajj with our Economy Package. Enjoy comfortable accommodations at the Razana Alrawdah Hotel in Makkah, ensuring a fulfilling pilgrimage at an affordable price. This package offers essential amenities and services to make your spiritual journey memorable."
All,info@hajjumrahhub.com,571-800-0706,hajjumrahhub.com,https://www.hajjumrahhub.com/chicago-umrah-packages.html,legitimate_interest,email_verified,23.92,"Book all-inclusive Umrah packages from Chicago with flights, hotels, visa, and transport. Enjoy budget and luxury options with expert support for a stress-free pilgrimage."
Hajj Umrah Services,info@hajjumrahservices.co.uk,02) 038 921 821,hajjumrahservices.co.uk,https://hajjumrahservices.co.uk/leeds-umrah-packages,legitimate_interest,email_verified,21.25,We have helped thousands of pilgrims fulfil their spiritual journey through leeds umrah packages. Enjoy special discounts on booking with us!
Umrah Packages Birmingham,sales@haleema.co.uk,0158 234 3075,haleema.co.uk,https://www.haleema.co.uk/umrah-birmingham/birmingham-umrah-packages,legitimate_interest,email_verified,25.81,"Birmingham Umrah Packages in 2026, lets travel with Haleema Limited for a secure and hassle-free journey."
Hilal Hajj and Umrah,hilalhajj@gmail.com,75074 (945) 900-2333,hilalhajj.com,https://hilalhajj.com,unknown,email_verified,21.25,"We strive to provide the best services to the guests of Allah. At Hilal Hajj & Umrah, our goal is to maintain, and exceed the highest quality  services offered by any licensed Hajj Agent in the United States. For over 20 years, we established ourselves as a market leaders in offering exceptional Hajj packages. Our uniq"
Hisar Tour Hajj Umrah,hisartour@uama.us,07013 (201) 201 8992,hisartour.com,https://hisartour.com/package/hajj-package-new-york-jfk-platinum,unknown,email_verified,21.25,"Plan Hajj 2026 from NYC. Learn how to register on Nusuk, fund your eWallet, and match flights from JFK/EWR to your package. Free Register."
Ibadah Tours,info@ibadahtours.com,020 8004 6786,ibadahtours.com,https://www.ibadahtours.com/hajj-packages,legitimate_interest,email_verified,25.31,Follow the Messanger of Allah's words and start your pilgrimage to the House of Allah. Ibadah Tours have created Hajj packages to make this easy.
International Hajj,info@internationalhajj.com,10001 212-967-9797,internationalhajj.com,https://internationalhajj.com/new-york-umrah-packages,legitimate_interest,email_verified,21.25,"Book affordable Umrah packages from New York with flights, hotels, and Ziyarats. Call us now to get all-inclusive New York Umrah packages."
Islamic Travel,info@islamictravel.com.au,1800 960 785,islamictravel.com.au,https://islamictravel.com.au,legitimate_interest,email_verified,25.15,"Australia's leading Muslim-friendly tour agency. Halal-friendly tours, Umrah packages & curated holidays. 226+ 5-star reviews. 1800 960 785."
Kaabah Tours,info@kaabahtours.com,437) 826-7786,kaabahtours.com,https://www.kaabahtours.com/toronto-umrah-packages.html,legitimate_interest,email_verified,21.25,"Book Umrah packages from Toronto with Kaabah Tours. All-inclusive 3, 4 & 5 star packages with flights, visa, hotels & transport. Trusted Canadian agency."
Kasbah Holidays,info@kasbahholidays.com,514) 225-3713,kasbahholidays.com,https://kasbahholidays.com,legitimate_interest,email_verified,21.25,Kasbah Holidays est une agence de voyage à Montréal spécialiste du pèlerinage offrant un séjour personnalisé et des forfaits Hajj et Omra.
Kasfah Hajj Travels,info@kasfahhajj.com,+1 (204)- 930-1352,kasfahhajj.com,https://kasfahhajj.com,legitimate_interest,email_verified,23.92,Kasfah Hajj Travels
King Travel Can Ltd,milton@kingtravelcan.com,,kingtravelcan.com,https://kingtravelcan.com/travel-agency-in-milton,unknown,email_verified,26.65,Office Hours
Kiswa Tours,contact@kiswatours.com,+1 289 222 2786,kiswatours.com,https://www.kiswatours.com/Umrah/umrah-package-january-2025,legitimate_interest,email_verified,21.25,"Umrah Package for January 2025 from Toronto, Edmonton, or Montreal. Get the best Umrah & Hajj 2025 packages, including visa from Canada."
Labayk Hajj,info@labaykhajj.ca,+1 613 371-6363,labaykhajj.ca,https://labaykhajj.ca/homepage-2,legitimate_interest,email_verified,25.44,Labayk Hajj take pride in planning for Canadian Muslims who are wishing to perform Hajj or Umrah.
Labbaik Hajj Umrah,info@labbaikhajjumrah.co.uk,02038656950 07598865272,labbaikhajjumrah.co.uk,https://www.labbaikhajjumrah.co.uk/umrah-packages-birmingham,legitimate_interest,email_verified,21.25,"Umrah Packages Birmingham 2026 include luxury to budget stays with flights, transport, and visa. Let's plan with Labbaik Hajj Umrah for Umrah from Birmingham."
Luton umrah Tours,webmaster@lutonumrahtours.com,,lutonumrahtours.com,https://lutonumrahtours.com/cgi-sys/suspendedpage.cgi,unknown,email_verified,16.25,Account Suspended Account Suspended This Account has been suspended. Contact your hosting provider for more information.
Madina Travel Nottingham,info@madinatravelnottingham.co.uk,0115 837 8626,madinatravelnottingham.co.uk,https://madinatravelnottingham.co.uk/hajjpackages,legitimate_interest,email_verified,26.65,Hajj & Umrah Packages
Muslims Holy Travel,info@muslimsholytravel.co.uk,0203 900 0310,muslimsholytravel.co.uk,https://www.muslimsholytravel.co.uk/hajj-packages-london,legitimate_interest,email_verified,25.37,"Get a perfect chance to embark on the soulful Hajj voyage with all-inclusive Hajj packages for the Muslim residents of London, by Muslims Holy Travel."
Nasser Travel,abdifatah@nassertravel.com,1-877-778-0277,nassertravel.com,http://www.nassertravel.com,unknown,email_verified,25.10,"Lorem ipsum dolor sit amet, consectetur adipisicing elit, sed do eiusmod tempor incididunt ut labore et  dolore magna incididunt ut labore aliqua."
Flexible Dallas Umrah Plans,info@onemoreholiday.com,+1 (571) - 484 3683 54,onemoreholiday.com,https://onemoreholiday.com/city/umrah-packages-from-dallas,legitimate_interest,email_verified,21.25,"Explore Umrah packages from Dallas with One More Holiday. Compare deals, customise your package, and get expert support for your journey."
"Umrah Packages from Detroit, Michigan",info@qiblatain.com,+19145200581,qiblatain.com,https://www.qiblatain.com/detroit-umrah-packages.html,legitimate_interest,email_verified,21.25,"Explore budget-friendly Umrah deals from Detroit with Qiblatain USA. 10+ years of experience, complete packages, and expert support. Women-only groups are available."
Qibla Travels,info@qiblatravels.com,020 8558 4848,qiblatravels.com,https://www.qiblatravels.com/about,legitimate_interest,email_verified,25.37,"Qibla Travels Ltd is a dedicated corporate Hajj, Umrah, and Halal Holidays travel agency. We provide you best Hajj and Umrah packages UK."
Salah Travels,info@salahtravels.com,+1 224 244 5040,salahtravels.com,https://salahtravels.com/umrah-packages-from-new-york,legitimate_interest,email_verified,23.92,Salah Travels presents meticulously Umrah packages from New York that enable travelers to concentrate on their relationship with Allah.
Hajj & Umrah Services,info@shahtravel.co.uk,078664 10109,shahtravel.co.uk,https://www.shahtravel.co.uk,legitimate_interest,email_verified,21.25,Trusted Hajj & Umrah provider in Leeds since 2003 | We have helped thousands of pilgrims fulfil their spiritual journey. Book your tour with us today!
Shery Travels,info@sherytravels.com,+1 667-439-1263,sherytravels.com,https://sherytravels.com/umrah/usa-packages/chicago,legitimate_interest,email_verified,25.87,"Start your Umrah journey from Chicago with Shery Travels. Easy departures from O'Hare, group travel with Chicago's Muslim community, and full guidance for a smooth and spiritual pilgrimage."
Sukoon Travels,info@sukoontravels.com,1-888-358-6724,sukoontravels.com,https://sukoontravels.com/hajj-packages-from-montreal,legitimate_interest,email_verified,25.31,"Book your Hajj from Montreal with Sukoon Travels. Enjoy seamless travel, visa support, and trusted service for a safe and spiritually fulfilling journey."
Sunnah Foundation Hajj & Umrah,labbayk@sunnahhajj.com,+1300 850 250,sunnahhajj.com,https://sunnahhajj.com,unknown,email_verified,21.25,"The Journey Of A Lifetime.
Hajj & Umrah Packages"
Taibah Travels,info@taibahtravels.com,+1 (206) 848-5272,taibahtravels.com,https://taibahtravels.com/detroit-mi,legitimate_interest,email_verified,25.31,"Experience top Umrah services in Detroit, MI, with Taibah Travels, offering visa assistance, direct flights, and convenient packages for your pilgrimage needs."
TakeMeToUmrah.com,info@takemetoumrah.com,1-888-358-6724,takemetoumrah.com,https://takemetoumrah.com,legitimate_interest,email_verified,21.25,"Trusted Umrah packages with expert guidance, care, and spiritual focus. Experience the blessings of Umrah & visiting the Prophet ﷺ – a Journey of the Heart ❤"
Taqwa Tours LTD,info@taqwatours.co.uk,02071128005 4,taqwatours.co.uk,https://taqwatours.co.uk/umrah-packages-from-glasgow,legitimate_interest,email_verified,21.25,"Book cheap Umrah package from Glasgow. 5-star for 7-night Umrah in £875/pp 10 N:£975. 3-5 stars 7,14 & 21 days. Book now for £49."
Taqwa Tours,info@taqwatours.us,1 2 3 4 5 6 7 8 9 10 10,taqwatours.us,https://taqwatours.us/umrah-packages/dallas,legitimate_interest,email_verified,21.25,"Efficient, affordable Umrah packages from Dallas with visa, flights, and halal hotels"
Umrah Packages From Los Angeles 2026,info@tarteeltravel.com,+1 (215)-277-7474,tarteeltravel.com,https://www.tarteeltravel.com/umrah-packages/los-angeles,legitimate_interest,email_verified,25.31,Embark on a sacred Umrah from Los Angeles. Tarteel Travel provides luxury packages with top-tier logistics for a peaceful and organized journey.
Customized Umrah Package Builder,support@umrahcompanions.com,+92 333 3862347,umrahcompanions.com,https://umrahcompanions.com/contact-us,legitimate_interest,email_verified,21.25,"Get Umrah packages for Hotels, Transport, Flights Visa bookings and much more as per your needs. We are your companion in the spiritual journey of Umrah."
UmrahHosting,info@umrahhosting.com,+966 56 648 3994,umrahhosting.com,https://umrahhosting.com/packages/usa/houston,legitimate_interest,email_verified,21.25,"Our Umrah Packages Houston from IAH feature direct flight options, luxury hotels steps from the Kaaba, Haramain train, and personal guidance."
Umrah Packages London,info@umrahpackageslondon.com,020 30110793,umrahpackageslondon.com,https://umrahpackageslondon.com,legitimate_interest,email_verified,25.52,"If you are looking for a trustworthy and affordable Islamic travel agency in the UK for Umrah, Umrah Packages London can help."
Umrah Packages UK,info@umrahpackagesuk.com,+44 7404 037532,umrahpackagesuk.com,https://umrahpackagesuk.com/umrah-packages-leicester,legitimate_interest,email_verified,21.25,"Book all-inclusive Umrah Packages Leicester starting @ £250 with 3-5 star hotels near haram, Visa, flights, transport & ziyarat."
YOUSAF RELIGIOUS TOURS LTD,info@yrtours.co.uk,+44 7940 452 869,yrtours.co.uk,https://yrtours.co.uk,legitimate_interest,email_verified,21.25,Book Your Hajj & Umrah Journey with Confidence
Plan Your Umrah Today,info@ziyufalrahman.co.uk,+44 161 949 4499,ziyufalrahman.co.uk,https://ziyufalrahman.co.uk/city/birmingham-umrah-packages,legitimate_interest,email_verified,21.25,"Book Birmingham Umrah packages for 2026 with a UK-based, ATOL-protected agency Ziyuf Al Rahman. Get clear prices & visa support."
Perfect Umrah and Travels Ltd,,020 8150 6556,2hajj.com,https://2hajj.com/umrah-packages-leicester,unknown,phone_verified,10.17,"Book affordable Umrah packages 2026 UK from £599. ATOL protected packages with flights, 4-5 star hotels near Haram, visa & Ziyarat. Perfect Umrah and Travels Ltd - Your trusted partner for spiritual journeys."
hidaayah,,0121 753 7890,al-hidaayah.travel,https://www.al-hidaayah.travel,unknown,phone_verified,7.50,"Whether you are looking for UK Hajj packages, UK umrah packages, Islamic holidays, or educational islamic tours, you can be sure to find them all with us."
Affordable & Trusted Deals from USA,,929)-833-1717,alhamdtravel.com,https://www.alhamdtravel.com/hajj-packages.html,unknown,phone_verified,10.17,"Book Hajj packages from the USA with AlhamdTravel, licensed & all-inclusive options starting at $6,405. Departures from New York, Chicago, Houston & more."
Haramain Travels,,+61 422 037 453,alharamaintravels.com.au,https://alharamaintravels.com.au/contact,unknown,phone_verified,10.17,Get In Touch
"Umrah Packages from Dallas, Texas",,929)-833-1717,alhateemtours.com,https://www.alhateemtours.com/umrah-from-dallas.html,unknown,phone_verified,7.50,"Book Umrah packages from Dallas, Texas including flights, visa processing, and hotel stays. Choose 3-star, 4-star, or 5-star options with AlHateem Tours."
Affordable Umrah Packages in Birmingham,,+447366350606,alkabbatravels.com,https://www.alkabbatravels.com/birmingham,unknown,phone_verified,10.17,"Looking for affordable Umrah packages in Birmingham? Book now with AlkabbaTravels for trusted service, expert guidance, and great value."
Alkarim Travel & Tours,,6 1-403-454-8011,alkarimtraveltours.com,https://www.alkarimtraveltours.com/contact-us,unknown,phone_verified,12.48,Get in touch with Best Travel Agency in Calgary
Alkhair Travel,,+447481686598,alkhairtravel.co.uk,https://www.alkhairtravel.co.uk/book/umrah-packages-birmingham,unknown,phone_verified,11.03,"AlKhair Travel is your one-stop agency to plan & book Umrah packages from Birmingham with all necessary arrangements. Consult our Umrah experts to choose duration, schedule as per holidays, flights, departure airport, hotel, transport and other necessary arrangements as per your budget and comfort requirements. Avail e"
Amax Travel,,+966 59 288 315 2255,amaxtravel.ca,https://www.amaxtravel.ca/contact,unknown,phone_verified,13.17,Send us a message
Best Life Tour and Travel,,+1 (416) 903-9250,bestlifetourandtravel.ca,https://www.bestlifetourandtravel.ca,unknown,phone_verified,11.16,"Best Life Tour and Travel, located in Mississauga, Ontario is proud to offer tours and flights packages to all people in the world and specially in North America, besides offering Hajj and Umrah packages to Muslims in Canada  . We at Best Life Tour ..."
Bismillah Tours,,929)-833-1717,bismillahtours.com,https://www.bismillahtours.com/houston-umrah-packages.html,unknown,phone_verified,7.50,Discover Affordable Umrah Packages from Houston - Reserve Your Spiritual Journey Now for a Memorable Experience!
Umrah Packages Canada 2026,,+1 (647) 704-2525,canadaumrah.com,https://canadaumrah.com,unknown,phone_verified,11.27,"Affordable Umrah Packages from Canada 2026. IATA certified travel agency offering economy to luxury packages with flights, hotels & visa. Book now from $1,295!"
Cheetah Travel Australia Australia,,+61 475 001 002,cheetahtravel.com.au,https://cheetahtravel.com.au,unknown,phone_verified,11.23,"Join us for an unforgettable Umrah experience this September/November 2026 with Cheetah Travel Centre . Let us guide you through a spiritually enriching journey designed for your comfort, convenience, and connection."
Chicago Sisters Umrah,,1-866-327-7252,dstworldtravel.com,https://dstworldtravel.com/chicagosisters,unknown,phone_verified,7.50,Chicago Sisters Umrah
Classy Travel,,+1-514-448-0788,hajj.classytravel.ca,https://hajj.classytravel.ca,unknown,phone_verified,11.31,"Classy Travel, located in Montreal -is proud to offer Hajj and Umrah packages to Muslims infor this season. We at Classy Travel have the experience and knowledge to manage a successfull campaign through our years of experience."
Hajj & Umrah Packages from the UK,,+44 7469063125,hajjumrahjourney.co.uk,https://www.hajjumrahjourney.co.uk/en/services/hajj-packages,unknown,phone_verified,7.50,Hajj Packages
HalalTrek,,01582 583 103,halaltrek.com,https://www.halaltrek.com/agents/yousaf-religious-tours,unknown,phone_verified,7.50,Yousaf Religious Tours is a Hajj and Umrah company established and based in Luton since 2004. We provide customised Umrah and Hajj packages throughout the...
iLink Tours,,+1-516-347-1175 15,ilinktours.com,https://ilinktours.com/new-york-city-umrah-package,unknown,phone_verified,7.50,"Perform Umrah with our first-class New York City Umrah Package starting at $695. Enjoy flights, 5-star hotel stays, guided Ziyarat, eVisa service, insurance, and full ground transport."
Moti Tours and Tourism,,0116 2372 520,motitours.co.uk,http://www.motitours.co.uk,unknown,phone_verified,11.69,Moti tours is one of the oldest hajj and umrah tour operator in leicester.specialized in hajj and umrah group packages.Call on 0116 2372 520
Bismillah Hajj And Umrah Services,,416-883-9693,muslimlink.ca,https://muslimlink.ca/directory/kitchener-waterloo/travel/hajj-umrah-tours/5530-bismillah-hajj-and-umrah-services,unknown,phone_verified,7.50,Hajj & umrah tour with Punjabi/Urdu speaking staff.
