company,contact_name,role,email,phone,domain,source_url,source_label,consent_status,verification_status,overall_score,raw_text_snippet
YOUR TRAVEL CONSULTANT,,Procurement Manager,info@mimmtravel.com,+6011 1029 7879,mimmtravel.com,https://mimmtravel.com,Public website crawl,legitimate_interest,email_verified,25.15,YOUR TRAVEL CONSULTANT UTAMA MIMM TRAVEL UMRAH HAJI LUAR NEGARA DALAM NEGARA INSURANS & VISA HUBUNGI 03 4162 7879 +6011 1029 7879 info@mimmtravel.com UTAMA MIMM TRAVEL UMRAH HAJI LUAR NEGARA DALAM NEGARA INSURANS & VISA HUBUNGI UTAMA MIMM TRAVEL UMRAH HAJI LUAR NEGARA DALAM NEGARA INSURANS & VISA HUBUNGI MAKLUMAT LANJU
Worldwide Travel Tour Ism,,Procurement Manager,info@worldwidetraveltourism.nz,+91 9711198463,worldwidetraveltourism.nz,https://www.worldwidetraveltourism.nz/hajj-packages,Public website crawl,legitimate_interest,email_verified,25.15,Explore most popular and recommended Hajj packages from New Zealand. We committed to provide quality Hajj program at any cost to pilgrimage Hajj 2025
Alharam travel,,Procurement Manager,info@alharamtravel.co.uk,+447417471247,alharamtravel.co.uk,https://www.alharamtravel.co.uk,Public website crawl,legitimate_interest,email_verified,25.10,"Book discounted hotels, buy lowest fare flights and enjoy exceptional planning of your Umrah trip or Halal holidays. We are experienced to plan, book and organize everything in advance."
Islamic Travel Agency,,Procurement Manager,info@islamictravelagency.co.uk,+447951138405,islamictravelagency.co.uk,https://www.islamictravelagency.co.uk/umrah-packages.html,Public website crawl,legitimate_interest,email_verified,25.10,"Umrah packages from UK are offered by Islamic Travel Agency starting around £395-£899. Get All-inclusive cheap Umrah deals for families, groups or individual pilgrims."
In Saff Travel & Tours Sdn. Bhd,,Procurement Manager,insafftravel@gmail.com,+601131274002,insafftravel.com.my,https://insafftravel.com.my,Public website crawl,unknown,email_verified,25.10,"In Saff Travel & Tours menyediakan pakej Umrah dan Haji lengkap dengan bimbingan mutawwif berpengalaman, perjalanan selesa serta pengurusan yang profesional."
MARAM TOURS & TRAVEL,,Procurement Manager,manager@maramtravel.com,212)-523-0314,maramtravel.com,https://www.maramtravel.com,Public website crawl,unknown,email_verified,25.10,Hajj & Umrah Agency Specializing in Hajj & Umrah Packages from USA for Over 25 Years. We offer Affordable Hajj Packages and Deluxe Hajj Packages. We offer Affordable as well as Deluxe Umrah Packages from USA and Canada. We offer Umrah packages from New York and offer Nationwide Umrah  Packages.
Mekka Travel,,Procurement Manager,info@mekka-travel.com,+49 1575 5743087,mekka-travel.com,https://mekka-travel.com/umrah,Public website crawl,legitimate_interest,email_verified,25.10,Umrah 2026 mit Mekka Travel GmbH | Dein Partner für spirituelle und zuverlässige Umrah Reisen. Sichere dir jetzt dein Ticket nach Mekka.
Sohail Waqas Travel,,Procurement Manager,info@sohailwaqas.com,+92 303 5655552,sohailwaqas.com,https://sohailwaqas.com/hajj-packages-australia-prices-services-trusted-agents,Public website crawl,legitimate_interest,email_verified,25.06,"Discover 2025 Hajj packages from Australia with 5-star hotels, expert guidance, and affordable deals. Book with Sohail Waqas Travels for a seamless pilgrimage."
Sohail Waqas Travel,,Procurement Manager,msr@sohailwaqas.com,+92 303 5655552,sohailwaqas.com,https://sohailwaqas.com/hajj-packages-australia-prices-services-trusted-agents,Public website crawl,unknown,email_verified,25.06,"Discover 2025 Hajj packages from Australia with 5-star hotels, expert guidance, and affordable deals. Book with Sohail Waqas Travels for a seamless pilgrimage."
umrah and hajj travel agency,,Procurement Manager,info@ummahtravels.org,+1-980-349-3280,ummahtravels.org,https://ummahtravels.org/services,Public website crawl,legitimate_interest,email_verified,25.06,Ummah Travels offers safe and affordable Hajj and Umrah journeys for East African communities and the Muslim Ummah. Experience spiritually fulfilling travel with our dedicated services tailored to your needs.
Zahafiz Travel & Tours Sdn Bhd,,Procurement Manager,zahafiz_travel@yahoo.com,60122389544,zahafiztravel.com,https://zahafiztravel.com,Public website crawl,unknown,email_verified,25.06,"Zahafiz Travel & Tours ingin mengajak anda semua untuk menikmati ibadah dan pengalaman Haji, Umrah & Muslim Tours yang paling bermakna. Lihat Pakej »"
Hajj & Umrah Experts,,Procurement Manager,info@buraqtravelsusa.com,+1 888-617-3061 690,buraqtravels.com,https://www.buraqtravels.com,Public website crawl,legitimate_interest,email_verified,25.04,Your Trusted Partner for Hajj Umrah & Islamic Tourism
Shahzada Travel,,Procurement Manager,info@shahzadatravel.com,+49-123-456-7890,shahzadatravel.com,https://shahzadatravel.com,Public website crawl,legitimate_interest,email_verified,25.02,"Discover Shahzada Travel, your premier travel agency in Germany. We specialize in travel tickets, visa assistance, hotel bookings, and Hajj travel packages to Saudi Arabia. Experience seamless travel planning with our expert services tailored for your needs."
"Hajj, Umrah and Leisure Travel Services",,Procurement Manager,info@itstimetotravel.co.za,021 001 2044,timetotravel.africa,https://timetotravel.africa,Public website crawl,legitimate_interest,email_verified,25.02,"Time To Travel – Hajj, Umrah and Leisure Travel Services Home About Us Meet The Team Hotels Umrah Packages Umrah Groups Leisure Mauritius Kenya Contact Home About Us Meet The Team Hotels Umrah Packages Umrah Groups Leisure Mauritius Kenya Contact Time To Travel Established in December 2018, Our Company specializes in H"
ITravelBest,,Procurement Manager,info@itravelbest.com,972) 837-5009,itravelbest.com,https://www.itravelbest.com,Public website crawl,legitimate_interest,email_verified,24.98,"When it comes to embarking on a spiritual journey like Umrah or planning your dream vacation, you deserve nothing but the best. In the vibrant city of Dallas,"
Noussouki Travel,,Procurement Manager,reservation.noussouki@gmail.com,+33 7 45 46 61 50,noussoukitravel.com,https://www.noussoukitravel.com,Public website crawl,unknown,email_verified,24.98,"Omra 2025 – 2026 avec Noussouki Travel, votre agence Hajj & Omra. Forfaits adaptés à tous les besoins. Contactez-nous au +33 1 79 36 01 66 !"
King Travel Can Ltd,,Procurement Manager,hajj@kingtravelcan.com,5464) 905-624-8555,kingtravelcan.com,https://kingtravelcan.com/contact-king-travel-booking-and-inquiries,Public website crawl,unknown,email_verified,24.95,"Get in touch with King Travel Canada for expert assistance on Umrah and Hajj packages, flight bookings, and Saudi visa services. Our dedicated team is here to help you every step of the way."
King Travel Can Ltd,,Procurement Manager,umrah@kingtravelcan.com,5464) 905-624-8555,kingtravelcan.com,https://kingtravelcan.com/contact-king-travel-booking-and-inquiries,Public website crawl,unknown,email_verified,24.95,"Get in touch with King Travel Canada for expert assistance on Umrah and Hajj packages, flight bookings, and Saudi visa services. Our dedicated team is here to help you every step of the way."
Awtar Tours,,Procurement Manager,info@awtartours.com,+20 106 087 2795,awtartours.com,https://awtartours.com,Public website crawl,legitimate_interest,email_verified,24.95,"Experience unforgettable journeys with Awtar Tours. Specializing in Hajj, Umrah, and global travel, we prioritize exceptional customer service and tailor-made packages to meet your needs. Join us for a remarkable adventure that lasts a lifetime."
Irshaad Travel,,Procurement Manager,info@irshaadtravel.com,+31 6 87 36 42 77,irshaadtravel.com,https://www.irshaadtravel.com,Public website crawl,legitimate_interest,email_verified,24.95,"Boek jouw zorgeloze Umrah-reis met Irshaad Travel. Kies uit volledig verzorgde pakketten inclusief vliegticket, hotels, visum en begeleiding. Verblijf in Madinah en Makkah."
IFI Hajj and Umrah,,Procurement Manager,info@islamicfoundation.ie,00 353 1) 4532 785,islamicfoundation.ie,https://islamicfoundation.ie/services/hajj-and-umrah,Public website crawl,legitimate_interest,email_verified,24.91,"Every year, millions of Muslims worldwide make the journey to Makkah for the annual pilgrimage (Hajj). Dressed in the same simple white clothing to represent human equality, the pilgrims gather to..."
Alsha Tours,,Procurement Manager,info@alshatravel.com,129-00-5566-677-6,alshatravel.com,https://www.alshatravel.com/biaya-umroh,Public website crawl,legitimate_interest,email_verified,24.88,"Biaya umroh 2026 - 2027 mulai dari Rp 24.999.000 fasilitas bintang 3, free city tour thaif bersama Alsha Tours - travel umroh akreditasi A dan berizin resmi U. 401/2020."
Caravan Hajj Umrah,,Procurement Manager,info@caravanhajjumrah.com,+44 7428 786445,caravanhajjumrah.com,https://www.caravanhajjumrah.com,Public website crawl,legitimate_interest,email_verified,24.88,"Experience a seamless Hajj or Umrah pilgrimage with our expert guidance. We offer affordable packages from London, UK. Including flights, visa assistance, accommodation, and 24/7 support. Book your spiritual journey today by Caravan Hajj & Umrah."
Hisar Europe Travel,,Procurement Manager,info@hisareurope.com,+49 221 7474 0022,hisareurope.com,https://hisareurope.com,Public website crawl,legitimate_interest,email_verified,24.83,"45 yıllık tecrübemizle, Hac ve Umre turlarında üstün kalite anlayışıyla yanınızdayız. En özel turlar için Hisar Europe ayrıcalığını keşfedin."
Alharam Travel,,Procurement Manager,info@alharamtravel.com,888-608-1057,alharamtravel.com,https://www.alharamtravel.com,Public website crawl,legitimate_interest,email_verified,24.73,"AlHaram Travel is a leading Hajj & Umrah services provider that specializes in designing Hajj & Umrah packages for USA citizens. Select flights from nearest USA airport, choose near Haram hotel & get fast visa processing while booking all-inclusive Hajj & Umrah packages. Avail professional assistance from certified tra"
"Umrah & Hajj Packages Johor Bahru (JB), Travel Agency",,Procurement Manager,tiram@tiram.com.my,+60197149236,tiram.com.my,https://www.tiram.com.my,Public website crawl,unknown,email_verified,24.71,"Tiram Travel Sdn Bhd specializes in Umrah and Hajj packages, reservation for worldwide tickets (domestic & international), inbound and outbound packages, hotel reservations, transportation arrangements and visa applications."
Travel Umroh Terbaik di Jakarta,,Procurement Manager,info@dreamtour.co,021) 21381090,dreamtour.co,https://dreamtour.co/hajj,Public website crawl,legitimate_interest,email_verified,24.67,"PT Dream Tours and Travel adalah Travel Umroh Terbaik di Jakarta yang akan membantu Anda untuk mendapatkan pelayanan yang terbaik untuk perjalanan Umroh dan Liburan. 
    Menyediakan berbagai pilihan paket dengan biaya umroh 2026 - 2027 yang kompetitif dan relatif murah / hemat.Pilihan paket yang kami tawarkan mulai d"
Travel Umroh Terbaik di Jakarta,,Procurement Manager,bandung@dreamtour.co.id,021) 21381090,dreamtour.co,https://dreamtour.co/hajj,Public website crawl,unknown,email_verified,24.67,"PT Dream Tours and Travel adalah Travel Umroh Terbaik di Jakarta yang akan membantu Anda untuk mendapatkan pelayanan yang terbaik untuk perjalanan Umroh dan Liburan. 
    Menyediakan berbagai pilihan paket dengan biaya umroh 2026 - 2027 yang kompetitif dan relatif murah / hemat.Pilihan paket yang kami tawarkan mulai d"
Travel Umroh Terbaik di Jakarta,,Procurement Manager,surabaya@dreamtour.co,021) 21381090,dreamtour.co,https://dreamtour.co/hajj,Public website crawl,unknown,email_verified,24.67,"PT Dream Tours and Travel adalah Travel Umroh Terbaik di Jakarta yang akan membantu Anda untuk mendapatkan pelayanan yang terbaik untuk perjalanan Umroh dan Liburan. 
    Menyediakan berbagai pilihan paket dengan biaya umroh 2026 - 2027 yang kompetitif dan relatif murah / hemat.Pilihan paket yang kami tawarkan mulai d"
Dallas Tour & Travel,,Procurement Manager,info@dallastourtravel.com,+62 812 14 2000 64,dallastourtravel.com,https://www.dallastourtravel.com,Public website crawl,legitimate_interest,email_verified,24.64,"Dallas Tour & Travel (PT. Delta Laras Wisata) adalah Biro Perjalanan Wisata yang berdiri sejak Tahun 2013 dan telah mendapatkan izin resmi dari Kementerian Agama RI sebagai Penyelenggara Perjalanan Ibadah Umrah dan Penyelanggara Ibadah Haji Khusus . Selain Ticketing, Land Arrangement & Wisata halal , Dallas Tour & Trav"
Umrah and Islamic Tours,,Procurement Manager,sales@zashaworldtravel.com,+1-614-218-6667,zashaworldtravel.com,https://zashaworldtravel.com/islamic,Public website crawl,legitimate_interest,email_verified,24.64,"Umrah, Saudi, Makkah, Madinah, Jeddah, Riyadh, Islamic tour, Halal tour, AlUla, Saudi Arabia, Turkey, Istanbul, Qatar, Doha, Oman, Spain, Anadalusia, Granada, AlHambra, Malaga, Morocco, muslim owned, ohio, usa, hotels, visa,  Wellness, spiritual, incentive, family, groups, faith-based, pilgrimage, umrah preparation, um"
Denatour Travel,,Procurement Manager,operation@denatours.com,+6221) 7944584,denatours.com,https://denatours.com,Public website crawl,unknown,email_verified,24.58,"Denatour Travel berdiri sejak tahun 1995 , berpengalaman memberikan Pelayanan Umrah – Hajji Plus dan menjadi Travel Perintis Islamic tour Mancanegara di Indonesia. Kami Dewasa karna dukungan anda

Denatour Travel memilik Izin Umrah dan Hajji resmi dari Departement Agama sejak tahun 1996 dengan alamat gedung tetap dan t"
Shafie Travels,,Procurement Manager,info@alshafietravels.com,+1 (718) 973-9626,alshafietravels.com,https://alshafietravels.com/umrah-packages-houston,Public website crawl,legitimate_interest,email_verified,23.92,"Explore Umrah packages from Houston 2026 with flights, hotels and visa support. Check Umrah packages Houston prices and plan your trip with Al Shafie Travels."
Tarteeltravel,,Procurement Manager,info@tarteeltravel.com,+1 (215)-277-7474,tarteeltravel.com,https://www.tarteeltravel.com/umrah-packages/houston,Public website crawl,legitimate_interest,email_verified,23.92,"Book your Umrah from Houston with Tarteel Travel. Enjoy 5-star accommodation, expert guides, and a stress-free experience in the Holy Cities."
Kasfah Hajj Travels,,Procurement Manager,info@kasfahhajj.com,+1 (204)- 930-1352,kasfahhajj.com,https://kasfahhajj.com/umrah-packages,Public website crawl,legitimate_interest,email_verified,23.92,Umrah Packages
Ayesha Hajj & Umrah Services,,Procurement Manager,info@ahus.co.nz,+14083246340,ahus.co.nz,https://ahus.co.nz/hajj,Public website crawl,legitimate_interest,email_verified,23.92,"Discover a sacred expedition through our customized Hajj packages, where exceptional service intertwines with your profound spiritual odyssey. Delve into our assortment of packages and commence your auspicious pilgrimage."
Al Imam Hazz Kafela Travels & Tours,,Procurement Manager,alimam_hajjkafela@yahoo.com,১৭১০ ০১৮১৭-২২৫৪৯৯,alimamhazzkafela.com,https://alimamhazzkafela.com,Public website crawl,unknown,email_verified,23.92,Al Imam Hazz Kafela Travels & Tours – Hajj | Umrah | Air Ticket | Recruiting| Dedicated Visa Service | Hotel Booking হজ্জ লাইসেন্স - ৬১৯ ওমরাহ লাইসেন্স - ৩৯৬ রিক্রুটিং লাইসেন্স - ১৭১০ ০১৮১৭-২২৫৪৯৯ alimamhajkafela@gmail.com প্রসপেক্টাস হোম আল ইমাম আমাদের কথা অফিস কর্মকর্তা ও কর্মচারী সেবাসমূহ হজ্ব প্যাকেজ ওমরাহ প্যাকেজ
Al Imam Hazz Kafela Travels & Tours,,Procurement Manager,alimamhajkafela@gmail.com,১৭১০ ০১৮১৭-২২৫৪৯৯,alimamhazzkafela.com,https://alimamhazzkafela.com,Public website crawl,unknown,email_verified,23.92,Al Imam Hazz Kafela Travels & Tours – Hajj | Umrah | Air Ticket | Recruiting| Dedicated Visa Service | Hotel Booking হজ্জ লাইসেন্স - ৬১৯ ওমরাহ লাইসেন্স - ৩৯৬ রিক্রুটিং লাইসেন্স - ১৭১০ ০১৮১৭-২২৫৪৯৯ alimamhajkafela@gmail.com প্রসপেক্টাস হোম আল ইমাম আমাদের কথা অফিস কর্মকর্তা ও কর্মচারী সেবাসমূহ হজ্ব প্যাকেজ ওমরাহ প্যাকেজ
Al Imam Hazz Kafela Travels & Tours,,Procurement Manager,alimam_hajjkafela@yahoo.com,079-201-000000281,alimamhazzkafela.com,https://alimamhazzkafela.com/about-us,Public website crawl,unknown,email_verified,23.92,আল ইমাম হজ্জ কাফেলা ট্রাভেলস্‌ এন্ড ট্যুরস্
Al Imam Hazz Kafela Travels & Tours,,Procurement Manager,alimamhajkafela@gmail.com,079-201-000000281,alimamhazzkafela.com,https://alimamhazzkafela.com/about-us,Public website crawl,unknown,email_verified,23.92,আল ইমাম হজ্জ কাফেলা ট্রাভেলস্‌ এন্ড ট্যুরস্
Alraheem Travels,,Procurement Manager,info@alraheemtravels.com,+1 502 431 9860,alraheemtravels.com,https://alraheemtravels.com,Public website crawl,legitimate_interest,email_verified,23.92,Al Raheem Travels gives you the best Umrah deals in the USA 2025. Our aim to give our customers affordable Umrah packages from USA. Book Your Umrah Package From Us
Umrah & Travel — Arizona Trade Network,,Procurement Manager,info@phxsmilestudio.com,989164897837,arizonatradenetwork.com,https://www.arizonatradenetwork.com/classified-sales,Public website crawl,legitimate_interest,email_verified,23.92,"ATN has a place for business owners’ to put their business notifications, discounts, sales and updates to attract customers."
Umrah & Travel — Arizona Trade Network,,Procurement Manager,chocozerts@gmail.com,989164897837,arizonatradenetwork.com,https://www.arizonatradenetwork.com/classified-sales,Public website crawl,unknown,email_verified,23.92,"ATN has a place for business owners’ to put their business notifications, discounts, sales and updates to attract customers."
Baitullah Travels,,Procurement Manager,info@baitullahtravels.co.uk,+447465790372,baitullahtravels.co.uk,https://baitullahtravels.co.uk,Public website crawl,legitimate_interest,email_verified,23.92,Your trusted partner for Umrah and Hajj journeys.
buildertravelgmbh.de,,Procurement Manager,m.elwy@buildertravel.com,004915560807942,buildertravel.de,https://buildertravel.de/ar/%D8%A7%D9%84%D8%AD%D8%AC,Public website crawl,unknown,email_verified,23.92,22 مايو – 24 ذو القعدة الرحلة: كولن → القاهرة → جدة
buildertravelgmbh.de,,Procurement Manager,n.elwy@buildertravel.com,004915560807942,buildertravel.de,https://buildertravel.de/ar/%D8%A7%D9%84%D8%AD%D8%AC,Public website crawl,unknown,email_verified,23.92,22 مايو – 24 ذو القعدة الرحلة: كولن → القاهرة → جدة
Buraq Travels,,Procurement Manager,setsail@select.com,+1 888-617-3061 690,buraqtravels.com,https://www.buraqtravels.com/about-us,Public website crawl,unknown,email_verified,23.92,About Us
Al Buraq Travels Canada,,Procurement Manager,info@alburaqtravels.com,+1 208-208-3893,canada.alburaqtravels.com,https://canada.alburaqtravels.com,Public website crawl,legitimate_interest,email_verified,23.92,"Book premium Umrah packages from Canada. Includes flights, hotels near Haram, visa help, and transport. Start your seamless spiritual journey today!"
Darelhuda Hajj,,Procurement Manager,darelhudahajj@gmail.com,0031638799779,darelhudahajj.com,https://www.darelhudahajj.com,Public website crawl,unknown,email_verified,23.92,De mooiste herinneringen creëren we samen
Dawah Travels,,Procurement Manager,info@dawahtravels.com,+1 (631) 772 0992,dawahtravels.com,https://dawahtravels.com/los-angeles-umrah-packages,Public website crawl,legitimate_interest,email_verified,23.92,"Book Los Angeles Umrah Packages. We offer affordable packages from the USA with visa, flights & hotels included. Easy, fast, & service."
Dawn Travels,,Procurement Manager,info@dawntravels.com,+1 212 244 1818,dawntravels.com,https://dawntravels.com/umrah-package-from-miami.htm,Public website crawl,legitimate_interest,email_verified,23.92,"Book 5-star Miami Umrah Package for 5 nights stay with Dawntravels.com. Umrah from Miami, package includes airline ticket, ground transportation and ziyarat, eVisa processing, VIP hotel accommodation with breakfast."
Dawn Travels,,Procurement Manager,sales@dawntravels.com,+1 212 244 1818,dawntravels.com,https://dawntravels.com/umrah-package-from-miami.htm,Public website crawl,legitimate_interest,email_verified,23.92,"Book 5-star Miami Umrah Package for 5 nights stay with Dawntravels.com. Umrah from Miami, package includes airline ticket, ground transportation and ziyarat, eVisa processing, VIP hotel accommodation with breakfast."
Dua Travels,,Procurement Manager,sales@duatravels.co.uk,+44 7407 897415,duatravels.co.uk,https://duatravels.co.uk/umrah-packages-dublin,Public website crawl,legitimate_interest,email_verified,23.92,"Discover affordable and all-inclusive Umrah packages from Dublin with Dua Travels. Book 3, 4 & 5-star packages designed for people living in Dublin!"
Hajj and Umrah for Sisters,,Procurement Manager,info@eicsanjose.org,1 408 239 6668,eicsanjose.org,https://www.eicsanjose.org/wp/sisters-section/hajj-and-umrah-for-sisters,Public website crawl,legitimate_interest,email_verified,23.92,"Hajj and Umrah for Sisters | EIC - San Jose, CA Toggle navigation About Us Job Opening History Privacy Policy Board of Directors EIC BYLAWS EIC Bylaws EIC IT & Security Policy EIC Committees Religious Comm/Vision/Tech Construction Finance Operations Women’s Youth Volunteering Membership Information Subscribe to EIC e-M"
Hajj and Umrah for Sisters,,Procurement Manager,kaknajmi@gmail.com,1 408 239 6668,eicsanjose.org,https://www.eicsanjose.org/wp/sisters-section/hajj-and-umrah-for-sisters,Public website crawl,unknown,email_verified,23.92,"Hajj and Umrah for Sisters | EIC - San Jose, CA Toggle navigation About Us Job Opening History Privacy Policy Board of Directors EIC BYLAWS EIC Bylaws EIC IT & Security Policy EIC Committees Religious Comm/Vision/Tech Construction Finance Operations Women’s Youth Volunteering Membership Information Subscribe to EIC e-M"
Hajj and Umrah for Sisters,,Procurement Manager,operation@eicsanjose.org,1 408 239 6668,eicsanjose.org,https://www.eicsanjose.org/wp/contact-us,Public website crawl,unknown,email_verified,23.92,"Contact Us | EIC - San Jose, CA Toggle navigation About Us Job Opening History Privacy Policy Board of Directors EIC BYLAWS EIC Bylaws EIC IT & Security Policy EIC Committees Religious Comm/Vision/Tech Construction Finance Operations Women’s Youth Volunteering Membership Information Subscribe to EIC e-Mail List Article"
Hajj and Umrah for Sisters,,Procurement Manager,zakat@eicsanjose.org,1 408 239 6668,eicsanjose.org,https://www.eicsanjose.org/wp/contact-us,Public website crawl,unknown,email_verified,23.92,"Contact Us | EIC - San Jose, CA Toggle navigation About Us Job Opening History Privacy Policy Board of Directors EIC BYLAWS EIC Bylaws EIC IT & Security Policy EIC Committees Religious Comm/Vision/Tech Construction Finance Operations Women’s Youth Volunteering Membership Information Subscribe to EIC e-Mail List Article"
Hajar Travels USA,,Procurement Manager,info@hajartravels.com,+1 224-487-5003,hajartravels.com,https://hajartravels.com,Public website crawl,legitimate_interest,email_verified,23.92,"Hajar Travels Provide Affordable Umrah Packages from the USA. Hajj, Umrah, Flights, and Tour Packages in the USA."
Haq Travel S,,Procurement Manager,info@haqtravels.co.uk,+44)203 062 8925,haqtravels.co.uk,https://haqtravels.co.uk,Public website crawl,legitimate_interest,email_verified,23.92,"Book affordable and reliable Hajj & Umrah packages from the UK with Haq Travels. Expert guidance, visa support, and 5-star service for a worry-free journey."
Haramain Travels,,Procurement Manager,umrah@haramain.com.au,+61 424033098,haramain.com.au,https://www.haramain.com.au,Public website crawl,unknown,email_verified,23.92,Don't miss out on the experience of a lifetime with our unbeatable Umrah packages. Contact us now to plan your perfect trip.
travels.de,,Procurement Manager,info@ihsan-travels.com,+49 17666869080,ihsan-travels.de,https://ihsan-travels.de,Public website crawl,legitimate_interest,email_verified,23.92,"Buche jetzt deine Umrah Reise ab Deutschland. Komplettpaket mit Flug, Hotel, Visa, Transfers & Betreuung. Persönlich & professionell."
Karmtravel,,Procurement Manager,reservations@karmtravel.com,+1 2403860638,karmumrah.com,https://karmumrah.com/%D8%A7%D9%84%D8%AD%D8%AC,Public website crawl,unknown,email_verified,23.92,تعرف علي باقاتنا لرحلات الحج
Karmtravel,,Procurement Manager,reservations@karmumrah.com,+1 2403860638,karmumrah.com,https://karmumrah.com/%D8%A7%D9%84%D8%AD%D8%AC,Public website crawl,unknown,email_verified,23.92,تعرف علي باقاتنا لرحلات الحج
Lords Travels & Tours,,Procurement Manager,info.lordtnt@gmail.com,01710 163781,lordtravelsandtours.com,https://lordtravelsandtours.com,Public website crawl,unknown,email_verified,23.92,২০১০ সাল থেকে হজ্জ ও ওমরাহ যাত্রীদের সেবায় নিরলসভাবে কাজ করে যাচ্ছে Lords Travels & Tours। আমাদের মানসম্মত প্যাকেজ ও অভিজ্ঞ মোয়াল্লিমের তত্ত্বাবধান আপনার যাত্রাকে নিরাপদ ও স্বস্তিকর করে তোলে।
