company,email,phone,domain,source_url,consent_status,verification_status,overall_score,raw_text_snippet
Hajj Umrah travel agents from UK,,+442071839663,perfectumrah.us,https://www.perfectumrah.us/umrah-package-from-dallas-texas.php,unknown,phone_verified,14.06,Looking for Umrah Packages from Dallas Texas? Book with one of most trusted agent. We Deliver Best Value in lowest Prices.
Qibla Haj & Umra,,+44 7848 888 938,qiblahajjandumra.com,https://qiblahajjandumra.com,unknown,phone_verified,7.50,Hajj
Sara International Travel,,+1 718 848 1222 166,sarainternationaltravel.com,https://sarainternationaltravel.com/contact,unknown,phone_verified,13.50,Contact Sara International Travel
Sky Direct Travel,,01204 665 668,skydirecttravel.co.uk,https://skydirecttravel.co.uk/locations/leicester,unknown,phone_verified,13.50,Leicester
UAMA,,+1 347 605 1989,uama.us,https://uama.us/umrah,unknown,phone_verified,7.50,"HISAR TOUR × UAMA • From Dream to Reality, We Make It Happen"
Hajj Umrah travel agents from UK,,+442071835226,umrahpackagescanada.com,https://www.umrahpackagescanada.com,unknown,phone_verified,13.86,"Book Economy to 5Star Umrah Packages Canada with Most Trusted Umrah Company. We have served more than 10,000 pilgrims and earned 5 Star Reviews."
Affordable Umrah Packages from Chicago,,+1 (312) 555-0147,umrahpackageschicago.com,https://umrahpackageschicago.com,unknown,phone_verified,11.40,Book trusted Umrah packages from Chicago to Makkah & Madinah. IATA-certified travel agency offering Economy to VIP packages. Flexible payments. Call +1-312-555-0147 today!
Umrah Packages from Houston 2026,,+1 (713) 555-8888,umrahpackageshouston.com,https://umrahpackageshouston.com,unknown,phone_verified,7.50,"Book affordable Umrah packages from Houston to Makkah & Madinah. IATA certified, all-inclusive deals starting at $2,499. Visa, flights, hotels & more. Call now!"
Umrah Packages Manchester 2026,,0123 456 7890,umrahpackagesmanchester.co.uk,https://umrahpackagesmanchester.co.uk,unknown,phone_verified,7.50,"Book affordable Umrah packages from Manchester 2026. Direct flights, 5-star hotels near Haram, expert guidance. Starting from £1299. ATOL protected. Call now!"
Umrah Packages from New York 2026,,+1 (917) 555-1234,umrahpackagesnewyork.com,https://umrahpackagesnewyork.com,unknown,phone_verified,11.27,"Book affordable Umrah packages from New York to Makkah & Madinah. IATA certified travel agency offering 6 package options starting at $2,899. Call now for 2026 deals!"
Umrah Packages from Toronto 2026,,+1 (416) 555-1234,umrahpackagestoronto.com,https://umrahpackagestoronto.com,unknown,phone_verified,7.50,"Book comprehensive Umrah packages from Toronto to Mecca & Medina. TICO registered, IATA certified. 6 package options starting from $2,999. Expert guidance, 5-star hotels, visa assistance included."
Umrah Xpress,,+44 7307 314792,umrahxpress.co.uk,https://umrahxpress.co.uk/umrah-packages-manchester,unknown,phone_verified,11.69,"At UmrahXpress,we take pride in offering premium Umrah packages 2026 Manchester designed to ensure your pilgrimage is comfortable,affordable."
Yuusr,,+44 333 355 5212 24,yuusr.com,https://yuusr.com/en/about-us,unknown,phone_verified,7.50,"Learn about Yuusr, your trusted partner for premium Umrah packages. ATOL protected with years of experience serving pilgrims worldwide."
