company,contact_name,role,email,phone,domain,source_url,source_label,consent_status,verification_status,overall_score,raw_text_snippet
daralharamtravels.co.uk,,Procurement Manager,info@daralharamtravels.co.uk,0203 355 8850 65,daralharamtravels.co.uk,https://daralharamtravels.co.uk,Public website crawl,legitimate_interest,email_verified,29.17,"Explore Umrah & Hajj packages at Dar Al Haram Travels Agency UK. Enjoy personalized services, affordable pricing & expert support for your journey."
daralharamtravels.co.uk,,Procurement Manager,info@qarlharamtravels.co.uk,0203 355 8850 65,daralharamtravels.co.uk,https://daralharamtravels.co.uk,Public website crawl,legitimate_interest,email_verified,29.17,"Explore Umrah & Hajj packages at Dar Al Haram Travels Agency UK. Enjoy personalized services, affordable pricing & expert support for your journey."
Crest Travel,,Procurement Manager,info@cresttravel.co.za,031 303 2028,cresttravel.co.za,https://cresttravel.co.za/site,Public website crawl,legitimate_interest,email_verified,28.27,For more information on Covid-19 click here
Mafaza Travel and Hajj,,Procurement Manager,mafaza@mafazatours.com,+1- 202-247-1535,mafazatours.com,https://www.mafazatours.com/mafaza-travel-for-hajj-and-umrah/hajj-umrah-tour-operations-mafaza-travel-usa,Public website crawl,unknown,email_verified,27.97,Explore Hajj & Umrah Tour operations with Mafaza Travel & Hajj Agency. Enjoy quality packages and reliable service for your sacred journey.
Approved Islamic Travel Agents,,Procurement Manager,info@qiblatain.com,+19145200581,qiblatain.com,https://www.qiblatain.com,Public website crawl,legitimate_interest,email_verified,27.77,"Book with a trusted Umrah travel agency in the USA. Approved Islamic travel agents offering visa assistance, flights, hotels, & customized Umrah packages. Contact us today."
GRID TRAVEL,,Procurement Manager,info@grid-travel.com,0558 29 81 66,grid-travel.com,https://grid-travel.com/omra,Public website crawl,legitimate_interest,email_verified,27.67,Omra
IV Travel,,Procurement Manager,info@ivtravel.ie,087 374 5622 62,ivtravel.org,https://ivtravel.org/contact,Public website crawl,legitimate_interest,email_verified,27.67,Contact
Shirawi Travel & Tours,,Procurement Manager,shirawitravel@gmail.com,০১৮১৭৭৪৪৫৭৯,shirawitravel.com,https://shirawitravel.com,Public website crawl,unknown,email_verified,27.67,হজ্ব প্যাকেজ
Umrah Travel,,Procurement Manager,info@umrahtravel.nl,+31 85 12 48 780,umrahtravel.nl,https://umrahtravel.nl,Public website crawl,legitimate_interest,email_verified,27.67,...
Hope Travel,,Procurement Manager,info@alamaltravel.net,+49 (176) 62495894,alamaltravel.net,https://alamaltravel.net/en/%D8%B1%D8%AD%D9%84%D8%A7%D8%AA-%D8%A7%D9%84%D8%AD%D8%AC%D9%91%D9%90-%D9%85%D9%86-%D8%A3%D9%84%D9%85%D8%A7%D9%86%D9%8A%D8%A7,Public website crawl,legitimate_interest,email_verified,27.25,تُعتبر شركة الأمل من الشركات المرخصة رسميًا من قبل وزارة الحج والعمرة السعودية، مما يضمن للحجاج الراحة والأمان خلال رحلات الحجِّ من ألمانيا. واستنادًا إلى متابعتنا لأسعار رحلات الحج لعام 2024،
Alhijra Travel BV,,Procurement Manager,booking@alhijratravel.nl,+31 010 226 20 98,alhijratravel.nl,https://www.alhijratravel.nl/umrah,Public website crawl,unknown,email_verified,27.25,Umrah
Muzahid Travel And Tours,,Procurement Manager,muzahidtravelandtours@gmail.com,01712310570,muzahidtravel.com,https://muzahidtravel.com/hajj-packages,Public website crawl,unknown,email_verified,27.25,গত ১৪ নভেম্বর - ২০২৩ হজ এজেন্সিজ অ্যাসোসিয়েশন অব বাংলাদেশ (হাব)   দুটি হজ প্যাকেজ ঘোষণা করেছেন।
Wakeel Worldwide Travel,,Procurement Manager,info@al-wakeelhajjandumrah.com,50 0225 1 0325 1000,al-wakeelhajjandumrah.com,https://www.al-wakeelhajjandumrah.com/umrah-packages,Public website crawl,legitimate_interest,email_verified,26.92,Umrah Packages
Wakeel Worldwide Travel,,Procurement Manager,alwakeelhajjumrah@gmail.com,50 0225 1 0325 1000,al-wakeelhajjandumrah.com,https://www.al-wakeelhajjandumrah.com/umrah-packages,Public website crawl,unknown,email_verified,26.92,Umrah Packages
Complete Hajj & Umrah Travel Solutions,,Procurement Manager,mabrurhajjbd@gmail.com,+880) 1914737599,mabrurhajjumrah.com,https://www.mabrurhajjumrah.com,Public website crawl,unknown,email_verified,26.92,মাবরুর হজ্ব ও উমরাহ সার্ভিস
SUPER EAGLE TRAVEL,,Procurement Manager,setravel2@gmail.com,410) 744-1222,supereagletravelinternational.com,https://supereagletravelinternational.com/about,Public website crawl,unknown,email_verified,26.92,ABOUT US
Mafaza Travel and Hajj,,Procurement Manager,mafaza@mafazatours.com,202-247-1535,mafazatours.com,https://www.mafazatours.com/premium-hajj-package-from-usa,Public website crawl,unknown,email_verified,26.83,Explore our Premium Hajj Package for 1446 with luxurious hotels and dedicated services for a transformative pilgrimage experience.
OnpointTravels,,Procurement Manager,admin@onpointtravels.com.au,1300 854 237,onpointtravels.com.au,https://www.onpointtravels.com.au/about-us,Public website crawl,unknown,email_verified,26.70,"Discover OnPoint Travels, Australia’s trusted Hajj & Umrah travel partner. Offering guided, reliable, and affordable pilgrimage tour packages."
TITIM TRAVEL,,Procurement Manager,titimsdnbhd@gmail.com,+60 18-965 4371,titimtravel.com,https://www.titimtravel.com,Public website crawl,unknown,email_verified,26.65,"UMRAH MURAH, BERKAT, DEKAT"
Zamzam Travels BD,,Procurement Manager,info@zamazamtravelsbd.com,+44 1012 177 35101,zamzamtravelsbd.com,https://zamzamtravelsbd.com,Public website crawl,legitimate_interest,email_verified,26.58,"Explore trusted Hajj and Umrah packages in Bangladesh with Zamzam Travels BD. Compare package options, travel support, visa assistance, and pilgrimage guidance."
"Travel Packages In Chicago, IL",,Procurement Manager,hello@hajjmakkahtours.com,60659 (773) 338-0720,hajjmakkahtours.com,https://www.hajjmakkahtours.com,Public website crawl,legitimate_interest,email_verified,26.43,"Welcome to Makkah Tours & Travel Inc. in Chicago, IL offering Tour Packages, Hajj Packages, Umrah Group, Umrah Packages and more."
Hajj and umrah booking travel to Mecca,,Procurement Manager,info@ilamecca.com,+49 152 272 44944,ilamecca.com,https://www.ilamecca.com,Public website crawl,legitimate_interest,email_verified,26.42,As-salamu alaykum !
Euro Bangla Tours,,Procurement Manager,info@eurobanglatours.com,0121 773 7700,eurobanglatours.co.uk,https://www.eurobanglatours.co.uk,Public website crawl,legitimate_interest,email_verified,26.29,"Trusted Hajj & Umrah travel agency in Birmingham. Premium pilgrimage packages, expert guidance, visa processing. Experience the spiritual journey of a lifetime. Book now!"
Hajj And Umrah,,Procurement Manager,inquiry@bestwesttravel.com,0449965678,bestwesttravel.com.au,https://bestwesttravel.com.au/hajj-and-umrah,Public website crawl,unknown,email_verified,26.23,Experience Spiritual Serenity with Trusted Pilgrimage Services
Hajj And Umrah,,Procurement Manager,inquiry@bestwesttravel.com.au,0449965678,bestwesttravel.com.au,https://bestwesttravel.com.au/hajj-and-umrah,Public website crawl,unknown,email_verified,26.23,Experience Spiritual Serenity with Trusted Pilgrimage Services
EL IZZAH TRAVEL & TOURS,,Procurement Manager,elizzahtravel@gmail.com,010-3399644,mampuumrah.com,https://www.mampuumrah.com/HOMEPAGE,Public website crawl,unknown,email_verified,26.23,"Pakej lengkap, umrah dibimbing,"
Noussouki Travel,,Procurement Manager,reservation.noussouki@gmail.com,+33 (0) 1 79 36 01 66,noussoukitravel.com,https://www.noussoukitravel.com/contact,Public website crawl,unknown,email_verified,26.23,Créer votre Omra sur mesure
Qibla Travel,,Procurement Manager,info@qiblatravel.com,+1 201-726-7525 12,qiblatravel.com,https://qiblatravel.com/umrah-packages-from-tampa,Public website crawl,legitimate_interest,email_verified,26.23,Qibla Travel – Trusted Islamic Travel Services
Qibla Travel,,Procurement Manager,sales@qiblatravel.com,+1 201-726-7525 12,qiblatravel.com,https://qiblatravel.com/umrah-packages-from-tampa,Public website crawl,legitimate_interest,email_verified,26.23,Qibla Travel – Trusted Islamic Travel Services
Qibla Travel,,Procurement Manager,example@info.com,+1 201-726-7525 12,qiblatravel.com,https://qiblatravel.com/umrah-packages-from-tampa,Public website crawl,unknown,email_verified,26.23,Qibla Travel – Trusted Islamic Travel Services
Sava Travel,,Procurement Manager,info@savatravel.com,+216 57 035 650,sava.travel,https://sava.travel,Public website crawl,legitimate_interest,email_verified,26.23,احجز أفضل باقات السفر والعمرة مع سافا ترافل. نقدم رحلات مميزة، أسعار تنافسية، وخدمات عالية الجودة. Book the best travel and Umrah packages with Sava Travel.
Sava Travel,,Procurement Manager,savatravel.gabes1@gmail.com,+216 57 035 650,sava.travel,https://sava.travel,Public website crawl,unknown,email_verified,26.23,احجز أفضل باقات السفر والعمرة مع سافا ترافل. نقدم رحلات مميزة، أسعار تنافسية، وخدمات عالية الجودة. Book the best travel and Umrah packages with Sava Travel.
Sava Travel,,Procurement Manager,savatravelkef@gmail.com,+216 57 035 650,sava.travel,https://sava.travel,Public website crawl,unknown,email_verified,26.23,احجز أفضل باقات السفر والعمرة مع سافا ترافل. نقدم رحلات مميزة، أسعار تنافسية، وخدمات عالية الجودة. Book the best travel and Umrah packages with Sava Travel.
Al Aqiq Travels SA,,Procurement Manager,admin@alaqiq.co.za,+27 72 400 4899,alaqiq.co.za,https://alaqiq.co.za,Public website crawl,unknown,email_verified,26.07,Experience the excitement.
Al Aqiq Travels SA,,Procurement Manager,info@alaqiq.co.za,+27 72 400 4899,alaqiq.co.za,https://alaqiq.co.za/contact,Public website crawl,legitimate_interest,email_verified,25.93,Let’s talk.
Shery Travels,,Procurement Manager,info@sherytravels.com,+966-58-384-2090,sherytravels.com,https://sherytravels.com/umrah/usa-packages/chicago,Public website crawl,legitimate_interest,email_verified,25.87,"Start your Umrah journey from Chicago with Shery Travels. Easy departures from O'Hare, group travel with Chicago's Muslim community, and full guidance for a smooth and spiritual pilgrimage."
Haleema,,Procurement Manager,sales@haleema.co.uk,07440 771 368 4,haleema.co.uk,https://www.haleema.co.uk/umrah-birmingham/birmingham-umrah-packages,Public website crawl,legitimate_interest,email_verified,25.81,"Birmingham Umrah Packages in 2026, lets travel with Haleema Limited for a secure and hassle-free journey."
SUPER EAGLE TRAVEL,,Procurement Manager,setravel2@gmail.com,1-800-666-4999,supereagletravelinternational.com,https://supereagletravelinternational.com,Public website crawl,unknown,email_verified,25.81,PLEASE CLICK ON THE HAJJ & UMRAH TAB ABOVE FOR MORE INFORMATION!
Aa Travel,,Procurement Manager,info@aatravel.ca,+1416-335-6026,aatravel.ca,https://aatravel.ca,Public website crawl,legitimate_interest,email_verified,25.61,Best Hajj & Umrah packages for 2024 by A & A Travel & Tours (Formerly known as Baggia Travels)
Nurul Umrah,,Procurement Manager,info@nurulumrah.com,+1 667 421 7876,nurulumrah.com,https://nurulumrah.com/blogs/best-umrah-travel-agency-in-arizona,Public website crawl,legitimate_interest,email_verified,25.61,Introduction - Why Choose Us for Your Umrah & Hajj Journey?
Miller's Travel and Tours,,Procurement Manager,info@millerstravels.co.za,,millerstravels.co.za,https://millerstravels.co.za,Public website crawl,legitimate_interest,email_verified,25.45,"Umrah packages from Cape Town â visa, flights & accommodation. Miller's Travel and Tours: trusted Saudi travel & international flights. Transparent pricing. Enquire on WhatsApp."
Miller's Travel and Tours,,Procurement Manager,admin@millerstravels.co.za,,millerstravels.co.za,https://millerstravels.co.za,Public website crawl,unknown,email_verified,25.45,"Umrah packages from Cape Town â visa, flights & accommodation. Miller's Travel and Tours: trusted Saudi travel & international flights. Transparent pricing. Enquire on WhatsApp."
Hajj Umra Abdalla,,Procurement Manager,info@hajj-umra-abdalla.de,+49 (0) 176 725 422 30,hajj-umra-abdalla.de,https://www.hajj-umra-abdalla.de/en/hajj.html,Public website crawl,legitimate_interest,email_verified,25.44,"Hajj and Umra Abd Alla is a special offer from Mostafa Abd Alla In Mannheim to help you organize your pilgrimage to Mecca and Medina.
   ÙØªÙØ¸ÙÙ Ø±Ø­ÙØ§Øª Ø§ÙØ­Ø¬ ÙØ§ÙØ¹ÙØ±Ø© Ø§ÙÙ Ø§ÙØ£Ø±Ø§Ø¶Ù Ø§ÙÙÙØ¯Ø³Ø© Ø§ÙÙ ÙÙØ© ÙØ§ÙÙØ¯ÙÙØ© Ø§ÙÙÙÙØ±Ø©, Ø§ÙØ­Ø¬ ÙØ§ÙØ¹ÙØ±Ø© Ø¨Ø±Ø¹Ø§ÙØ© Ø§ÙØ³ÙØ¯ ÙØ"
Hajj Umra Abdalla,,Procurement Manager,info@reise-freudig.de,+49 (0) 176 725 422 30,hajj-umra-abdalla.de,https://www.hajj-umra-abdalla.de/en/about-us.html,Public website crawl,legitimate_interest,email_verified,25.44,"Hajj and Umra Abd Alla is a special offer from Mostafa Abd Alla In Mannheim to help you organize your pilgrimage to Mecca and Medina.
   ÙØªÙØ¸ÙÙ Ø±Ø­ÙØ§Øª Ø§ÙØ­Ø¬ ÙØ§ÙØ¹ÙØ±Ø© Ø§ÙÙ Ø§ÙØ£Ø±Ø§Ø¶Ù Ø§ÙÙÙØ¯Ø³Ø© Ø§ÙÙ ÙÙØ© ÙØ§ÙÙØ¯ÙÙØ© Ø§ÙÙÙÙØ±Ø©, Ø§ÙØ­Ø¬ ÙØ§ÙØ¹ÙØ±Ø© Ø¨Ø±Ø¹Ø§ÙØ© Ø§ÙØ³ÙØ¯ ÙØ"
Ikhlas Travel,,Procurement Manager,info@ikhlastravel.co.uk,+44 20 8123 2138,ikhlastravel.co.uk,https://ikhlastravel.co.uk,Public website crawl,legitimate_interest,email_verified,25.44,"Ikhlas Travel – trusted UK provider of affordable Umrah packages from London, Birmingham, Manchester & flights, hotels & spiritual journeys."
Muslims Holy Travel,,Procurement Manager,info@muslimsholytravel.co.uk,0203 900 0310,muslimsholytravel.co.uk,https://www.muslimsholytravel.co.uk/contact-us,Public website crawl,legitimate_interest,email_verified,25.44,"Muslims Holy Travel is always looking forward to help customers in planning a journey of Hajj, Umrah or Halal Holiday Destinations."
World Hajj,,Procurement Manager,info@worldhajj.com,+1 307-392-4596,worldhajj.com,https://www.worldhajj.com/hajj-packages-from-australia,Public website crawl,legitimate_interest,email_verified,25.44,"We are an experienced Australian travel agency offering the best Hajj Packages 2026, from standard to luxury options. Book now!"
Al Haram Travel and Tours,,Procurement Manager,info@alharamtravelntours.com,+1 (623) 404-4213,alharamtravelntours.com,https://alharamtravelntours.com,Public website crawl,legitimate_interest,email_verified,25.37,"Explore amazing travel packages with Al Haram Travel & Tours in Texas, New York, Michigan, Ohio, Washington, Detroit & Dallas today!"
Hisar Europe Travel,,Procurement Manager,info@hisareurope.com,+49 (0) 221 75993636,hisareurope.com,https://hisareurope.com/impressum,Public website crawl,legitimate_interest,email_verified,25.37,"Hisar Europe Travel'ın yasal bilgileri, Şirket bilgilerimizi ve seyahat hizmetlerimizle ilgili iletişim bilgilerimizi kontrol edin"
Hisar Europe Travel,,Procurement Manager,info@hisareurope.de,+49 (0) 221 75993636,hisareurope.com,https://hisareurope.com/impressum,Public website crawl,legitimate_interest,email_verified,25.37,"Hisar Europe Travel'ın yasal bilgileri, Şirket bilgilerimizi ve seyahat hizmetlerimizle ilgili iletişim bilgilerimizi kontrol edin"
Islamic Travel,,Procurement Manager,info@islamictravel.com.au,32 654 849 377,islamictravel.com.au,https://islamictravel.com.au/about-us,Public website crawl,legitimate_interest,email_verified,25.37,"Established in 2017, Islamic Travel Australia designs halal-conscious holidays, tours & Umrah packages with 226+ five-star reviews from happy travellers."
Labbaik Hajj Umrah USA,,Procurement Manager,info@labbaikhajjumrah.com,+17732321877,labbaikhajjumrah.com,https://www.labbaikhajjumrah.com,Public website crawl,legitimate_interest,email_verified,25.37,"Being a Leading USA Travel Agency, Labbaik Hajj Umrah offers Hajj and Umrah Packages according to your needs, Contact Us: (773) 232-1877"
Makkah Tour,,Procurement Manager,info@makkahtour.co.uk,0203 195 8700,makkahtour.co.uk,https://www.makkahtour.co.uk,Public website crawl,legitimate_interest,email_verified,25.37,Book your Cheap Umrah Packages by a top rated umrah travel agency. Get your all inclusive Umrah deals now. Book this limited offer at 0203-195-8700
Resala Travel,,Procurement Manager,info@resalatravel.com,+31 6 41712806,resalatravel.com,https://resalatravel.com,Public website crawl,legitimate_interest,email_verified,25.37,"Expert-guided spiritual journeys to Mecca and Medina with premium accommodations, experienced Islamic scholars, small-group attention, and complete visa &â¦"
Ibadah Tours,,Procurement Manager,info@ibadahtours.com,+447440 474247,ibadahtours.com,https://www.ibadahtours.com/hajj-packages,Public website crawl,legitimate_interest,email_verified,25.31,Follow the Messanger of Allah's words and start your pilgrimage to the House of Allah. Ibadah Tours have created Hajj packages to make this easy.
Ibadah Tours,,Procurement Manager,sales@ibadahtours.com,+447440 474247,ibadahtours.com,https://www.ibadahtours.com/hajj-packages,Public website crawl,legitimate_interest,email_verified,25.31,Follow the Messanger of Allah's words and start your pilgrimage to the House of Allah. Ibadah Tours have created Hajj packages to make this easy.
Al Momin Travels,,Procurement Manager,info@almomintravel.co.uk,+442032890000 16,almomintravel.co.uk,https://almomintravel.co.uk/about-us,Public website crawl,legitimate_interest,email_verified,25.31,"Learn about Al Momin Travel, a UK-based agency offering reliable Umrah packages, expert guidance, and seamless travel experiences for pilgrims."
Al Raad Tours & Travel,,Procurement Manager,info@alraadtours.com,678-677-2807,alraadtours.com,http://www.alraadtours.com/contact-us,Public website crawl,legitimate_interest,email_verified,25.31,"Reach out to Al Raad Tours for Hajj & Umrah inquiries. Call 678-677-2807 or email info@alraadtours.com. Visit us in Atlanta, GA."
Umrah Travel Agency UK,,Procurement Manager,info@alzowartravel.co.uk,020 3504 2326 13,alzowartravel.co.uk,https://alzowartravel.co.uk,Public website crawl,legitimate_interest,email_verified,25.31,"Best Umrah Travel agency in UK, Al Zowar Travel offers Hajj and Umrah services, expert guidance, Dedicated support and ATOL protected."
Islamic Travel,,Procurement Manager,info@islamictravel.co.uk,0203-970-4500,islamictravel.co.uk,https://www.islamictravel.co.uk/cheap-hajj-packages.html,Public website crawl,legitimate_interest,email_verified,25.31,"Looking for Cheap Hajj Packages 2026? Islamic Travel offers ATOL-protected Hajj packages from London, Manchester & Birmingham. All-inclusive 5-star & shifting deals available."
Noble Hajj Umrah,,Procurement Manager,info@noblehajjumrah.com,+32 465 70 45 62,noblehajjumrah.com,https://noblehajjumrah.com/contact,Public website crawl,legitimate_interest,email_verified,25.31,"Contact Noble Hajj Umrah for Hajj, Umrah, and Islamic tour inquiries. Our team is here to assist you with travel bookings, package details, and personalized support."
Taibah Travels,,Procurement Manager,info@taibahtravels.com,+1 (206) 848-5272,taibahtravels.com,https://taibahtravels.com/detroit-mi,Public website crawl,legitimate_interest,email_verified,25.31,"Experience top Umrah services in Detroit, MI, with Taibah Travels, offering visa assistance, direct flights, and convenient packages for your pilgrimage needs."
Travel Gate USA,,Procurement Manager,info@sarainternationaltravel.com,+15421 678 8888,travelgateusa.com,https://travelgateusa.com/top-hajj-and-umrah-companies,Public website crawl,legitimate_interest,email_verified,25.31,"Here is our well-researched list of the best Hajj and Umrah companies in the USA 2025 that provide affordable packages, VIP trips and more."
Travel Gate USA,,Procurement Manager,info@travelgateus.com,+15421 678 8888,travelgateusa.com,https://travelgateusa.com/top-hajj-and-umrah-companies,Public website crawl,legitimate_interest,email_verified,25.31,"Here is our well-researched list of the best Hajj and Umrah companies in the USA 2025 that provide affordable packages, VIP trips and more."
GM Travel,,Procurement Manager,info@gmtravel.co.uk,+44 203 371 9643,gmtravel.co.uk,https://gmtravel.co.uk,Public website crawl,legitimate_interest,email_verified,25.25,"Embark on a spiritual journey filled with peace, comfort, and devotion. Our exclusive Umrah packages are designed to provide you with luxurious yet affordable"
Haj,,Procurement Manager,info@haj.co.uk,020 7286 1111,haj.co.uk,https://www.haj.co.uk,Public website crawl,legitimate_interest,email_verified,25.25,Haj & Umra Travel provide Hajj and Umrah escorted tours as well as tailor made packages to suit different budgets. Specialists with decades of experience.
Felda Travel & Tours,,Procurement Manager,salam@feldatravel.com.my,60192790022,pakejhajiswasta.com,https://pakejhajiswasta.com,Public website crawl,unknown,email_verified,25.25,Felda Travel merupakan agensi haji berlesen yang menyediakan pakej haji dengan perkhidmatan terbaik pada harga berpatutan.
Alhadi Travel,,Procurement Manager,info@alhaditravel.co.uk,0203 930 0817,alhaditravel.co.uk,https://alhaditravel.co.uk,Public website crawl,legitimate_interest,email_verified,25.20,"Discover All inclusive Umrah packages UK from £699. Alhadi Travel offers flights, hotels & transport. ATOL & IATA certified. Book your journey today."
ALMAASI NUJOOM,,Procurement Manager,nujoomalmaasi@mweb.co.za,061 495 4745,almaasinujoom.co.za,https://www.almaasinujoom.co.za,Public website crawl,unknown,email_verified,25.20,"Experience premium Hajj and Umrah packages with ALMAASI NUJOOM. Offering luxury accommodations, expert guidance, and complete travel services for your spiritual journey to Makkah and Madina."
Allia Tour & Travel,,Procurement Manager,customerservice@alliatour.com,081 212 515 253,alliatour.com,https://alliatour.com,Public website crawl,unknown,email_verified,25.20,Nikmati perjalanan ibadah umrah yang nyaman dengan paket terbaik kami. Daftar sekarang untuk mendapatkan penawaran spesial!
Umrah Travel & Halal Tours Company,,Procurement Manager,enquiry@crescenttours.com.au,0420 800 894,crescenttours.com.au,https://crescenttours.com.au,Public website crawl,unknown,email_verified,25.20,"With 78 years of experience, Crescent Tours offers premium, all-inclusive Halal & Umrah travel in Australia. Travel with experts who make every trip extraordinary!"
Falcon Travel,,Procurement Manager,info@falcontravel.ca,1-844-774-2828,falcontravel.ca,https://falcontravel.ca,Public website crawl,legitimate_interest,email_verified,25.20,"Falcon Travel offers Hajj, Umrah, Saudi visa services, and Islamic tours for Muslims across Canada. Trusted travel agency serving pilgrims since 1980."
Hagel Travel & Tours,,Procurement Manager,sales@hageltravel.com,+65 6296 8644,hageltravel.com,https://www.hageltravel.com,Public website crawl,legitimate_interest,email_verified,25.20,"With over 25 years of experience, Hagel Travel offers trusted Umrah, Hajj & Muslim-friendly tour packages across Asia, the Middle East & beyond."
Hisar Travel Australia,,Procurement Manager,hisartravelau@gmail.com,+61 4 11 456 014,hisartravel.com.au,https://hisartravel.com.au/umrah,Public website crawl,unknown,email_verified,25.20,"Explore affordable Umrah packages from Sydney, Melbourne, Perth & across Australia. Book your journey to the Holy Land with our trusted, seamless services."
Masartomecca,,Procurement Manager,info@masartomecca.com,+1 917-227-9341,masartomecca.com,https://masartomecca.com/umrah-packages-from-new-york,Public website crawl,legitimate_interest,email_verified,25.20,"Book Umrah packages from New York with a trusted Umrah travel agency from New York. Affordable prices, flights, hotels, visa & full support."
Muslims Holy Travel,,Procurement Manager,info@muslimsholytravel.co.uk,0203 900 0310 12,muslimsholytravel.co.uk,https://www.muslimsholytravel.co.uk,Public website crawl,legitimate_interest,email_verified,25.20,"Book reliable Hajj and Umrah packages with Muslims Holy Travel, a UK-based ATOL-protected agency offering customisable deals from Heathrow & beyond. Secure your spot today."
King Travel Can Ltd,,Procurement Manager,info@kingtravelcan.com,5464) 905-624-8555,kingtravelcan.com,https://kingtravelcan.com,Public website crawl,legitimate_interest,email_verified,25.15,"Book Umrah packages from Canada with King Travel. Explore Hajj packages, flight deals, visa support, and trusted travel services for pilgrims across Canada."
UK's Best Hajj and Umrah Travel Agency,,Procurement Manager,info@bismillahtravel.co.uk,0208 145 7860,bismillahtravel.co.uk,https://www.bismillahtravel.co.uk,Public website crawl,legitimate_interest,email_verified,25.15,"Experience seamless Hajj & Umrah journeys with Bismillah Travel, the UK's premier Islamic travel agency. Trusted expertise & exceptional service. Book now!"
Islamic Travel,,Procurement Manager,info@islamictravel.com.au,1800 960 785,islamictravel.com.au,https://islamictravel.com.au,Public website crawl,legitimate_interest,email_verified,25.15,"Australia's leading Muslim-friendly tour agency. Halal-friendly tours, Umrah packages & curated holidays. 226+ 5-star reviews. 1800 960 785."
