company,company_clean,domain,website,country_inferred,country_inference_source,region_inferred,tld,email,email_domain,email_type,role_email,free_email_provider,phone_raw,phone_normalized,contact_readiness,outreach_priority,recommended_channel,consent_status,verification_status,overall_score,raw_text_snippet
Hadj en Umrah Vergelijken,Hadj en Umrah Vergelijken,hadjenumrahvergelijken.nl,https://hadjenumrahvergelijken.nl/umrah,Netherlands,domain_tld,Europe,nl,info@hadjenumrah.nl,hadjenumrah.nl,external_domain,yes,no,+316 17420624,+31617420624,email_and_phone,B,email_then_phone,legitimate_interest,email_verified,21.25,Bekijk Umrah 2026 prijzen. Een complete Umrah reis kost tussen de €1800 en €2500 per persoon. Umrah in de Ramadan of in April.
Aqeel Hadj & Umrah reizen,Aqeel Hadj & Umrah reizen,hadjumrahreizen.nl,https://www.hadjumrahreizen.nl,Netherlands,domain_tld,Europe,nl,info@hadjumrahreizen.nl,hadjumrahreizen.nl,company_domain,yes,no,+31623247871,+31623247871,email_and_phone,B,email_first,legitimate_interest,email_verified,21.25,"Aqeel Hadj &amp; Umrah reizen: Met Hadj &amp; Umrah Reizen boek je een reis naar hadjar die je nooit zult vergeten. Bewezen de beste reis in Hadjs, ook wel bekend als hajj’s of ḥajjāt. Maar ook de reizen met Umrahs oftwel umraāt."
Hajar Umrah Reizen,Hajar Umrah Reizen,hajarumrah.nl,https://www.hajarumrah.nl,Netherlands,domain_tld,Europe,nl,info@hajarumrah.nl,hajarumrah.nl,company_domain,yes,no,+31 (0)85 060 4047,+310850604047,email_and_phone,B,email_first,legitimate_interest,email_verified,21.25,"Begin uw bedevaart met Hajar Umrah Reizen. Ontdek volledig verzorgde Umrah pakketten naar Mekka en Medina, incl. accommodatie, vluchten en onze handige reisapp."
Sahabic The Rihla Company,Sahabic The Rihla Company,sahabic.com,https://www.sahabic.com/nl_nl,Netherlands,phone,Europe,com,info@sahabic.com,sahabic.com,company_domain,yes,no,+3140 216 34 59,+31402163459,email_and_phone,B,email_first,legitimate_interest,email_verified,21.25,"Boek uw perfecte Umrah- of Hajj-reis bij Sahabic. Complete pakketten voor families, ouderen en jonge gezinnen. Reserveer eenvoudig online!"
Stichting Burak,Stichting Burak,stichtingburak.nl,https://www.stichtingburak.nl/reizen.php,Netherlands,domain_tld,Europe,nl,info@stichtingburak.nl,stichtingburak.nl,company_domain,yes,no,+31 6 49981017,+31649981017,email_and_phone,B,email_first,legitimate_interest,email_verified,21.25,"Bekijk alle Hajj 2026 en Umrah pakketten van Stichting Burak Rotterdam. Inclusief vluchten, hotels, begeleiding en visum. Direct online boeken of meer informatie aanvragen."
Umrah & Hadj Pakketten 2026,Tayseer,tayseer.nl,https://www.tayseer.nl,Netherlands,domain_tld,Europe,nl,contact@tayseer.nl,tayseer.nl,company_domain,yes,no,+31 40 750 2534,+31407502534,email_and_phone,B,email_first,legitimate_interest,email_verified,21.25,"Boek uw betaalbare Umrah- of Hadj-reis vanuit Nederland & BelgiÃ« met Sunnah-gerichte begeleiding, kwalitatieve hotels en betrouwbare vliegtuigmaatschappijen. Reis zorgeloos naar Mekka en Medina."
Umrah Reisbureau,Umrah Reisbureau,temheed.nl,https://temheed.nl,Netherlands,domain_tld,Europe,nl,info@temheed.nl,temheed.nl,company_domain,yes,no,+31 (0)85 06 02 666,+310850602666,email_and_phone,B,email_first,legitimate_interest,email_verified,21.25,Reis met Temheed het Umrah reisbureau voor een uitstekend goed verzorgde reis naar Mekka en Medina. Temheed heeft 25+ jaar ervaring als Umrah reisbureau.
Umrah Tours,Umrah Tours,umrah-tours.nl,https://umrah-tours.nl,Netherlands,domain_tld,Europe,nl,info@umrah-tours.nl,umrah-tours.nl,company_domain,yes,no,+31 85 822 4175,+31858224175,email_and_phone,B,email_first,legitimate_interest,email_verified,21.25,Ontdek de beste umrah reizen voor een onvergetelijke ervaring. Leer tips en advies om jouw pelgrimstocht soepel te laten verlopen.
Umrah Reizen Nederland,Umrah Reizen Nederland,umrahreizennederland.nl,https://umrahreizennederland.nl,Netherlands,domain_tld,Europe,nl,info@umrahreizennederland.nl,umrahreizennederland.nl,company_domain,yes,no,0612345678,+31612345678,email_and_phone,B,email_first,legitimate_interest,email_verified,21.25,"Beleef een zorgeloze Umrah met Umrah Reizen Nederland – compleet verzorgde pakketten inclusief vluchten, verblijf, transfers en begeleiding."
Ayesha Hajj & Umrah Services,Ahus,ahus.co.nz,https://ahus.co.nz/hajj,New Zealand,domain_tld,APAC,nz,info@ahus.co.nz,ahus.co.nz,company_domain,yes,no,+14083246340,+14083246340,email_and_phone,B,email_first,legitimate_interest,email_verified,23.92,"Discover a sacred expedition through our customized Hajj packages, where exceptional service intertwines with your profound spiritual odyssey. Delve into our assortment of packages and commence your auspicious pilgrimage."
MK Hajj & Umrah Tours,MK Hajj & Umrah Tours,mkhajjumrah.co.nz,https://mkhajjumrah.co.nz,New Zealand,domain_tld,APAC,nz,info@mktours.co.nz,mktours.co.nz,external_domain,yes,no,021 025 32786,+642102532786,email_and_phone,B,email_then_phone,legitimate_interest,email_verified,21.25,Premium Hajj & Umrah Tours
Muslimdirectory,Muslimdirectory,muslimdirectory.co.nz,https://muslimdirectory.co.nz/listing-feature/umrah-packages,New Zealand,domain_tld,APAC,nz,info@muslimdirectory.co.nz,muslimdirectory.co.nz,company_domain,yes,no,38-9009-0503270-00,+19009050327,email_and_phone,B,email_first,legitimate_interest,email_verified,21.25,Umrah Packages
Discount Travel All,Discount Travel All,discounttravelall.com,https://discounttravelall.com,North America,phone,Unknown,com,discounttravel@discounttravelall.com,discounttravelall.com,company_domain,no,no,800-293-2937,+18002932937,email_and_phone,B,email_first,unknown,email_verified,21.25,1.6k booked for Ramadan Umrah 2026
Umrah / Hajj / Islamic Tour Package,Roadtomakkah,roadtomakkah.com,https://www.roadtomakkah.com,North America,phone,Unknown,com,info@roadtomakkah.com,roadtomakkah.com,company_domain,yes,no,1-855-262-5524,+18552625524,email_and_phone,B,email_first,legitimate_interest,email_verified,21.25,"Road to Makkah offers expertly designed Umrah Hajj and Islamic tour package services, refined over the years to ensure a smooth and hassle-free journey for you"
Sunnah Foundation Hajj & Umrah,Sunnah Foundation Hajj & Umrah,sunnahhajj.com,https://sunnahhajj.com,North America,phone,Unknown,com,labbayk@sunnahhajj.com,sunnahhajj.com,company_domain,no,no,+1300 850 250,+1300850250,email_and_phone,B,email_first,unknown,email_verified,21.25,"The Journey Of A Lifetime.
Hajj & Umrah Packages"
TakeMeToUmrah.com,TakeMeToUmrah.com,takemetoumrah.com,https://takemetoumrah.com,North America,phone,Unknown,com,info@takemetoumrah.com,takemetoumrah.com,company_domain,yes,no,1-888-358-6724,+18883586724,email_and_phone,B,email_first,legitimate_interest,email_verified,21.25,"Trusted Umrah packages with expert guidance, care, and spiritual focus. Experience the blessings of Umrah & visiting the Prophet ﷺ – a Journey of the Heart ❤"
Arqemhajj,Arqem Hajj,arqemhajj.com,https://www.arqemhajj.com/contact,Pakistan,text_hint,APAC,com,info@arqemhajj.com,arqemhajj.com,company_domain,yes,no,+923219333305,+923219333305,email_and_phone,B,email_first,legitimate_interest,email_verified,21.25,"Address: 14/1 Block L Gulberg 3rd, Main Ferozpur Road Opp Model Town Morr, Metro Station no 16 Lahore. info@arqemhajj.com"
Momal Travel S,Momal Travels,momaltravels.com,https://www.momaltravels.com/ur/services/umrah-bookings,Pakistan,phone,APAC,com,info@momaltravels.com,momaltravels.com,company_domain,yes,no,+92 303 7761616,+923037761616,email_and_phone,B,email_first,legitimate_interest,email_verified,21.25,ڈسکہ، سیالکوٹ، لاہور، گوجرانوالہ، پاکستان سے عمرہ پیکیجز۔ ہوٹل، پروازیں، ویزا کی مدد کے ساتھ مکمل عمرہ بکنگ خدمات۔ مومل انٹرنیشنل ٹریولز - آپ کا قابل اعتماد عمرہ سفر کا ساتھی۔
Umrah & Hajj,Umrah & Hajj,rayyanam.com,https://www.rayyanam.com/ur/umrah-hajj,Pakistan,phone,APAC,com,info@rayyanam.com,rayyanam.com,company_domain,yes,no,+92616241412,+92616241412,email_and_phone,B,email_first,legitimate_interest,email_verified,21.25,عمرہ اور حج
trips.pk,trips.pk,trips.pk,https://www.trips.pk/umrah/germany,Pakistan,domain_tld,APAC,pk,info@trips.pk,trips.pk,company_domain,yes,no,+92-3104-449-553,+923104449553,email_and_phone,B,email_first,legitimate_interest,email_verified,21.25,Page Not Found
Customized Umrah Package Builder,Umrah Companions,umrahcompanions.com,https://umrahcompanions.com/contact-us,Pakistan,phone,APAC,com,support@umrahcompanions.com,umrahcompanions.com,company_domain,yes,no,+92 333 3862347,+923333862347,email_and_phone,B,email_first,legitimate_interest,email_verified,21.25,"Get Umrah packages for Hotels, Transport, Flights Visa bookings and much more as per your needs. We are your companion in the spiritual journey of Umrah."
Umrah Dost,Umrah Dost,umrahdost.com,https://umrahdost.com/umrah-packages-germany-2025,Pakistan,phone,APAC,com,info@umrahdost.com,umrahdost.com,company_domain,yes,no,+92 315 946 4767,+923159464767,email_and_phone,B,email_first,legitimate_interest,email_verified,21.25,"A seamless Umrah journey from Germany with Umrah Dost. Choose from 3, 4, or 5 star packages, including flights, hotels, and transport."
ريجنسي هوليدايز,Regency Holidays,regencyholidays.com,https://www.regencyholidays.com/ar-us/packages/%D8%A8%D8%A7%D9%82%D8%A7%D8%AA-%D8%A7%D9%84%D8%B9%D9%85%D8%B1%D8%A9,Qatar,phone,MENA,com,callcenter@regencyholidays.com,regencyholidays.com,company_domain,no,no,+974 40415050,+97440415050,email_and_phone,B,email_first,unknown,email_verified,21.25,تحقق من جميع باقات العمرة المدرجة في ريجنسي هوليدايز واحجز أفضل باقة مناسبة من رحلات العمرة من الولايات المتحدة الأمريكية واستمتع بإجازة مقدسة في مكة المكرمة والمدينة المنورة، المملكة العربية السعودية.
Almosafer Blog,Almosafer Blog,blog.almosafer.com,https://blog.almosafer.com/nusuk-hajj,Saudi Arabia,phone,MENA,com,support@almosafer.com,almosafer.com,external_domain,yes,no,+966 55 440 0000,+966554400000,email_and_phone,B,email_then_phone,legitimate_interest,email_verified,21.25,اكتشف نُسُك حج! تعرف علي أكبر منصة حج في 2026 . أكتشف الباقات وتكلفة نُسُك حج ودليل التسجيل خطوة بخطوة. اعثر على حجك المثالي مع المسافر!
Hajj and Umrah Pilgrimage Travelers,Travel,travel.state.gov,https://travel.state.gov/en/international-travel/planning/safety-tips/hajj-umrah-pilgrimage.html,Saudi Arabia,email_tld,MENA,gov,care@haj.gov.sa,haj.gov.sa,external_domain,no,no,+966-11-835-4000,+966118354000,email_and_phone,B,email_then_phone,unknown,email_verified,26.48,"Pilgrims traveling for Hajj or Umrah should check entry visa requirements, health rules, and travel advisories before going to Mecca in Saudi Arabia."
specialising in Hajj & Umrah Tours,Barakah Travel,barakahtravel.co.za,https://barakahtravel.co.za,South Africa,domain_tld,Africa,za,admin@barakahtravel.co.za,barakahtravel.co.za,company_domain,yes,no,+27 74 046 4101,+27740464101,email_and_phone,B,email_first,unknown,email_verified,21.25,Embark on an Unforgettable Journey
Mithas Travel,Mithas Travel,mithastravel.co.za,https://www.mithastravel.co.za/middle-east/umrah,South Africa,domain_tld,Africa,za,info@mithastravel.co.za,mithastravel.co.za,company_domain,yes,no,+27 21 018 0530,+27210180530,email_and_phone,B,email_first,legitimate_interest,email_verified,21.25,"A journey to the holy city of Mecca in Saudi Arabia. Unlike Hajj, Umrah can be performed at any time of the year with our Umrah packages."
Department of Hajj And Umra,Department of Hajj And Umra,muscoosa.org,https://muscoosa.org/hajjandumra/contact-us,South Africa,phone,Africa,org,hajjandumra@muscoosa.org,muscoosa.org,company_domain,no,no,+27 83 749 8338,+27837498338,email_and_phone,B,email_first,unknown,email_verified,21.25,Contact Us
Tawfiq Hajj,Tawfiq Hajj,tawfiq.co.za,https://www.tawfiq.co.za/hajj-packages,South Africa,domain_tld,Africa,za,hajj@tawfiq.co.za,tawfiq.co.za,company_domain,yes,no,+27 71 4688 444,+27714688444,email_and_phone,B,email_first,unknown,email_verified,21.25,
"Hajj, Umrah and Leisure Travel Services",Timeto Travel,timetotravel.africa,https://timetotravel.africa,South Africa,email_tld,Africa,africa,info@itstimetotravel.co.za,itstimetotravel.co.za,external_domain,yes,no,021 001 2044,+27210012044,email_and_phone,B,email_then_phone,legitimate_interest,email_verified,25.02,"Time To Travel – Hajj, Umrah and Leisure Travel Services Home About Us Meet The Team Hotels Umrah Packages Umrah Groups Leisure Mauritius Kenya Contact Home About Us Meet The Team Hotels Umrah Packages Umrah Groups Leisure Mauritius Kenya Contact Time To Travel Established in December 2018, Our Company specializes in H"
Twf Hajj,Twf Hajj,twfhajj.com,https://www.twfhajj.com,South Africa,phone,Africa,com,am@ttw.co,ttw.co,external_domain,no,no,+27 72 500 0188,+27725000188,email_and_phone,B,email_then_phone,unknown,email_verified,23.92,"TWF Hajj packages (South Africa) are designed to offer a truly personalised and compassionate approach, making every traveller feel supported at every stage of their journey"
Sava Travel,Sava Travel,sava.travel,https://sava.travel,Tunisia,phone,MENA,travel,info@savatravel.com,savatravel.com,external_domain,yes,no,+216 57 035 650,+21657035650,email_and_phone,B,email_then_phone,legitimate_interest,email_verified,26.23,احجز أفضل باقات السفر والعمرة مع سافا ترافل. نقدم رحلات مميزة، أسعار تنافسية، وخدمات عالية الجودة. Book the best travel and Umrah packages with Sava Travel.
JTR Holidays,JTR Holidays,jtrholidays.com,https://www.jtrholidays.com/ar/contact-us,United Arab Emirates,phone,MENA,com,info@jtrholidays.com,jtrholidays.com,company_domain,yes,no,+971 4 385 2466,+97143852466,email_and_phone,B,email_first,legitimate_interest,email_verified,21.25,اتصل بنا للحصول على أفضل باقات العطلات، الجولات والرحلات الاستكشافية، عروض الرحلات البحرية، حجز رحلات السفاري، المنتزهات الترفيهية، الحدائق المائية، الجولات الجوية، وع...
Umrahme,Umrah Me,umrahme.com,https://www.umrahme.com/umrah-packages/ar-sa,United Arab Emirates,phone,MENA,com,care@umrahme.com,umrahme.com,company_domain,no,no,+971523873550,+971523873550,email_and_phone,B,email_first,unknown,email_verified,21.25,احجز باقة عمرة أو رحلات العمرة اونلاين مع عمرة مي. استمتع بأفضل اسعار رحلات العمرة وبرامج العمرة، واطلع على جدول العمرة الخاص للحصول على أفضل باقة للعمرة. احجز الآن!
العرب في بريطانيا,Alarabinuk,alarabinuk.com,https://alarabinuk.com/%D8%B1%D8%AD%D9%84%D8%A9-%D8%B9%D9%85%D8%B1%D8%A9-%D9%85%D9%86-%D8%A8%D8%B1%D9%8A%D8%B7%D8%A7%D9%86%D9%8A%D8%A7-%D9%85%D8%B9-%D8%B3%D9%88%D8%A7-%D8%AA%D8%B1%D8%A7%D9%81%D9%84-2025,United Kingdom,phone,Europe,com,info@alarabinuk.com,alarabinuk.com,company_domain,yes,no,+44 7455 737800,+447455737800,email_and_phone,B,email_first,legitimate_interest,email_verified,21.25,مع اقتراب نهاية العام، يتهيّأ المسلمون في بريطانيا لرحلةٍ روحانيةٍ تلامس القلوب، حيث يزداد الإقبال على أداء العمرة في أجواءٍ شتويةٍ هادئة تمنح الزائرين
Almaknoon Travel S,Almaknoon Travels,almaknoontravels.co.uk,https://almaknoontravels.co.uk/contact-us,United Kingdom,domain_tld,Europe,uk,info@almaknoontravels.co.uk,almaknoontravels.co.uk,company_domain,yes,no,+44 208 4786 886,+442084786886,email_and_phone,B,email_first,legitimate_interest,email_verified,21.25,Contact Us
Baitullah Travels,Baitullah Travels,baitullahtravels.co.uk,https://baitullahtravels.co.uk,United Kingdom,domain_tld,Europe,uk,info@baitullahtravels.co.uk,baitullahtravels.co.uk,company_domain,yes,no,+447465790372,+447465790372,email_and_phone,B,email_first,legitimate_interest,email_verified,23.92,Your trusted partner for Umrah and Hajj journeys.
Hajj & Umrah Tours 2025,Dome Tours,dometours.com,https://dometours.com,United Kingdom,text_hint,Europe,com,info@dometours.com,dometours.com,company_domain,yes,no,020 8962 6644,+442089626644,email_and_phone,B,email_first,legitimate_interest,email_verified,21.25,"Dome Tours provides UK 2026 Hajj packages (shifting/non-shifting), Umrah packages and Tour packages from the UK."
Dua Travels,Dua Travels,duatravels.co.uk,https://duatravels.co.uk/hajj-packages,United Kingdom,domain_tld,Europe,uk,sales@duatravels.co.uk,duatravels.co.uk,company_domain,yes,no,+44 7407 897415,+447407897415,email_and_phone,B,email_first,legitimate_interest,email_verified,23.92,"Book ATOL & ABTA protected Cheap Hajj Packages 2026 from UK with flights from London, Manchester & Birmingham. Find Hajj cost along 3 ,4 and 5 star hotels."
Elite Umrah,Elite Umrah,eliteumrah.co.uk,https://eliteumrah.co.uk,United Kingdom,domain_tld,Europe,uk,info@eliteumrah.co.uk,eliteumrah.co.uk,company_domain,yes,no,+442032896800,+442032896800,email_and_phone,B,email_first,legitimate_interest,email_verified,21.25,"Book your 2026 Umrah journey with EliteUmrah. Explore our all inclusive umrah packages from the UK, offering flights, accommodation, transfers, and more for a seamless spiritual experience"
Euro Bangla Tours,Euro Bangla Tours,eurobanglatours.co.uk,https://www.eurobanglatours.co.uk,United Kingdom,domain_tld,Europe,uk,info@eurobanglatours.com,eurobanglatours.com,external_domain,yes,no,0121 773 7700,+441217737700,email_and_phone,B,email_then_phone,legitimate_interest,email_verified,26.29,"Trusted Hajj & Umrah travel agency in Birmingham. Premium pilgrimage packages, expert guidance, visa processing. Experience the spiritual journey of a lifetime. Book now!"
Hajj Umrah Package,Hajj Umrah Package,hajjumrahpackage.com,https://www.hajjumrahpackage.com,United Kingdom,text_hint,Europe,com,info@hajjumrahpackage.com,hajjumrahpackage.com,company_domain,yes,no,020-8124-8088 4,+442081248088,email_and_phone,B,email_first,legitimate_interest,email_verified,21.25,"Umrah Packages for individual pilgrims, families, kids, and senior citizens from UK. Book all-inclusive Umrah deals with flights, hotels, visas, and transport."
Haq Travel S,Haq Travels,haqtravels.co.uk,https://haqtravels.co.uk,United Kingdom,domain_tld,Europe,uk,info@haqtravels.co.uk,haqtravels.co.uk,company_domain,yes,no,+44)203 062 8925,+442030628925,email_and_phone,B,email_first,legitimate_interest,email_verified,23.92,"Book affordable and reliable Hajj & Umrah packages from the UK with Haq Travels. Expert guidance, visa support, and 5-star service for a worry-free journey."
Hisar Tour UK,Hisar Tour UK,hisartour.co.uk,https://www.hisartour.co.uk/tr/umrah,United Kingdom,domain_tld,Europe,uk,info@hisartour.co.uk,hisartour.co.uk,company_domain,yes,no,+44 75 6895 5690,+447568955690,email_and_phone,B,email_first,legitimate_interest,email_verified,21.25,"Kapsamlı Umre paketlerimizi keşfedin. Farklı bütçelere ve tercihlere uygun seçenekler sunan paketlerimiz; konforlu konaklama, rehberli turlar ve İngilizce ile Türkçe destek gibi üst düzey hizmetler içerir. Sünnete uygun rehberlik ve modern olanaklarla manevi açıdan zenginleştirici bir yolculuk deneyimi yaşayın. Paket s"
Labbaik Hajj Umrah,Labbaik Hajj Umrah,labbaikhajjumrah.co.uk,https://www.labbaikhajjumrah.co.uk/umrah-packages,United Kingdom,domain_tld,Europe,uk,info@labbaikhajjumrah.co.uk,labbaikhajjumrah.co.uk,company_domain,yes,no,02038656950,+442038656950,email_and_phone,B,email_first,legitimate_interest,email_verified,21.25,"Umrah Packages 2026 from UK with flights, hotels, visas & transport included. ATOL-protected top-rated agent for affordable, smooth journeys to Makkah & Madinah"
Lepelerinage,Lepelerinage,lepelerinage.com,https://lepelerinage.com/contact-nous,United Kingdom,phone,Europe,com,arielle@autrevoyage.com,autrevoyage.com,external_domain,no,no,01 42 36 23 29,+44142362329,email_and_phone,B,email_then_phone,unknown,email_verified,21.25,Besoin de renseignements pour votre Omra ou Hajj ? Contactez l'agence AUTRE VOYAGE Tél: 01 42 36 23 29 Email : lepelerinage@autrevoyage.com
Muslim Tour,Muslim Tour,muslimtour.co.uk,https://muslimtour.co.uk,United Kingdom,domain_tld,Europe,uk,info@muslimtour.co.uk,muslimtour.co.uk,company_domain,yes,no,+44 1215291686,+441215291686,email_and_phone,B,email_first,legitimate_interest,email_verified,21.25,Our commitment to your well-being is paramount. We prioritize health and safety by fostering a positive environment and implementing comprehensive safeguards.
MZ Travels,MZ Travels,mz-travels.com,https://mz-travels.com/forfaits-omra,United Kingdom,phone,Europe,com,contact@mz-travels.com,mz-travels.com,company_domain,yes,no,01-89-86-16-07,+44189861607,email_and_phone,B,email_first,legitimate_interest,email_verified,23.92,Forfait Omra 2024 : Profitez d'un pèlerinage spirituel inoubliable avec nos offres complètes et personnalisées. Réservez maintenant.
Travel to Umrah,Travel To Umrah,traveltoumrah.co.uk,https://traveltoumrah.co.uk,United Kingdom,domain_tld,Europe,uk,info@bismillahumrahservices.co.uk,bismillahumrahservices.co.uk,external_domain,yes,no,+44 20 3287 2118,+442032872118,email_and_phone,B,email_then_phone,legitimate_interest,email_verified,25.61,Book Luxury & Cheap Umrah Packages 2026 from UK. we specialize in delivering exceptional Umrah experiences with our all-inclusive packages
Umrah Al,Umrah Al,umrah-alamanah.com,https://umrah-alamanah.com,United Kingdom,text_hint,Europe,com,info@umrah-alamanah.com,umrah-alamanah.com,company_domain,yes,no,020 8813 8600,+442088138600,email_and_phone,B,email_first,legitimate_interest,email_verified,21.25,"Affordable Umrah & Hajj packages with Umrah Al-Amanah, the UK’s trusted agency. 18 years’ experience, ATOL protected & Saudi-approved services."
Umrah Packages UK,Umrah Packages UK,umrahpackagesuk.com,https://umrahpackagesuk.com/umrah-packages-ireland,United Kingdom,text_hint,Europe,com,info@umrahpackagesuk.com,umrahpackagesuk.com,company_domain,yes,no,+44 7404 037532,+447404037532,email_and_phone,B,email_first,legitimate_interest,email_verified,21.25,"Book all-inclusive umrah packages Ireland starting @ £250 with 3-5 star hotels near haram, Visa, flights, transport & ziyarat."
Umrapackages,Umrapackages,umrapackages.co.uk,https://umrapackages.co.uk/umrah-packages,United Kingdom,domain_tld,Europe,uk,info@umrapackages.co.uk,umrapackages.co.uk,company_domain,yes,no,0203 504 1200,+442035041200,email_and_phone,B,email_first,legitimate_interest,email_verified,21.25,Book Affordable Umrah Package
Ziyufalrahman,Ziyufalrahman,ziyufalrahman.co.uk,https://ziyufalrahman.co.uk/umrah-packages,United Kingdom,domain_tld,Europe,uk,info@ziyufalrahman.co.uk,ziyufalrahman.co.uk,company_domain,yes,no,+44 161 949 4499,+441619494499,email_and_phone,B,email_first,legitimate_interest,email_verified,21.25,Discover your perfect Umrah Packages. ATOL protected and all-inclusive deals with direct flights & hotels. Book your Umrah journey today.
Alhaq Tours,Alhaq Tours,alhaqtours.com,https://alhaqtours.com/umrah-packages-from-houston.html,United States,text_hint,North America,com,info@alhaqtours.com,alhaqtours.com,company_domain,yes,no,312) 923 - 7866,+13129237866,email_and_phone,B,email_first,legitimate_interest,email_verified,21.25,"Book affordable and luxury Umrah packages from Houston 2026 with AlHaq Tours. Get 3–5 star hotels, direct flights, visa help, and family-friendly deal"
Alhelal Tour S,Alhelal Tours,alhelal-tours.com,https://alhelal-tours.com/umrah-from-usa-america-best-umrah-company,United States,text_hint,North America,com,info@alhelal-tours.com,alhelal-tours.com,company_domain,yes,no,4 - 01211326666,+14012113266,email_and_phone,B,email_first,legitimate_interest,email_verified,21.25,عمرة من الولايات المتحدة مع افضل شركة عمرة من امريكا | شركة الهلال شركة تنظيم عمرة من امريكا بكل أحترافيه
AlSafwa Tours,AlSafwa Tours,alsafwatours.com,https://alsafwatours.com/about,United States,phone,North America,com,info@alsafwatours.com,alsafwatours.com,company_domain,yes,no,+1 (872) 263-9805,+18722639805,email_and_phone,B,email_first,legitimate_interest,email_verified,21.25,About
Shafie Travels,Shafie Travels,alshafietravels.com,https://alshafietravels.com/umrah-packages-houston,United States,text_hint,North America,com,info@alshafietravels.com,alshafietravels.com,company_domain,yes,no,+1(718) 973-9626,+17189739626,email_and_phone,B,email_first,legitimate_interest,email_verified,23.92,"Explore Umrah packages from Houston 2026 with flights, hotels and visa support. Check Umrah packages Houston prices and plan your trip with Al Shafie Travels."
Arrahman Tours,Arrahman Tours,arrahman-tours.com,https://www.arrahman-tours.com,United States,text_hint,North America,com,info@arrahman-tours.com,arrahman-tours.com,company_domain,yes,no,425) 522-4292,+14255224292,email_and_phone,B,email_first,legitimate_interest,email_verified,21.25,"Explore Islamic tours, Hajj, and Umrah with Arrahman Tours, established in 1992. Experience spiritual journeys with expert guidance and well-managed logistics. Based in Seattle, Washington."
