company,contact_name,role,email,phone,domain,source_url,source_label,consent_status,verification_status,overall_score,raw_text_snippet
Umrahme,,Procurement Manager,care@umrahme.com,+971523873550,umrahme.com,https://www.umrahme.com/umrah-packages/ar-sa,Public website crawl,unknown,email_verified,21.25,احجز باقة عمرة أو رحلات العمرة اونلاين مع عمرة مي. استمتع بأفضل اسعار رحلات العمرة وبرامج العمرة، واطلع على جدول العمرة الخاص للحصول على أفضل باقة للعمرة. احجز الآن!
Umrah Me,,Procurement Manager,care@umrahme.com,+971 523873550,umrahme.com,https://www.umrahme.com/pages/ar-us/contact-us,Public website crawl,unknown,email_verified,21.25,اتصل بنا
Umrah Packages UK,,Procurement Manager,info@umrahpackagesuk.com,+44 7404 037532,umrahpackagesuk.com,https://umrahpackagesuk.com/umrah-packages-ireland,Public website crawl,legitimate_interest,email_verified,21.25,"Book all-inclusive umrah packages Ireland starting @ £250 with 3-5 star hotels near haram, Visa, flights, transport & ziyarat."
Voyages Cortoba,,Procurement Manager,info@voyagescortoba.com,+514-303-3033,voyagescortoba.com,https://voyagescortoba.com/contact,Public website crawl,legitimate_interest,email_verified,21.25,"Address 657 CURÉ-LABELLE SUITE 250 LAVAL QUÉBEC H7V 2T8 +514-303-3033 + 1877-714-3033 sans frais Email info@voyagescortoba.com Heures d'ouverture Mon- Sat: 10:00 AM - 18:00 PM Envoyez-nous votre message Vous avez des questions concernant le Hajj, la Omra ou la billetterie? N'hésitez pas de nous contacter,"
World Hajj,,Procurement Manager,info@worldhajj.com,+92 335 2248488,worldhajj.com,https://www.worldhajj.com/contact,Public website crawl,legitimate_interest,email_verified,21.25,Reach out to us today for all the details on our exceptional Hajj and Umrah services. Don't miss out on this opportunity!
Yaseen Hajj & Umrah Tours,,Procurement Manager,info@yaseenhajj.com,630) 637-4500,yaseenhajjumrah.com,http://yaseenhajjumrah.com,Public website crawl,legitimate_interest,email_verified,21.25,"Umrah Package | Yaseen Hajj & Umrah Tours Skip to content (630) 637-4500 info@yaseenhajj.com Call Now! Umrah Package Hajj Package 2026 Hajj/Umrah Essentials Testimonials Visa Forms Policy Contact US About Us Facebook Quran Education Project -QuranEdu Call Now! Umrah Package Why Choose Us? A Journey of Faith, Growth, an"
Yaseen Hajj & Umrah Tours,,Procurement Manager,yaseenhajjumrah@gmail.com,630) 637-4500,yaseenhajjumrah.com,http://yaseenhajjumrah.com,Public website crawl,unknown,email_verified,21.25,"Umrah Package | Yaseen Hajj & Umrah Tours Skip to content (630) 637-4500 info@yaseenhajj.com Call Now! Umrah Package Hajj Package 2026 Hajj/Umrah Essentials Testimonials Visa Forms Policy Contact US About Us Facebook Quran Education Project -QuranEdu Call Now! Umrah Package Why Choose Us? A Journey of Faith, Growth, an"
Uwumrah,,Procurement Manager,info@uwumrah.nl,+31 (6) 4720 6688,uwumrah.nl,https://uwumrah.nl/pakketten,Public website crawl,legitimate_interest,email_verified,21.25,Umrah Prijzen 2025/2026
Ziyufalrahman,,Procurement Manager,info@ziyufalrahman.co.uk,+44 161 949 4499,ziyufalrahman.co.uk,https://ziyufalrahman.co.uk/umrah-packages,Public website crawl,legitimate_interest,email_verified,21.25,Discover your perfect Umrah Packages. ATOL protected and all-inclusive deals with direct flights & hotels. Book your Umrah journey today.
Alfalah Travel and Tourism,,Procurement Manager,info@alfalahtravelandtourism.com,,alfalahtravelandtourism.com,https://alfalahtravelandtourism.com,Public website crawl,legitimate_interest,email_verified,20.93,"Alfalah Travel & Tourism provides premium Umrah packages from Canada, featuring 3, 4, and 5-star accommodations, reliable services, and a seamless travel."
Alalaa Travel Hajj and Umrah Tours,,Procurement Manager,info@alalaatravel.com,,alalaatravel.com,https://www.alalaatravel.com/site/about.php,Public website crawl,legitimate_interest,email_verified,20.70,Alalaa Travel is your source for Hajj travel from the USA. Check out our comprehensive 2022 packages for Hajj and Umrah Tours
tasheeltravel.nl,,Procurement Manager,info@tasheeltravel.nl,,tasheeltravel.nl,https://tasheeltravel.nl,Public website crawl,legitimate_interest,email_verified,20.20,"Boek jouw Umrah en Hadj Reizen bij Tasheel Travel - Complete reizen vanuit Nederland met betrouwbare begeleiding, comfort en toewijding."
Bismillahtravels,,Procurement Manager,info@bismillahtravels.ca,,bismillahtravels.ca,https://www.bismillahtravels.ca,Public website crawl,legitimate_interest,email_verified,18.92,"Explore trusted Umrah & Hajj packages with Bismillah Travels. Hassle-free services, expert guidance, and spiritual journeys you can rely on."
Ekasamira Travel,,Procurement Manager,info@ekasamiratravel.com,,ekasamiratravel.com,https://ekasamiratravel.com,Public website crawl,legitimate_interest,email_verified,18.92,"Berangkat Umroh Resmi 2026 bersama Samira Travel. Biaya transparan, hotel dekat Masjidil Haram, bimbingan ustadz, hingga paket Umroh Plus & Furoda Resmi"
Bismillah Hajj and Umrah Services,,Procurement Manager,bismillahhajj2000@hotmail.com,,bismillahhajj.com,https://bismillahhajj.com,Public website crawl,unknown,email_verified,16.25,Home - Bismillah Hajj and Umrah Services 416.883.9693 bismillahhajj2000@hotmail.com Home About Us Umrah Packages November Umrah December Umrah Hajj 2025 How to Register Important Information Important Places Common Questions Articles to Pack Arabic Words to Know Seminar Details Hajj Visa Requirements Contact Us Select
Taqwa Tours,,Procurement Manager,info@taqwatours.us,,taqwatours.us,https://taqwatours.us/umrah-packages/dallas,Public website crawl,legitimate_interest,email_verified,16.25,"Efficient, affordable Umrah packages from Dallas with visa, flights, and halal hotels"
Noor Hajj,,Procurement Manager,webmaster@alnoorhajj.com,,alnoorhajj.com,https://alnoorhajj.com/cgi-sys/suspendedpage.cgi,Public website crawl,unknown,email_verified,16.25,Account Suspended Account Suspended This Account has been suspended. Contact your hosting provider for more information.
baniadamtours.com,,Procurement Manager,info@baniadamtours.com,,baniadamtours.com,https://www.baniadamtours.com/za,Public website crawl,legitimate_interest,email_verified,16.25,"Experience spiritually enriching Umrah journeys with Bani Adam Tours. Choose from our thoughtfully crafted packages designed for comfort, knowledge, and worship. Perfect for individuals, families, and groups—your stress-free journey awaits. Book today!"
Flight & Hotel!,,Procurement Manager,csu@nasholidays.com,,booking.nasholidays.com,https://booking.nasholidays.com/forfaits_omra/fr,Public website crawl,unknown,email_verified,16.25,"Nasholidays propose un large éventail de forfaits au rapport qualité-prix exceptionnel pour les vacances et la Omra. Découvrez les meilleures formules vol + hôtel à des prix imbattables vers 70 destinations populaires, nationales et internationales, présentées par la meilleure compagnie aérienne à bas prix du Moyen-Ori"
France Omra,,Procurement Manager,contact@franceomra.com,,franceomra.com,https://franceomra.com,Public website crawl,legitimate_interest,email_verified,16.25,France Omra : Organisateur de Hajj et Omra
France Omra,,Procurement Manager,contact@franceomra.fr,,franceomra.com,https://franceomra.com,Public website crawl,legitimate_interest,email_verified,16.25,France Omra : Organisateur de Hajj et Omra
Departures with Verified Imams,,Procurement Manager,support@go-together.co,,go-together.co,https://www.go-together.co/en-US/umrah-packages/from-charlotte-nc,Public website crawl,legitimate_interest,email_verified,16.25,Book authentic Umrah packages departing from Charlotte. Join verified local imams for your spiritual journey to Mecca and Medina.  Muslims served.
GoTogether,,Procurement Manager,investors@go-together.co,,go-together.co,https://www.go-together.co/en-US/about,Public website crawl,unknown,email_verified,16.25,"Learn about GoTogether, the pioneering Saudi tech startup connecting Muslims with trusted leaders for authentic Umrah and spiritual journeys."
হজ প্যাকেজ,,Procurement Manager,haab01bd@gmail.com,,haabbd.com,https://haabbd.com/site/hajj-package,Public website crawl,unknown,email_verified,16.25,00
Hajj & Umrah Trips,,Procurement Manager,info@hajjandumrahtrips.com,,hajjandumrahtrips.com,https://hajjandumrahtrips.com/umrah-packages/dallas,Public website crawl,legitimate_interest,email_verified,16.25,Umrah Packages From Dallas
Hajj and Umrah Packages,,Procurement Manager,contact@mysite.com,,hajjandumrahpackages.com,https://hajjandumrahpackages.com/hajj-packages,Public website crawl,legitimate_interest,email_verified,16.25,"Explore our Hajj Packages for 2025, offering a variety of options from affordable to luxury experiences. Enjoy comfortable accommodations...."
Hajj Umrah Info,,Procurement Manager,info@hajjumrahinfo.co.za,,hajjumrahinfo.co.za,https://www.hajjumrahinfo.co.za,Public website crawl,legitimate_interest,email_verified,16.25,"Browse and compare Hajj and Umrah packages in South Africa. Compare by operator, stay length, hotel, package features. Find the perfect package to suit your needs."
HajumrahBooking,,Procurement Manager,info@hajumrahbooking.com,,hajumrahbooking.com,https://hajumrahbooking.com/tr,Public website crawl,legitimate_interest,email_verified,16.25,"Hac ve Umre yolculuğunuzu kolayca planlayın. Lüks oteller, güvenilir rehberler ve konforlu transferler."
Hulm Hijrah,,Procurement Manager,office@hulmhijrah.co,,hulmhijrah.co,https://hulmhijrah.co/about-us,Public website crawl,legitimate_interest,email_verified,16.25,Introduction
Beste Umrah Preise,,Procurement Manager,booking@idealgate.de,,idealgate.de,https://www.idealgate.de,Public website crawl,unknown,email_verified,16.25,"IDEALGATE bietet transparente Umrah Kosten und beste Umrah Preise fÃ¼r Ihr Umre Paket. Entdecken Sie Kaaba, Mekka und Medina. Von Deutschland und ganz Europa."
Inspired Tours,,Procurement Manager,joinus@inspiredtours.com.au,,inspiredtours.com.au,https://inspiredtours.com.au/hajj-packages,Public website crawl,unknown,email_verified,16.25,Hajj Packages
Flight & Hotel!,,Procurement Manager,csu@nasholidays.com,,nasholidays.com,https://nasholidays.com/%D8%A8%D8%A7%D9%82%D8%A7%D8%AA_%D8%A7%D9%84%D8%B9%D9%85%D8%B1%D8%A9/ar,Public website crawl,unknown,email_verified,16.25,"عطلات ناس | حجز باقات العطلات والعمرة بأفضل الأسعار – الفنادق مع رحلات الطيران

تخطّط لباقة عطلة أو عمرة فريدة؟ استمتع بباقات سفر مخصصة لراحتك. عطلات ناس هي خيارك الأفضل لحجز باقة العطلة أو العمرة لتجربة سفر لا تُنسى بسعر أقل. احجز رحلات الطيران والفنادق بالإضافة إلى خدمات مثل المواصلات و الجولات السياحية واستمتع بتجرب"
Sabile voyages,,Procurement Manager,info@sabilevoyages.com,,sabilevoyages.com,https://sabilevoyages.com,Public website crawl,legitimate_interest,email_verified,16.25,"HAJJ & OMRA 2023/2024. Partez en Omra toute l'annÃ©e avec Sabile Voyages, la premiÃ¨re agence 100% en ligne."
Sunnah Hajj,,Procurement Manager,labbayk@sunnahhajj.com,,sunnahhajj.com,https://sunnahhajj.com/about,Public website crawl,unknown,email_verified,16.25,About
Umrah Companions,,Procurement Manager,johndoe@email.com,,umrahcompanions.com,https://umrahcompanions.com,Public website crawl,unknown,email_verified,16.25,"Premium, Economy & Budget  Umrah packages 2026 . Affordable Umrah Packages 2026 from all over the World"
Umrah Expresusa,,Procurement Manager,info@umrahexpresusa.com,,umrahexpresusa.com,https://umrahexpresusa.com,Public website crawl,legitimate_interest,email_verified,16.25,"Plan your sacred journey with Umrah Express USA. Explore affordable, luxury, and all-inclusive Umrah & Hajj packages departing from the United States."
Approved Hajj Travel Agents,,Procurement Manager,,00971506506468,hajinformation.com,https://www.hajinformation.com/main/n72u01.htm,Public website crawl,unknown,phone_verified,15.56,USA - Approved Hajj Travel Agents
TH Travel,,Procurement Manager,,+6019 289 7624,thts.com.my,https://www.thts.com.my/haji,Public website crawl,unknown,phone_verified,14.49,TH Travel
TH Travel,,Procurement Manager,,+6019 289 7624 (8,thts.com.my,https://www.thts.com.my/tentang-kami,Public website crawl,unknown,phone_verified,14.49,TH Travel
IV Travel,,Procurement Manager,,087 374 5622 62,ivtravel.org,https://ivtravel.org,Public website crawl,unknown,phone_verified,13.92,Home
Hajj Umrah travel agents from UK,,Procurement Manager,,+442071839663,perfectumrah.us,https://www.perfectumrah.us/index.php,Public website crawl,unknown,phone_verified,13.86,"Book Economy to 5Star Umrah Packages From USA with Most Trusted Umrah Company. We have served more than 10,000 pilgrims and earned 5 Star Reviews."
Hajj Umrah travel agents from UK,,Procurement Manager,,+442071835226,umrahpackagescanada.com,https://www.umrahpackagescanada.com,Public website crawl,unknown,phone_verified,13.86,"Book Economy to 5Star Umrah Packages Canada with Most Trusted Umrah Company. We have served more than 10,000 pilgrims and earned 5 Star Reviews."
Heaven Tours,,Procurement Manager,,+20-115-637-7771,heaventours.com,https://heaventours.com/about,Public website crawl,unknown,phone_verified,13.67,"Heaven Tours, Inc. is a U.S.-based tour operator and a proud member of the International Air Transport Association (IATA) , as well as a certified Hajj Travel Agent . Recognized for our expertise in designing premium Hajj packages, we specialize in creating VIP package  experiences for both groups and individuals. Our"
Bestair Travel Bd,,Procurement Manager,,+88) 01784671947,bestairtravelbd.com,https://bestairtravelbd.com/%E0%A6%9C%E0%A6%BE%E0%A6%A8%E0%A7%81%E0%A7%9F%E0%A6%BE%E0%A6%B0%E0%A6%BF-%E0%A7%A8%E0%A7%A6%E0%A7%A8%E0%A7%AC-%E0%A6%93%E0%A6%AE%E0%A6%B0%E0%A6%BE%E0%A6%B9-%E0%A6%AA%E0%A7%8D%E0%A6%AF%E0%A6%BE,Public website crawl,unknown,phone_verified,13.50,জানুয়ারি ২০২৬ ওমরাহ প্যাকেজ
Sara International Travel,,Procurement Manager,,+1 718 848 1222 166,sarainternationaltravel.com,https://sarainternationaltravel.com/contact,Public website crawl,unknown,phone_verified,13.50,Contact Sara International Travel
USA Best Hajj and Umrah Travel Agency,,Procurement Manager,,929)-833-1717,alhateemtours.com,https://www.alhateemtours.com,Public website crawl,unknown,phone_verified,13.22,"Plan your Hajj and Umrah with AlHateem Tours, a trusted Islamic travel agency in the USA, for affordable services and seamless pilgrimage experiences."
Al Hoda Hajj Group Travel USA,,Procurement Manager,,1-866-254-6321,alhodahajjgroup.com,https://alhodahajjgroup.com/hajj-packages,Public website crawl,unknown,phone_verified,13.21,"ALHoda Hajj Group USA is a trusted Islamic travel agency and Muslim travel agency in the USA offering Hajj packages, Umrah packages, Ramadan Umrah trips, Saudi visa services, and Islamic pilgrimage travel with 37 years of experience."
MKM Ticketing Travel & Tours,,Procurement Manager,,+6012-213 0579,mkm.my,https://mkm.my/about,Public website crawl,unknown,phone_verified,12.90,03-7831 6740
Darulifta.info,,Procurement Manager,,62987 2019-05-26,darulifta.info,https://www.darulifta.info/d/jamiaturrasheed/fatwa/5KY/%D8%B9%D9%85%D8%B1%DB%81-%DA%A9%DB%92-%D9%84%DB%8C%DB%92-%D9%B9%D8%B1%DB%8C%D9%88%D9%84-%D8%A7%DB%8C%D8%AC%D9%86%D8%B3%DB%8C-%DA%A9%DB%8C-%D8%B7%DB%92-%DA%A9%D8%B1%D8%AF%DB%81-%D8%B4%D8%B1%D8%A7%D8%A6%D8%B7-%DA%A9%D8%A7-%D8%AD%DA%A9%D9%85,Public website crawl,unknown,phone_verified,12.32,ruling regarding the terms and conditions set by a travel agency for umrah
Hajj Companions,,Procurement Manager,,+966 59 457 9323,hajjcompanions.com,https://hajjcompanions.com/nusuk-hajj-packages-2025-from-france,Public website crawl,unknown,phone_verified,11.86,"Embark on a simplified Hajj journey in five easy steps, ensuring a seamless and sacred pilgrimage experience."
Only Tourism,,Procurement Manager,,+971501031771,onlytourism.com,https://onlytourism.com/umrah-ar,Public website crawl,unknown,phone_verified,11.77,4.9/52k+ المراجعات
Sara International Travel,,Procurement Manager,,+1 (718) 848-1222,sarainternationaltravel.com,https://sarainternationaltravel.com,Public website crawl,unknown,phone_verified,11.69,"32+ years of Proud Legacy in Umrah & Hajj, enriching 100,000+ pilgrimages. Join us"
iLink Tours,,Procurement Manager,,+1-516-347-1175 15,ilinktours.com,https://ilinktours.com,Public website crawl,unknown,phone_verified,11.45,"Travel with iLink Tours—your trusted Islamic holiday, Hajj & Umrah agency in USA. Affordable packages with flights, hotels, visa processing & ground transport included."
Umrahpackageschicago,,Procurement Manager,,+1 (312) 555-0147,umrahpackageschicago.com,https://umrahpackageschicago.com,Public website crawl,unknown,phone_verified,11.40,Book trusted Umrah packages from Chicago to Makkah & Madinah. IATA-certified travel agency offering Economy to VIP packages. Flexible payments. Call +1-312-555-0147 today!
MKM Ticketing Travel & Tours,,Procurement Manager,,03-7831 6740 15,mkm.my,https://mkm.my,Public website crawl,unknown,phone_verified,11.40,Nak Bawa Mak Ayah Umrah? Ini Checklist Penting Supaya Mereka Tak Terlalu Letih di Tanah Suci.
Travel Umroh Haji Terbaik,,Procurement Manager,,006-0008-012-225,alhijazindonesia.com,https://alhijazindonesia.com/umroh,Public website crawl,unknown,phone_verified,11.35,Alhijaz Indowisata adalah agen travel Haji Plus dan Umroh resmi yang terdaftar di Kementerian Agama RI dengan predikat AKREDITASI “A” Terbaik
"Paket Biaya Haji Plus 2026 Travel Haji Khusus Akreditasi ""A""",,Procurement Manager,,0857-1692-6969,haji.plus,https://www.haji.plus,Public website crawl,unknown,phone_verified,11.35,"Paket biaya haji plus 2026/2027 travel haji khusus terbaik dengan akreditasi ""A"". Segera hubungi kami untuk info dan pendaftaran!"
Kembara Sufi Travel & Tours,,Procurement Manager,,03 - 5523 4498,kembarasufi.com,https://kembarasufi.com/luar_negara/pakej-new-zealand,Public website crawl,unknown,phone_verified,11.31,"Percutian ke New Zealand 10 Hari 8 Malam bersama Kembara Sufi Travel & Tours Sdn Bhd, Peneraju Pakej Pelancongan Muslim Terbaik di Malaysia"
Canada Umrah,,Procurement Manager,,+1 (647) 704-2525,canadaumrah.com,https://canadaumrah.com,Public website crawl,unknown,phone_verified,11.27,"Affordable Umrah Packages from Canada 2026. IATA certified travel agency offering economy to luxury packages with flights, hotels & visa. Book now from $1,295!"
Umrah Packagesnewyork,,Procurement Manager,,+1 (917) 555-1234,umrahpackagesnewyork.com,https://umrahpackagesnewyork.com,Public website crawl,unknown,phone_verified,11.27,"Book affordable Umrah packages from New York to Makkah & Madinah. IATA certified travel agency offering 6 package options starting at $2,899. Call now for 2026 deals!"
Biaya Haji Plus 2026/2027 Travel Haji Khusus Terpercaya,,Procurement Manager,,021) 72781015,biayahaji.com,https://www.biayahaji.com,Public website crawl,unknown,phone_verified,11.23,Paket Biaya Haji Plus 2023-2024 / Haji Khusus Kuota Resmi Kementerian Agama (Kemenag). DP US$ 4.500 langsung dapat nomor porsi. Mau?
Cheetah Travel Australia Australia,,Procurement Manager,,+61 475 001 002,cheetahtravel.com.au,https://cheetahtravel.com.au,Public website crawl,unknown,phone_verified,11.23,"Join us for an unforgettable Umrah experience this September/November 2026 with Cheetah Travel Centre . Let us guide you through a spiritually enriching journey designed for your comfort, convenience, and connection."
Alhijaz Indowisata Travel Umroh Jakarta,,Procurement Manager,,006-0008-012-225,alhijaz.travel,https://alhijaz.travel,Public website crawl,unknown,phone_verified,11.20,Terima kasih untuk tim Alhijaz Indowisata yang sudah membantu Laxmi dan keluarga menjadi tamu Allah yang terlayani dengan baik. Insyaallah jika ada rezeki
Agence Hajj et Omra 2026,,Procurement Manager,,01 34 92 98 25,chaimatravel.net,https://www.chaimatravel.net,Public website crawl,unknown,phone_verified,11.16,Découvrez nos forfaits Omra et Hajj 2026 et réservez votre pèlerinage avec l'agence Chaima Travel agréée par la Ministère du Hajj & Omra.
South Africa Travel,,Procurement Manager,,1-215-572-7676,gate1travel.com,https://www.gate1travel.com/africa/south-africa,Public website crawl,unknown,phone_verified,11.16,"Gate 1 Travel has provided quality, affordable escorted tours, river cruises and vacation packages for 40 years. We look forward to showing you More of the World for Less on your next vacation."
Alkhair Travel,,Procurement Manager,,+447481686598,alkhairtravel.co.uk,https://www.alkhairtravel.co.uk/book/hajj-packages,Public website crawl,unknown,phone_verified,11.05,"Your one-stop shop for organizing and booking Hajj Packages is AlKhair Travel. Our Hajj Packages can be tailored to your specifications. Speak with our Hajj specialists to select the time, day, flights, hotels (5-star, 4-star, and 3-star), local transportation, and other essential arrangements based on your needs for c"
Alhaq Travel,,Procurement Manager,,020 34757513,alhaqtravel.co.uk,https://www.alhaqtravel.co.uk/buy/umrah-packages-birmingham,Public website crawl,unknown,phone_verified,11.00,"Book your Umrah from Birmingham at AlHaq Travel – cheap Umrah packages Birmingham with best facilities and exclusive services. Prompt visa processing, accommodation options in the close vicinity to Haram, direct and cheap flights from Birmingham. ATOL protection. Early bird discounts. Easy instalment plan. Book now wit"
Al Momin Travels,,Procurement Manager,,+442032890000 15,almomintravel.co.uk,https://almomintravel.co.uk,Public website crawl,unknown,phone_verified,10.97,"Book affordable Umrah packages from the UK with Almomin Travel. ATOL-protected flights, visa, hotels and group deals for a stress-free Umrah journey."
Pakej Haji By Azzuha Travel,,Procurement Manager,,011-1078 3467,pakejhaji.com.my,https://pakejhaji.com.my,Public website crawl,unknown,phone_verified,10.94,"Dapatkan Pakej Haji 2026 yang lengkap dan dipercayai dengan kemudahan penginapan strategik, mutawwif bertauliah, kursus persediaan haji dan jadual perjalanan tersusun. Tempahan telah dibuka untuk jemaah yang mencari keselesaan, bimbingan berkualiti dan pengalaman ibadah yang lancar."
Almaknoontravels,,Procurement Manager,,+44 208 4786 886,almaknoontravels.co.uk,https://almaknoontravels.co.uk/umrah-packages-from-birmingham,Public website crawl,unknown,phone_verified,10.17,Welcome to Al Maknoon Travels
Alhamdtravel,,Procurement Manager,,929)-833-1717,alhamdtravel.com,https://www.alhamdtravel.com/umrah-from-houston.html,Public website crawl,unknown,phone_verified,10.17,"Start your Umrah journey from Houston with Alhamd Travel. Packages start at $1290, including flights from IAH, visa, hotels, transport & 24/7 support."
Haramain Travels,,Procurement Manager,,+61 422 037 453,alharamaintravels.com.au,https://alharamaintravels.com.au/contact,Public website crawl,unknown,phone_verified,10.17,Get In Touch
Trusted Umrah Agency in Maryland,,Procurement Manager,,+1 202-674-8688,amluxtravels.com,https://amluxtravels.com/umrah-service,Public website crawl,unknown,phone_verified,10.17,"Perform Umrah with peace of mind. Amlux Travels, a trusted umrah agency in Maryland, offers all-inclusive Umrah packageswith visa assistance, flights, and hotel reservations for a seamless pilgrimage."
travels.de,,Procurement Manager,,+49 176 66869080,ihsan-travels.de,https://ihsan-travels.de/impressum,Public website crawl,unknown,phone_verified,10.17,"Impressum Impressum Ehsan Tawakkuli
Reisevermittler
Winterhuder Weg 53D
22085 Hamburg Kontakt Telefon: +49 176 66869080 E-Mail: info[@]ihsan-travels.com Gewerbeanmeldung gemÃ¤Ã Â§ 14 GewO: Hamburg Redaktionell verantwortlich Ehsan Tawakkuli
Winterhuder Weg 53D
22085 Hamburg Verbraucherstreitbeilegung/Universalschlicht"
Rayhar Travels,,Procurement Manager,,011-65691942,rayhar.com,https://rayhar.com,Public website crawl,unknown,phone_verified,10.17,Berpengalaman Mesra Berkualiti
Umrah Packagesnetherlands,,Procurement Manager,,+31 10 234 5678,umrahpackagesnetherlands.com,https://umrahpackagesnetherlands.com,Public website crawl,unknown,phone_verified,8.20,"Book affordable Umrah packages from Netherlands to Makkah & Madinah. IATA certified, 5-star hotels, direct flights. Starting €1,995. Family & group discounts available."
Bismillah Tours,,Procurement Manager,,929)-833-1717,bismillahtours.com,https://www.bismillahtours.com/houston-umrah-packages.html,Public website crawl,unknown,phone_verified,7.50,Discover Affordable Umrah Packages from Houston - Reserve Your Spiritual Journey Now for a Memorable Experience!
Umrahpackageshouston,,Procurement Manager,,+1 (713) 555-8888,umrahpackageshouston.com,https://umrahpackageshouston.com,Public website crawl,unknown,phone_verified,7.50,"Book affordable Umrah packages from Houston to Makkah & Madinah. IATA certified, all-inclusive deals starting at $2,499. Visa, flights, hotels & more. Call now!"
UAMA,,Procurement Manager,,+1 800 123 456 789,uama.us,https://uama.us/umrah,Public website crawl,unknown,phone_verified,7.50,"HISAR TOUR × UAMA • From Dream to Reality, We Make It Happen"
Agence Issa Omra,,Procurement Manager,,+33 6 67 39 87 37,agence-issa-omra.com,https://agence-issa-omra.com,Public website crawl,unknown,phone_verified,7.50,"Agence Issa Omra â Omra sur mesure 2026 Ã  partir de 400â¬. Visa Omra, hÃ´tels La Mecque & MÃ©dine, location voiture MÃ©dine, transport Haramain, guide francophone. Devis gratuit et personnalisÃ© en 2 minutes. Omra pas cher pour toute la France, Belgique, Suisse, AlgÃ©rie, Maroc, Tunisie."
