company,contact_name,role,email,phone,domain,source_url,source_label,consent_status,verification_status,overall_score,raw_text_snippet
London Hajj & Umrah,,Procurement Manager,sales@london-travels.co.uk,020 33931701 10,london-hajj-umrah.com,https://london-hajj-umrah.com,Public website crawl,legitimate_interest,email_verified,25.31,Looking for affordable hajj and umrah packages? London Travel are the best Hajj and umrah service provider based in London UK. Contact us at: 020 7993 0104.
Mekka Travel,,Procurement Manager,info@mekka-travel.com,+49 1575 5743087,mekka-travel.com,https://mekka-travel.com/umrah-frankfurt,Public website crawl,legitimate_interest,email_verified,25.31,"Umrah Frankfurt 2026: Flug, Hotels Mekka & Medina, Visa & Transfers. Optional individuell ohne Gruppe. Jetzt unverbindlich anfragen!"
Muslims Holy Travel,,Procurement Manager,info@muslimsholytravel.co.uk,0203 900 0310,muslimsholytravel.co.uk,https://www.muslimsholytravel.co.uk/umrah-packages-luton,Public website crawl,legitimate_interest,email_verified,25.31,"Book cheap Luton Umrah packages from the UK with flights, Haram hotels, transfers and visa support included. Book now!"
Noble Hajj Umrah,,Procurement Manager,info@noblehajjumrah.com,+32 465 70 45 62,noblehajjumrah.com,https://noblehajjumrah.com/contact,Public website crawl,legitimate_interest,email_verified,25.31,"Contact Noble Hajj Umrah for Hajj, Umrah, and Islamic tour inquiries. Our team is here to assist you with travel bookings, package details, and personalized support."
TakeMeToUmrah.com,,Procurement Manager,info@takemetoumrah.com,1-888-358-6724,takemetoumrah.com,https://takemetoumrah.com/umrah-packages-from-montreal,Public website crawl,legitimate_interest,email_verified,25.31,"Book your Umrah from Montreal with Take Me To Umrah. Experience seamless travel, visa assistance, and trusted service for a spiritually rewarding journey."
Taibah Travels,,Procurement Manager,info@taibahtravels.com,+1 (206) 848-5272,taibahtravels.com,https://taibahtravels.com/detroit-mi,Public website crawl,legitimate_interest,email_verified,25.31,"Experience top Umrah services in Detroit, MI, with Taibah Travels, offering visa assistance, direct flights, and convenient packages for your pilgrimage needs."
albaseerahtravel,,Procurement Manager,info@albaseerah.travel,01274 317 867,albaseerah.travel,https://www.albaseerah.travel,Public website crawl,legitimate_interest,email_verified,25.25,Albaseerah Travel - A Bradford based travel agency offering premier 5* Hajj & Umrah packages. Perform Hajj 2026 with us by enquiring now.
Al Musafir Travel,,Procurement Manager,info@almusafirtravel.co.uk,+44 20 3504 1840,almusafirtravel.co.uk,https://almusafirtravel.co.uk/glasgow,Public website crawl,legitimate_interest,email_verified,25.25,"Umrah Travel Agency Glasgow offers affordable Umrah packages, visa assistance, hotel bookings, and complete travel arrangements for a smooth and spiritual pilgrimage."
Alraheem Travel S,,Procurement Manager,info@alraheemtravels.com,2025 2025-05-21,alraheemtravels.com,http://alraheemtravels.com/blogs/best-umrah-travel-agency-in-arizona,Public website crawl,legitimate_interest,email_verified,25.25,"Looking for the Best Umrah Travel Agency in Arizona USA? Alraheem Travels offers Affordable Umrah Packages 2025 with flights, hotels, Visa & Imam guidance."
Ark Travelers AB,,Procurement Manager,info@arktravelers.com,+46 700 101 401,arktravelers.com,https://www.arktravelers.com,Public website crawl,legitimate_interest,email_verified,25.25,"Ark Travelers AB makes travel easy worldwide. Flights, hotels, excursions, visas, and Umrah & Hajj packages handled with care and personal attention."
Bukhari Tours,,Procurement Manager,info@bukharitours.com,+44 7513 311939,bukharitours.co.uk,https://bukharitours.co.uk/contact-us,Public website crawl,legitimate_interest,email_verified,25.25,"Get in touch with Bukhari Tours, the UK’s trusted Hajj & Umrah travel agency. Serving Manchester, London & Birmingham with expert Islamic travel guidance."
Haj,,Procurement Manager,info@haj.co.uk,020 7286 1111,haj.co.uk,https://www.haj.co.uk,Public website crawl,legitimate_interest,email_verified,25.25,Haj & Umra Travel provide Hajj and Umrah escorted tours as well as tailor made packages to suit different budgets. Specialists with decades of experience.
ALMAASI NUJOOM,,Procurement Manager,nujoomalmaasi@mweb.co.za,061 495 4745,almaasinujoom.co.za,https://www.almaasinujoom.co.za,Public website crawl,unknown,email_verified,25.20,"Experience premium Hajj and Umrah packages with ALMAASI NUJOOM. Offering luxury accommodations, expert guidance, and complete travel services for your spiritual journey to Makkah and Madina."
Aqdas Travel,,Procurement Manager,info@aqdastravel.co.uk,0203 504 1818,aqdastravel.co.uk,https://aqdastravel.co.uk/umrah-packages-from-liverpool,Public website crawl,legitimate_interest,email_verified,25.20,"Umrah Packages From Liverpool for families & mosque groups. Direct flights, Northwest support, ATOL protected. 9 years, 20,000+ pilgrims."
Bismillah Travel,,Procurement Manager,info@bismillahtravel.co.uk,0208 145 7860,bismillahtravel.co.uk,https://www.bismillahtravel.co.uk/umrah-from-leicester.html,Public website crawl,legitimate_interest,email_verified,25.20,"Book your Umrah package from Leicester with Bismillah Travel. All-inclusive Umrah packages with flights, 3-5 star hotels, visa services, transport & ziyarat tours."
Umrah Travel & Halal Tours Company,,Procurement Manager,enquiry@crescenttours.com.au,0420 800 894,crescenttours.com.au,https://crescenttours.com.au,Public website crawl,unknown,email_verified,25.20,"With 78 years of experience, Crescent Tours offers premium, all-inclusive Halal & Umrah travel in Australia. Travel with experts who make every trip extraordinary!"
Falcon Travel,,Procurement Manager,info@falcontravel.ca,1-844-774-2828,falcontravel.ca,https://falcontravel.ca,Public website crawl,legitimate_interest,email_verified,25.20,"Falcon Travel offers Hajj, Umrah, Saudi visa services, and Islamic tours for Muslims across Canada. Trusted travel agency serving pilgrims since 1980."
Hisar Travel Australia,,Procurement Manager,hisartravelau@gmail.com,+61 4 11 456 014,hisartravel.com.au,https://hisartravel.com.au/umrah,Public website crawl,unknown,email_verified,25.20,"Explore affordable Umrah packages from Sydney, Melbourne, Perth & across Australia. Book your journey to the Holy Land with our trusted, seamless services."
Masartomecca,,Procurement Manager,info@masartomecca.com,+1 917-227-9341,masartomecca.com,https://masartomecca.com/umrah-packages-from-new-york,Public website crawl,legitimate_interest,email_verified,25.20,"Book Umrah packages from New York with a trusted Umrah travel agency from New York. Affordable prices, flights, hotels, visa & full support."
Sky Bright Travel,,Procurement Manager,skybrighttravel@mail.com,7 01274 043405,skybrighttravel.co.uk,https://skybrighttravel.co.uk/contact,Public website crawl,unknown,email_verified,25.20,Have a question about travel plan. Contact us for assistance on airline tickets or other services — we value your journey.
King Travel Can Ltd,,Procurement Manager,info@kingtravelcan.com,5464) 905-624-8555,kingtravelcan.com,https://kingtravelcan.com,Public website crawl,legitimate_interest,email_verified,25.15,"Book Umrah packages from Canada with King Travel. Explore Hajj packages, flight deals, visa support, and trusted travel services for pilgrims across Canada."
British Haj Travel,,Procurement Manager,booking@britishhajtravel.com,01772252996,britishhajtravel.com,https://britishhajtravel.com/umrah-package-from-manchester,Public website crawl,unknown,email_verified,25.15,Certainly! Here's a professional and informative blog article tailored for an Umrah package departing from Manchester: Umrah Packages from Manchester: A
ITravelBest,,Procurement Manager,info@itravelbest.com,972) 837-5009,itravelbest.com,https://www.itravelbest.com/umrah-agent/top-umrah-agencies-in-dallas-what-to-know-before-you-book,Public website crawl,legitimate_interest,email_verified,25.15,"Embarking on the sacred journey of Umrah is a deeply spiritual and transformative experience. For many Muslims in Dallas, preparing for Umrah raises important"
Noussouki Travel,,Procurement Manager,reservation.noussouki@gmail.com,+33 7 45 46 61 50,noussoukitravel.com,https://www.noussoukitravel.com/agence-omra-lyon,Public website crawl,unknown,email_verified,25.15,"Découvrez Noussouki Travel, votre agence de confiance à Lyon-69000, spécialisée dans l'organisation de pèlerinages Hajj et Omra"
MARAM TOURS & TRAVEL,,Procurement Manager,manager@maramtravel.com,212)-523-0314,maramtravel.com,https://www.maramtravel.com,Public website crawl,unknown,email_verified,25.10,Hajj & Umrah Agency Specializing in Hajj & Umrah Packages from USA for Over 25 Years. We offer Affordable Hajj Packages and Deluxe Hajj Packages. We offer Affordable as well as Deluxe Umrah Packages from USA and Canada. We offer Umrah packages from New York and offer Nationwide Umrah  Packages.
Hajj & Umrah Travel Agency,,Procurement Manager,info@marhabamusafir.com,+47 400 62 436,marhabamusafir.com,https://marhabamusafir.com,Public website crawl,legitimate_interest,email_verified,25.10,"Discover reliable and budget-friendly Hajj, Umrah, and Al-Aqsa mosque packages with Marhaba Musafir. Your trusted travel partner for affordable religious pilgrimages and historical tours. Book now!"
Nasser Travel,,Procurement Manager,abdifatah@nassertravel.com,1-877-778-0277,nassertravel.com,http://www.nassertravel.com,Public website crawl,unknown,email_verified,25.10,"Lorem ipsum dolor sit amet, consectetur adipisicing elit, sed do eiusmod tempor incididunt ut labore et  dolore magna incididunt ut labore aliqua."
Nasser Travel,,Procurement Manager,abukar@nassertravel.com,1-877-778-0277,nassertravel.com,http://www.nassertravel.com,Public website crawl,unknown,email_verified,25.10,"Lorem ipsum dolor sit amet, consectetur adipisicing elit, sed do eiusmod tempor incididunt ut labore et  dolore magna incididunt ut labore aliqua."
Nasser Travel,,Procurement Manager,accounting@nassertravel.com,1-877-778-0277,nassertravel.com,http://www.nassertravel.com,Public website crawl,unknown,email_verified,25.10,"Lorem ipsum dolor sit amet, consectetur adipisicing elit, sed do eiusmod tempor incididunt ut labore et  dolore magna incididunt ut labore aliqua."
Nasser Travel,,Procurement Manager,carmelie@nassertravel.com,1-877-778-0277,nassertravel.com,http://www.nassertravel.com,Public website crawl,unknown,email_verified,25.10,"Lorem ipsum dolor sit amet, consectetur adipisicing elit, sed do eiusmod tempor incididunt ut labore et  dolore magna incididunt ut labore aliqua."
Nasser Travel,,Procurement Manager,geedeeye@hotmail.com,1-877-778-0277,nassertravel.com,http://www.nassertravel.com,Public website crawl,unknown,email_verified,25.10,"Lorem ipsum dolor sit amet, consectetur adipisicing elit, sed do eiusmod tempor incididunt ut labore et  dolore magna incididunt ut labore aliqua."
Accurate Travel S,,Procurement Manager,iqbal@accuratetravels.com,416-264-9299,accuratetravels.com,https://accuratetravels.com/contact_us.php,Public website crawl,unknown,email_verified,25.06,"Accurate Travel & Tours offer pre-designed & customized Umrah & Hajj packages including all hotel booking, air tickets, breakfast & dedicated travel to destination"
Indus Travel,,Procurement Manager,post@industravel.no,+4721423444,industravel.no,https://industravel.no,Public website crawl,unknown,email_verified,25.06,"Indus Travel ledende reisebyrå for Hajj & Umrah i Norge. Vi tilbyr pålitelige umrah-pakker med fly, visum, hotell, transport og personlig veiledning."
Noble Hajj Umrah,,Procurement Manager,info@noblehajjumrah.com,0465704562,noblehajjumrah.com,https://noblehajjumrah.com/about-us,Public website crawl,legitimate_interest,email_verified,25.06,"Learn about us (Noble Hajj Umrah), an Islamic travel agency specializing in Hajj, Umrah, and Islamic heritage tours. With years of experience, we serve Muslim travelers across Europe with trusted, Shariah-compliant travel solutions."
Sohail Waqas Travel,,Procurement Manager,info@sohailwaqas.com,+92 303 5655552,sohailwaqas.com,https://sohailwaqas.com/hajj-packages-australia-prices-services-trusted-agents,Public website crawl,legitimate_interest,email_verified,25.06,"Discover 2025 Hajj packages from Australia with 5-star hotels, expert guidance, and affordable deals. Book with Sohail Waqas Travels for a seamless pilgrimage."
Sohail Waqas Travel,,Procurement Manager,msr@sohailwaqas.com,+92 303 5655552,sohailwaqas.com,https://sohailwaqas.com/hajj-packages-australia-prices-services-trusted-agents,Public website crawl,unknown,email_verified,25.06,"Discover 2025 Hajj packages from Australia with 5-star hotels, expert guidance, and affordable deals. Book with Sohail Waqas Travels for a seamless pilgrimage."
umrah and hajj travel agency,,Procurement Manager,info@ummahtravels.org,+1-980-349-3280,ummahtravels.org,https://ummahtravels.org/services,Public website crawl,legitimate_interest,email_verified,25.06,Ummah Travels offers safe and affordable Hajj and Umrah journeys for East African communities and the Muslim Ummah. Experience spiritually fulfilling travel with our dedicated services tailored to your needs.
Hajj & Umrah Experts,,Procurement Manager,info@buraqtravelsusa.com,+1 888-617-3061 690,buraqtravels.com,https://www.buraqtravels.com,Public website crawl,legitimate_interest,email_verified,25.04,Your Trusted Partner for Hajj Umrah & Islamic Tourism
Your One Stop Travel Shop,,Procurement Manager,info@onestoptours.co.za,+27 31 271 2800,onestoptours.co.za,https://onestoptours.co.za/about,Public website crawl,legitimate_interest,email_verified,25.02,"To deliver inspiring services swiftly and efficiently, meeting clients' needs promptly. Offering cost-effective, tailor-made packages for a diverse range of travellers across South Africa."
"Hajj, Umrah and Leisure Travel Services",,Procurement Manager,info@itstimetotravel.co.za,021 001 2044,timetotravel.africa,https://timetotravel.africa,Public website crawl,legitimate_interest,email_verified,25.02,"Time To Travel – Hajj, Umrah and Leisure Travel Services Home About Us Meet The Team Hotels Umrah Packages Umrah Groups Leisure Mauritius Kenya Contact Home About Us Meet The Team Hotels Umrah Packages Umrah Groups Leisure Mauritius Kenya Contact Time To Travel Established in December 2018, Our Company specializes in H"
King Travel Can Ltd,,Procurement Manager,hajj@kingtravelcan.com,5464) 905-624-8555,kingtravelcan.com,https://kingtravelcan.com/contact-king-travel-booking-and-inquiries,Public website crawl,unknown,email_verified,24.95,"Get in touch with King Travel Canada for expert assistance on Umrah and Hajj packages, flight bookings, and Saudi visa services. Our dedicated team is here to help you every step of the way."
King Travel Can Ltd,,Procurement Manager,umrah@kingtravelcan.com,5464) 905-624-8555,kingtravelcan.com,https://kingtravelcan.com/contact-king-travel-booking-and-inquiries,Public website crawl,unknown,email_verified,24.95,"Get in touch with King Travel Canada for expert assistance on Umrah and Hajj packages, flight bookings, and Saudi visa services. Our dedicated team is here to help you every step of the way."
IFI Hajj and Umrah,,Procurement Manager,info@islamicfoundation.ie,00 353 1) 4532 785,islamicfoundation.ie,https://islamicfoundation.ie/services/hajj-and-umrah,Public website crawl,legitimate_interest,email_verified,24.91,"Every year, millions of Muslims worldwide make the journey to Makkah for the annual pilgrimage (Hajj). Dressed in the same simple white clothing to represent human equality, the pilgrims gather to..."
Alraheem Travels,,Procurement Manager,info@alraheemtravels.com,+1 502 431 9860,alraheemtravels.com,http://alraheemtravels.com/about-us,Public website crawl,legitimate_interest,email_verified,24.88,"Alraheem Travels (Al Raheem Travels) offers trusted, affordable Umrah and Hajj packages from the USA. Experience hassle-free Islamic travel with expert guidance, visa assistance, and 24/7 customer support."
Amana Travel Canada,,Procurement Manager,booking@amanatravel.ca,1(888) 909-2651,amanatravel.ca,https://amanatravel.ca,Public website crawl,unknown,email_verified,24.88,"Discover Amana Travel, your trusted travel agency in Edmonton for dream vacations and Umrah packages. We offer expert planning, exclusive deals, and personalized services to make your trip unforgettable. Book your next vacation or Umrah journey with us today!"
Caravan Hajj Umrah,,Procurement Manager,info@caravanhajjumrah.com,+44 7428 786445,caravanhajjumrah.com,https://www.caravanhajjumrah.com,Public website crawl,legitimate_interest,email_verified,24.88,"Experience a seamless Hajj or Umrah pilgrimage with our expert guidance. We offer affordable packages from London, UK. Including flights, visa assistance, accommodation, and 24/7 support. Book your spiritual journey today by Caravan Hajj & Umrah."
Alharam travel,,Procurement Manager,info@alharamtravel.co.uk,+447417471247,alharamtravel.co.uk,https://www.alharamtravel.co.uk/offers/umrah-packages-bradford,Public website crawl,legitimate_interest,email_verified,24.80,"We offer Umrah packages from Bradford with economical to luxury arrangements. Return flights from Bradford. 5 star, 4 star, and 3 star hotel options in Makkah and Medina. We make it affordable with advance Umrah Services. Savings up to 30%, flexible payment options."
Alharam Travel,,Procurement Manager,info@alharamtravel.com,888-608-1057,alharamtravel.com,https://www.alharamtravel.com,Public website crawl,legitimate_interest,email_verified,24.73,"AlHaram Travel is a leading Hajj & Umrah services provider that specializes in designing Hajj & Umrah packages for USA citizens. Select flights from nearest USA airport, choose near Haram hotel & get fast visa processing while booking all-inclusive Hajj & Umrah packages. Avail professional assistance from certified tra"
Embassy Tours,,Procurement Manager,info@embassytours.com,+1 121-356-95950,embassytourshajjandumrah.com,https://embassytourshajjandumrah.com,Public website crawl,legitimate_interest,email_verified,24.64,"Hajj & Umrah Packages from the USA – Embassy Tours Embark on your sacred journey with Embassy Tours. We offer premium Hajj and Umrah packages departing from Los Angeles (LAX), New York (JFK), and major US cities. Our 2025 programs deliver a seamless, spiritually enriching experience—from international airfare and top h"
Embassy Tours,,Procurement Manager,info@embassytourshajjandumrah.com,+1 121-356-95950,embassytourshajjandumrah.com,https://embassytourshajjandumrah.com,Public website crawl,legitimate_interest,email_verified,24.64,"Hajj & Umrah Packages from the USA – Embassy Tours Embark on your sacred journey with Embassy Tours. We offer premium Hajj and Umrah packages departing from Los Angeles (LAX), New York (JFK), and major US cities. Our 2025 programs deliver a seamless, spiritually enriching experience—from international airfare and top h"
Embassy Tours,,Procurement Manager,booking@embassytourshajjandumrah.com,+1 121-356-95950,embassytourshajjandumrah.com,https://embassytourshajjandumrah.com,Public website crawl,unknown,email_verified,24.64,"Hajj & Umrah Packages from the USA – Embassy Tours Embark on your sacred journey with Embassy Tours. We offer premium Hajj and Umrah packages departing from Los Angeles (LAX), New York (JFK), and major US cities. Our 2025 programs deliver a seamless, spiritually enriching experience—from international airfare and top h"
Shafie Travels,,Procurement Manager,info@alshafietravels.com,+1 (718) 973-9626,alshafietravels.com,https://alshafietravels.com/umrah-packages-houston,Public website crawl,legitimate_interest,email_verified,23.92,"Explore Umrah packages from Houston 2026 with flights, hotels and visa support. Check Umrah packages Houston prices and plan your trip with Al Shafie Travels."
Tarteeltravel,,Procurement Manager,info@tarteeltravel.com,+1 (215)-277-7474,tarteeltravel.com,https://www.tarteeltravel.com/umrah-packages/houston,Public website crawl,legitimate_interest,email_verified,23.92,"Book your Umrah from Houston with Tarteel Travel. Enjoy 5-star accommodation, expert guides, and a stress-free experience in the Holy Cities."
Blackburn Travels,,Procurement Manager,info@blackburntravels.co.uk,+44 1254 957786,blackburntravels.co.uk,https://blackburntravels.co.uk,Public website crawl,legitimate_interest,email_verified,23.92,"Experience the spiritual journey of Umrah with ease and comfort. Our services ensure a peaceful, faith-filled experience, guiding you every step of the way"
Buraq Travels,,Procurement Manager,setsail@select.com,+1 888-617-3061 690,buraqtravels.com,https://www.buraqtravels.com/about-us,Public website crawl,unknown,email_verified,23.92,About Us
Crowntravels,,Procurement Manager,info@crownetravels.com,+1 480-744-0060,crownetravels.com,https://crownetravels.com/new-york-umrah-packages,Public website crawl,legitimate_interest,email_verified,23.92,Make your Makkah and Madinah journey stress-free with us by booking our Affordable Umrah packages from New York right now!
Dawah Travels,,Procurement Manager,info@dawahtravels.com,+1 (631) 772 0992,dawahtravels.com,https://dawahtravels.com/los-angeles-umrah-packages,Public website crawl,legitimate_interest,email_verified,23.92,"Book Los Angeles Umrah Packages. We offer affordable packages from the USA with visa, flights & hotels included. Easy, fast, & service."
Dawn Travels,,Procurement Manager,info@dawntravels.com,+1 212 244 1818,dawntravels.com,https://dawntravels.com/umrah-package-from-orlando.htm,Public website crawl,legitimate_interest,email_verified,23.92,"Book 5-star Orlando Umrah Package for 5 nights stay with Dawntravels.com. Umrah from Orlando, package includes airline ticket, ground transportation and ziyarat, eVisa processing, VIP hotel accommodation with breakfast."
Dawn Travels,,Procurement Manager,sales@dawntravels.com,+1 212 244 1818,dawntravels.com,https://dawntravels.com/umrah-package-from-orlando.htm,Public website crawl,legitimate_interest,email_verified,23.92,"Book 5-star Orlando Umrah Package for 5 nights stay with Dawntravels.com. Umrah from Orlando, package includes airline ticket, ground transportation and ziyarat, eVisa processing, VIP hotel accommodation with breakfast."
Darelhuda Hajj,,Procurement Manager,darelhudahajj@gmail.com,0031638799779,darelhudahajj.com,https://www.darelhudahajj.com,Public website crawl,unknown,email_verified,23.92,De mooiste herinneringen creëren we samen
Etihad Travels for Assistance,,Procurement Manager,info@etihadtravels.co.uk,0203 930 8114,etihadtravels.co.uk,https://etihadtravels.co.uk/contact-us,Public website crawl,legitimate_interest,email_verified,23.92,"Contact us for the most affordable Umrah deals. Call us for instant Umrah, flight, and hotel bookings. 02039308114"
flywelltravel.co.uk,,Procurement Manager,info@flywelltravel.co.uk,0116 273 9666,flywelltravel.co.uk,https://www.flywelltravel.co.uk,Public website crawl,legitimate_interest,email_verified,23.92,"Specialist in Hajj, Umrah, Worldwide Flights, Package Tours, Holidays and Bespoke Honeymoon Packages"
travels.de,,Procurement Manager,info@ihsan-travels.com,+49 17666869080,ihsan-travels.de,https://ihsan-travels.de,Public website crawl,legitimate_interest,email_verified,23.92,"Buche jetzt deine Umrah Reise ab Deutschland. Komplettpaket mit Flug, Hotel, Visa, Transfers & Betreuung. Persönlich & professionell."
Hajj Umrah Travels,,Procurement Manager,info@hajjumrahtravels.co.uk,+44 7462289724,hajjumrahtravels.co.uk,https://hajjumrahtravels.co.uk/about-us,Public website crawl,legitimate_interest,email_verified,23.92,Affordable Umrah packages from the UK with Hajj Umrah Travels. We're here to make your journey to Makkah Madinah special. Learn more about us
Kasfah Hajj Travels,,Procurement Manager,info@kasfahhajj.com,+1 (204)- 930-1352,kasfahhajj.com,https://kasfahhajj.com,Public website crawl,legitimate_interest,email_verified,23.92,Kasfah Hajj Travels
Kiswa Travels Limited,,Procurement Manager,info@kiswa-travels.com,+44 786 660 7607 359,kiswa-travels.com,https://www.kiswa-travels.com,Public website crawl,legitimate_interest,email_verified,23.92,"Book affordable Hajj & Umrah packages from the UK with Kiswa Travels. Trusted Sheffield agency offering visa, flights, and hotel deals."
Kiswa Travels Limited,,Procurement Manager,kiswatravels786@gmail.com,+44 786 660 7607 359,kiswa-travels.com,https://www.kiswa-travels.com,Public website crawl,unknown,email_verified,23.92,"Book affordable Hajj & Umrah packages from the UK with Kiswa Travels. Trusted Sheffield agency offering visa, flights, and hotel deals."
maidentraveltours.com,,Procurement Manager,info@maidentraveltours.com,+27 726 921 381,maidentraveltours.com,https://maidentraveltours.com/umrah-packages,Public website crawl,legitimate_interest,email_verified,23.92,Services
OnpointTravels,,Procurement Manager,admin@onpointtravels.com.au,0424 342 124,onpointtravels.com.au,https://www.onpointtravels.com.au/packages/umrah,Public website crawl,unknown,email_verified,23.92,"Looking for Umrah packages with flights from Australia? Get the best Umrah tour packages, including great deals. Affordable, reliable, and hassle-free!"
OnpointTravels,,Procurement Manager,fardeen@alemaantravel.com.au,0424 342 124,onpointtravels.com.au,https://www.onpointtravels.com.au/packages/umrah,Public website crawl,unknown,email_verified,23.92,"Looking for Umrah packages with flights from Australia? Get the best Umrah tour packages, including great deals. Affordable, reliable, and hassle-free!"
