company,company_clean,domain,website,country_inferred,country_inference_source,region_inferred,tld,email,email_domain,email_type,role_email,free_email_provider,phone_raw,phone_normalized,contact_readiness,outreach_priority,recommended_channel,consent_status,verification_status,overall_score,raw_text_snippet
Umrah Travel & Halal Tours Company,Crescent Tours,crescenttours.com.au,https://crescenttours.com.au,Australia,domain_tld,APAC,au,enquiry@crescenttours.com.au,crescenttours.com.au,company_domain,yes,no,0420 800 894,+61420800894,email_and_phone,A,email_first,unknown,email_verified,25.20,"With 78 years of experience, Crescent Tours offers premium, all-inclusive Halal & Umrah travel in Australia. Travel with experts who make every trip extraordinary!"
Islamic Travel,Islamic Travel,islamictravel.com.au,https://islamictravel.com.au/about-us,Australia,domain_tld,APAC,au,info@islamictravel.com.au,islamictravel.com.au,company_domain,yes,no,32 654 849 377,+32654849377,email_and_phone,A,email_first,legitimate_interest,email_verified,25.37,"Established in 2017, Islamic Travel Australia designs halal-conscious holidays, tours & Umrah packages with 226+ five-star reviews from happy travellers."
OnpointTravels,Onpoint Travels,onpointtravels.com.au,https://www.onpointtravels.com.au/about-us,Australia,domain_tld,APAC,au,admin@onpointtravels.com.au,onpointtravels.com.au,company_domain,yes,no,1300 854 237,+611300854237,email_and_phone,A,email_first,unknown,email_verified,26.70,"Discover OnPoint Travels, Australia’s trusted Hajj & Umrah travel partner. Offering guided, reliable, and affordable pilgrimage tour packages."
Sohail Waqas Travel,Sohail Waqas Travel,sohailwaqas.com,https://sohailwaqas.com/hajj-packages-australia-prices-services-trusted-agents,Australia,text_hint,APAC,com,info@sohailwaqas.com,sohailwaqas.com,company_domain,yes,no,+92 303 5655552,+923035655552,email_and_phone,A,email_first,legitimate_interest,email_verified,25.06,"Discover 2025 Hajj packages from Australia with 5-star hotels, expert guidance, and affordable deals. Book with Sohail Waqas Travels for a seamless pilgrimage."
World Hajj,World Hajj,worldhajj.com,https://www.worldhajj.com/hajj-packages-from-australia,Australia,text_hint,APAC,com,info@worldhajj.com,worldhajj.com,company_domain,yes,no,+1 307-392-4596,+13073924596,email_and_phone,A,email_first,legitimate_interest,email_verified,25.44,"We are an experienced Australian travel agency offering the best Hajj Packages 2026, from standard to luxury options. Book now!"
Noble Hajj Umrah,Noble Hajj Umrah,noblehajjumrah.com,https://noblehajjumrah.com/contact,Belgium,phone,Europe,com,info@noblehajjumrah.com,noblehajjumrah.com,company_domain,yes,no,+32 465 70 45 62,+32465704562,email_and_phone,A,email_first,legitimate_interest,email_verified,25.31,"Contact Noble Hajj Umrah for Hajj, Umrah, and Islamic tour inquiries. Our team is here to assist you with travel bookings, package details, and personalized support."
Falcon Travel,Falcon Travel,falcontravel.ca,https://falcontravel.ca,Canada,domain_tld,North America,ca,info@falcontravel.ca,falcontravel.ca,company_domain,yes,no,1-844-774-2828,+18447742828,email_and_phone,A,email_first,legitimate_interest,email_verified,25.20,"Falcon Travel offers Hajj, Umrah, Saudi visa services, and Islamic tours for Muslims across Canada. Trusted travel agency serving pilgrims since 1980."
King Travel Can Ltd,King Travel Can Ltd,kingtravelcan.com,https://kingtravelcan.com,Canada,text_hint,North America,com,info@kingtravelcan.com,kingtravelcan.com,company_domain,yes,no,5464) 905-624-8555,+19056248555,email_and_phone,A,email_first,legitimate_interest,email_verified,26.65,"Book Umrah packages from Canada with King Travel. Explore Hajj packages, flight deals, visa support, and trusted travel services for pilgrims across Canada."
Labayk Hajj,Labayk Hajj,labaykhajj.ca,https://labaykhajj.ca/package-chart,Canada,domain_tld,North America,ca,info@labaykhajj.ca,labaykhajj.ca,company_domain,yes,no,+1 613 371-6363,+16133716363,email_and_phone,A,email_first,legitimate_interest,email_verified,25.44,As-salamu alaykum Welcome to Your Trusted Partner for Hajj & Umrah — Labayk Hajj.
Awtar Tours,Awtar Tours,awtartours.com,https://awtartours.com,Egypt,phone,MENA,com,info@awtartours.com,awtartours.com,company_domain,yes,no,+20 106 087 2795,+201060872795,email_and_phone,A,email_first,legitimate_interest,email_verified,24.95,"Experience unforgettable journeys with Awtar Tours. Specializing in Hajj, Umrah, and global travel, we prioritize exceptional customer service and tailor-made packages to meet your needs. Join us for a remarkable adventure that lasts a lifetime."
GRID TRAVEL,GRID TRAVEL,grid-travel.com,https://grid-travel.com/omra,France,phone,Europe,com,info@grid-travel.com,grid-travel.com,company_domain,yes,no,0558 29 81 66,+33558298166,email_and_phone,A,email_first,legitimate_interest,email_verified,27.67,Omra
Hajj Umra Abdalla,Hajj Umra Abdalla,hajj-umra-abdalla.de,https://www.hajj-umra-abdalla.de/en/hajj.html,Germany,domain_tld,Europe,de,info@hajj-umra-abdalla.de,hajj-umra-abdalla.de,company_domain,yes,no,+49 (0) 176 725 422 30,+49017672542230,email_and_phone,A,email_first,legitimate_interest,email_verified,25.44,"Hajj and Umra Abd Alla is a special offer from Mostafa Abd Alla In Mannheim to help you organize your pilgrimage to Mecca and Medina.
   ÙØªÙØ¸ÙÙ Ø±Ø­ÙØ§Øª Ø§ÙØ­Ø¬ ÙØ§ÙØ¹ÙØ±Ø© Ø§ÙÙ Ø§ÙØ£Ø±Ø§Ø¶Ù Ø§ÙÙÙØ¯Ø³Ø© Ø§ÙÙ ÙÙØ© ÙØ§ÙÙØ¯ÙÙØ© Ø§ÙÙÙÙØ±Ø©, Ø§ÙØ­Ø¬ ÙØ§ÙØ¹ÙØ±Ø© Ø¨Ø±Ø¹Ø§ÙØ© Ø§ÙØ³ÙØ¯ ÙØ"
Hisar Europe Travel,Hisar Europe Travel,hisareurope.com,https://hisareurope.com/impressum,Germany,phone,Europe,com,info@hisareurope.com,hisareurope.com,company_domain,yes,no,+49 (0) 221 75993636,+49022175993636,email_and_phone,A,email_first,legitimate_interest,email_verified,25.37,"Hisar Europe Travel'ın yasal bilgileri, Şirket bilgilerimizi ve seyahat hizmetlerimizle ilgili iletişim bilgilerimizi kontrol edin"
Hajj and umrah booking travel to Mecca,Ilamecca,ilamecca.com,https://www.ilamecca.com,Germany,phone,Europe,com,info@ilamecca.com,ilamecca.com,company_domain,yes,no,+49 152 272 44944,+4915227244944,email_and_phone,A,email_first,legitimate_interest,email_verified,26.42,As-salamu alaykum !
Mekka Travel,Mekka Travel,mekka-travel.com,https://mekka-travel.com/umrah,Germany,phone,Europe,com,info@mekka-travel.com,mekka-travel.com,company_domain,yes,no,+49 1575 5743087,+4915755743087,email_and_phone,A,email_first,legitimate_interest,email_verified,25.10,Umrah 2026 mit Mekka Travel GmbH | Dein Partner für spirituelle und zuverlässige Umrah Reisen. Sichere dir jetzt dein Ticket nach Mekka.
Sunnaalive Travel,Sunnaalive Travel,sunnaalivetravel.com,https://sunnaalivetravel.com/umrah-germany-packages,Germany,phone,Europe,com,info@sunnaalivetravel.com,sunnaalivetravel.com,company_domain,yes,no,+4916092324933,+4916092324933,email_and_phone,A,email_first,legitimate_interest,email_verified,26.92,Umrah Germany packages
umrax,umrax,umrax.de,https://www.umrax.de/impressum,Germany,domain_tld,Europe,de,info@umrax.de,umrax.de,company_domain,yes,no,+4915733267143,+4915733267143,email_and_phone,A,email_first,legitimate_interest,email_verified,28.72,Unternehmensname: Worod for Travel and Tourism
Allia Tour & Travel,Allia Tour & Travel,alliatour.com,https://alliatour.com,Indonesia,phone,APAC,com,customerservice@alliatour.com,alliatour.com,company_domain,yes,no,081 212 515 253,+6281212515253,email_and_phone,A,email_first,unknown,email_verified,25.20,Nikmati perjalanan ibadah umrah yang nyaman dengan paket terbaik kami. Daftar sekarang untuk mendapatkan penawaran spesial!
Denatour Travel,Denatour Travel,denatours.com,https://denatours.com,Indonesia,text_hint,APAC,com,operation@denatours.com,denatours.com,company_domain,no,no,+6221) 7944584,+62217944584,email_and_phone,A,email_first,unknown,email_verified,24.58,"Denatour Travel berdiri sejak tahun 1995 , berpengalaman memberikan Pelayanan Umrah – Hajji Plus dan menjadi Travel Perintis Islamic tour Mancanegara di Indonesia. Kami Dewasa karna dukungan anda

Denatour Travel memilik Izin Umrah dan Hajji resmi dari Departement Agama sejak tahun 1996 dengan alamat gedung tetap dan t"
Travel Umroh Terbaik di Jakarta,Dream Tour,dreamtour.co,https://dreamtour.co/hajj,Indonesia,text_hint,APAC,co,info@dreamtour.co,dreamtour.co,company_domain,yes,no,021) 21381090,+622121381090,email_and_phone,A,email_first,legitimate_interest,email_verified,24.67,"PT Dream Tours and Travel adalah Travel Umroh Terbaik di Jakarta yang akan membantu Anda untuk mendapatkan pelayanan yang terbaik untuk perjalanan Umroh dan Liburan. 
    Menyediakan berbagai pilihan paket dengan biaya umroh 2026 - 2027 yang kompetitif dan relatif murah / hemat.Pilihan paket yang kami tawarkan mulai d"
NehSher Tour Travel,NehSher Tour Travel,nehshertour.com,https://www.nehshertour.com/country/prancis,Indonesia,phone,APAC,com,marketing@nehshertour.com,nehshertour.com,company_domain,no,no,+6285320111976,+6285320111976,email_and_phone,A,email_first,unknown,email_verified,25.37,Semua paket tour travel untuk lokasi wisata negara Prancis dengan layanan terbaik dan harga termurah.
YOUR TRAVEL CONSULTANT,YOUR TRAVEL CONSULTANT,mimmtravel.com,https://mimmtravel.com,Malaysia,phone,APAC,com,info@mimmtravel.com,mimmtravel.com,company_domain,yes,no,+6011 1029 7879,+601110297879,email_and_phone,A,email_first,legitimate_interest,email_verified,25.15,YOUR TRAVEL CONSULTANT UTAMA MIMM TRAVEL UMRAH HAJI LUAR NEGARA DALAM NEGARA INSURANS & VISA HUBUNGI 03 4162 7879 +6011 1029 7879 info@mimmtravel.com UTAMA MIMM TRAVEL UMRAH HAJI LUAR NEGARA DALAM NEGARA INSURANS & VISA HUBUNGI UTAMA MIMM TRAVEL UMRAH HAJI LUAR NEGARA DALAM NEGARA INSURANS & VISA HUBUNGI MAKLUMAT LANJU
SAAG TRAVEL,SAAG TRAVEL,saagtravel.com.my,https://saagtravel.com.my/pakej-percutian/percutian-luar-negara/afrika-selatan,Malaysia,domain_tld,APAC,my,sales@saagtravel.com.my,saagtravel.com.my,company_domain,yes,no,+60 12-346 2720 0,+601234627200,email_and_phone,A,email_first,legitimate_interest,email_verified,27.25,Afrika Selatan
"Umrah & Hajj Packages Johor Bahru (JB), Travel Agency",Tiram,tiram.com.my,https://www.tiram.com.my,Malaysia,domain_tld,APAC,my,tiram@tiram.com.my,tiram.com.my,company_domain,no,no,+60197149236,+60197149236,email_and_phone,A,email_first,unknown,email_verified,24.71,"Tiram Travel Sdn Bhd specializes in Umrah and Hajj packages, reservation for worldwide tickets (domestic & international), inbound and outbound packages, hotel reservations, transportation arrangements and visa applications."
Alhijra Travel BV,Alhijra Travel BV,alhijratravel.nl,https://www.alhijratravel.nl,Netherlands,domain_tld,Europe,nl,booking@alhijratravel.nl,alhijratravel.nl,company_domain,yes,no,+31 010 226 20 98,+310102262098,email_and_phone,A,email_first,unknown,email_verified,25.06,Alhijra Travel BV – In dienst van Duyuf al Rahman +31 010 226 20 98 +31 010 226 20 98 booking@alhijratravel.nl Inloggen Registreren Inloggen Registreren Home Umrah Al Aqsa Hadj 2026 Contact +31 010 226 20 98 +31 010 226 20 98 booking@alhijratravel.nl Inloggen Registreren Home Umrah Al Aqsa Hadj 2026 Contact Home Umrah
Resala Travel,Resala Travel,resalatravel.com,https://resalatravel.com,Netherlands,phone,Europe,com,info@resalatravel.com,resalatravel.com,company_domain,yes,no,+31 6 41712806,+31641712806,email_and_phone,A,email_first,legitimate_interest,email_verified,25.37,"Expert-guided spiritual journeys to Mecca and Medina with premium accommodations, experienced Islamic scholars, small-group attention, and complete visa &â¦"
Umrah Travel,Umrah Travel,umrahtravel.nl,https://umrahtravel.nl,Netherlands,domain_tld,Europe,nl,info@umrahtravel.nl,umrahtravel.nl,company_domain,yes,no,+31 85 12 48 780,+31851248780,email_and_phone,A,email_first,legitimate_interest,email_verified,27.67,...
Worldwide Travel Tour Ism,Worldwide Travel Tour Ism,worldwidetraveltourism.nz,https://www.worldwidetraveltourism.nz/hajj-packages,New Zealand,domain_tld,APAC,nz,info@worldwidetraveltourism.nz,worldwidetraveltourism.nz,company_domain,yes,no,+91 9711198463,+19197111984,email_and_phone,A,email_first,legitimate_interest,email_verified,25.15,Explore most popular and recommended Hajj packages from New Zealand. We committed to provide quality Hajj program at any cost to pilgrimage Hajj 2025
Shahzada Travel,Shahzada Travel,shahzadatravel.com,https://shahzadatravel.com,Saudi Arabia,text_hint,MENA,com,info@shahzadatravel.com,shahzadatravel.com,company_domain,yes,no,+49-123-456-7890,+491234567890,email_and_phone,A,email_first,legitimate_interest,email_verified,25.02,"Discover Shahzada Travel, your premier travel agency in Germany. We specialize in travel tickets, visa assistance, hotel bookings, and Hajj travel packages to Saudi Arabia. Experience seamless travel planning with our expert services tailored for your needs."
Al Aqiq Travels SA,Al Aqiq Travels SA,alaqiq.co.za,https://alaqiq.co.za,South Africa,domain_tld,Africa,za,admin@alaqiq.co.za,alaqiq.co.za,company_domain,yes,no,+27 72 400 4899,+27724004899,email_and_phone,A,email_first,unknown,email_verified,26.07,Experience the excitement.
Crest Travel,Crest Travel,cresttravel.co.za,https://cresttravel.co.za/site,South Africa,domain_tld,Africa,za,info@cresttravel.co.za,cresttravel.co.za,company_domain,yes,no,031 303 2028,+27313032028,email_and_phone,A,email_first,legitimate_interest,email_verified,28.27,For more information on Covid-19 click here
Your One Stop Travel Shop,Your One Stop Travel Shop,onestoptours.co.za,https://onestoptours.co.za/categories/umrah,South Africa,domain_tld,Africa,za,info@onestoptours.co.za,onestoptours.co.za,company_domain,yes,no,0860 109 500,+27860109500,email_and_phone,A,email_first,legitimate_interest,email_verified,26.65,Talk to an expert
World of Travel by Irshad Malek,World of Travel by Irshad Malek,worldoftravel.co.za,http://www.worldoftravel.co.za,South Africa,domain_tld,Africa,za,sales@worldoftravel.co.za,worldoftravel.co.za,company_domain,yes,no,082 333 6086,+27823336086,email_and_phone,A,email_first,legitimate_interest,email_verified,27.25,World of Travel by Irshad Malek
Wakeel Worldwide Travel,Wakeel Worldwide Travel,al-wakeelhajjandumrah.com,https://www.al-wakeelhajjandumrah.com/umrah-packages,Turkey,phone,MENA,com,info@al-wakeelhajjandumrah.com,al-wakeelhajjandumrah.com,company_domain,yes,no,50 0225 1 0325 1000,+15002251032,email_and_phone,A,email_first,legitimate_interest,email_verified,26.92,Umrah Packages
Alhadi Travel,Alhadi Travel,alhaditravel.co.uk,https://alhaditravel.co.uk,United Kingdom,domain_tld,Europe,uk,info@alhaditravel.co.uk,alhaditravel.co.uk,company_domain,yes,no,0203 930 0817,+442039300817,email_and_phone,A,email_first,legitimate_interest,email_verified,25.20,"Discover All inclusive Umrah packages UK from £699. Alhadi Travel offers flights, hotels & transport. ATOL & IATA certified. Book your journey today."
Alhaq Travel,Alhaq Travel,alhaqtravel.co.uk,https://www.alhaqtravel.co.uk/contact-us,United Kingdom,domain_tld,Europe,uk,quotes@alhaqtravel.co.uk,alhaqtravel.co.uk,company_domain,yes,no,020 34757513,+442034757513,email_and_phone,A,email_first,unknown,email_verified,26.42,Contact US | Alhaq Travel UK  | 020 34757513
Alharam travel,Alharam travel,alharamtravel.co.uk,https://www.alharamtravel.co.uk,United Kingdom,domain_tld,Europe,uk,info@alharamtravel.co.uk,alharamtravel.co.uk,company_domain,yes,no,+447417471247,+447417471247,email_and_phone,A,email_first,legitimate_interest,email_verified,25.10,"Book discounted hotels, buy lowest fare flights and enjoy exceptional planning of your Umrah trip or Halal holidays. We are experienced to plan, book and organize everything in advance."
Al Momin Travels,Al Momin Travels,almomintravel.co.uk,https://almomintravel.co.uk/about-us,United Kingdom,domain_tld,Europe,uk,info@almomintravel.co.uk,almomintravel.co.uk,company_domain,yes,no,+442032890000 16,+44203289000016,email_and_phone,A,email_first,legitimate_interest,email_verified,25.31,"Learn about Al Momin Travel, a UK-based agency offering reliable Umrah packages, expert guidance, and seamless travel experiences for pilgrims."
Umrah Travel Agency UK,Alzowar Travel,alzowartravel.co.uk,https://alzowartravel.co.uk,United Kingdom,domain_tld,Europe,uk,info@alzowartravel.co.uk,alzowartravel.co.uk,company_domain,yes,no,020 3504 2326 13,+12035042326,email_and_phone,A,email_first,legitimate_interest,email_verified,25.31,"Best Umrah Travel agency in UK, Al Zowar Travel offers Hajj and Umrah services, expert guidance, Dedicated support and ATOL protected."
Caravan Hajj Umrah,Caravan Hajj Umrah,caravanhajjumrah.com,https://www.caravanhajjumrah.com,United Kingdom,text_hint,Europe,com,info@caravanhajjumrah.com,caravanhajjumrah.com,company_domain,yes,no,+44 7428 786445,+447428786445,email_and_phone,A,email_first,legitimate_interest,email_verified,24.88,"Experience a seamless Hajj or Umrah pilgrimage with our expert guidance. We offer affordable packages from London, UK. Including flights, visa assistance, accommodation, and 24/7 support. Book your spiritual journey today by Caravan Hajj & Umrah."
GM Travel,GM Travel,gmtravel.co.uk,https://gmtravel.co.uk,United Kingdom,domain_tld,Europe,uk,info@gmtravel.co.uk,gmtravel.co.uk,company_domain,yes,no,+44 203 371 9643,+442033719643,email_and_phone,A,email_first,legitimate_interest,email_verified,25.25,"Embark on a spiritual journey filled with peace, comfort, and devotion. Our exclusive Umrah packages are designed to provide you with luxurious yet affordable"
Haj,Haj,haj.co.uk,https://www.haj.co.uk,United Kingdom,domain_tld,Europe,uk,info@haj.co.uk,haj.co.uk,company_domain,yes,no,020 7286 1111,+442072861111,email_and_phone,A,email_first,legitimate_interest,email_verified,25.25,Haj & Umra Travel provide Hajj and Umrah escorted tours as well as tailor made packages to suit different budgets. Specialists with decades of experience.
Haleema,Haleema,haleema.co.uk,https://www.haleema.co.uk/umrah-birmingham/birmingham-umrah-packages,United Kingdom,domain_tld,Europe,uk,sales@haleema.co.uk,haleema.co.uk,company_domain,yes,no,0158 234 3075,+441582343075,email_and_phone,A,email_first,legitimate_interest,email_verified,25.81,"Birmingham Umrah Packages in 2026, lets travel with Haleema Limited for a secure and hassle-free journey."
Ibadah Tours,Ibadah Tours,ibadahtours.com,https://www.ibadahtours.com/hajj-packages,United Kingdom,phone,Europe,com,info@ibadahtours.com,ibadahtours.com,company_domain,yes,no,020 8004 6786,+442080046786,email_and_phone,A,email_first,legitimate_interest,email_verified,25.31,Follow the Messanger of Allah's words and start your pilgrimage to the House of Allah. Ibadah Tours have created Hajj packages to make this easy.
Ikhlas Travel,Ikhlas Travel,ikhlastravel.co.uk,https://ikhlastravel.co.uk,United Kingdom,domain_tld,Europe,uk,info@ikhlastravel.co.uk,ikhlastravel.co.uk,company_domain,yes,no,+44 20 8123 2138,+442081232138,email_and_phone,A,email_first,legitimate_interest,email_verified,25.44,"Ikhlas Travel – trusted UK provider of affordable Umrah packages from London, Birmingham, Manchester & flights, hotels & spiritual journeys."
Trusted Islamic Travel Agency in the UK,Trusted Islamic Travel Agency in the UK,islamictravel.co.uk,https://www.islamictravel.co.uk,United Kingdom,domain_tld,Europe,uk,info@islamictravel.co.uk,islamictravel.co.uk,company_domain,yes,no,0203-970-4500,+442039704500,email_and_phone,A,email_first,legitimate_interest,email_verified,24.73,Islamic Travel feels proud to offer Hajj and Umrah packages with 5-star hotels and direct flights from London. Islamic Travel also offers Short term Hajj Umrah package service for groups and families with an option to customize and add anything to make it best Hajj and Umrah package for you. Get the best Hajj Umrah dea
Islamic Travel Agency,Islamic Travel Agency,islamictravelagency.co.uk,https://www.islamictravelagency.co.uk/umrah-packages.html,United Kingdom,domain_tld,Europe,uk,info@islamictravelagency.co.uk,islamictravelagency.co.uk,company_domain,yes,no,+447951138405,+447951138405,email_and_phone,A,email_first,legitimate_interest,email_verified,25.10,"Umrah packages from UK are offered by Islamic Travel Agency starting around £395-£899. Get All-inclusive cheap Umrah deals for families, groups or individual pilgrims."
Muslims Holy Travel,Muslims Holy Travel,muslimsholytravel.co.uk,https://www.muslimsholytravel.co.uk/contact-us,United Kingdom,domain_tld,Europe,uk,info@muslimsholytravel.co.uk,muslimsholytravel.co.uk,company_domain,yes,no,0203 900 0310,+442039000310,email_and_phone,A,email_first,legitimate_interest,email_verified,25.44,"Muslims Holy Travel is always looking forward to help customers in planning a journey of Hajj, Umrah or Halal Holiday Destinations."
Safamarwah Travel,Safamarwah Travel,safamarwahtravel.co.uk,https://www.safamarwahtravel.co.uk/contact-us,United Kingdom,domain_tld,Europe,uk,info@safamarwahtravel.co.uk,safamarwahtravel.co.uk,company_domain,yes,no,447951878851,+14479518788,email_and_phone,A,email_first,legitimate_interest,email_verified,24.98,"Having years of experience, discounted deals and professional support, we are offering remarkable travel arrangements for Muslims. Enjoy your Umrah trip or Halal family holiday by opting luxury holiday package at reasonable price."
Alhadi Travel USA,Alhadi Travel USA,alhaditravel.com,https://alhaditravel.com,United States,text_hint,North America,com,info@alhaditravel.com,alhaditravel.com,company_domain,yes,no,+1 (520) 595 - 0005 54,+15205950005,email_and_phone,A,email_first,legitimate_interest,email_verified,25.37,"Book Hajj and Umrah tours with Alhadi Travel, a trusted USA-based agency. Enjoy all-inclusive packages with visa, flights, and hotels."
Hajaz Travels,Hajaz Travels,alhajaztravels.com,https://alhajaztravels.com,United States,text_hint,North America,com,info@alhajaztravels.com,alhajaztravels.com,company_domain,yes,no,+1 888 980 8775,+18889808775,email_and_phone,A,email_first,legitimate_interest,email_verified,25.25,"Al Hajjaz Travels is a USA Umrah Travel Agency , We provide Best Hajj, Umrah, Flights, and Tour Packages in the USA. Contact us now!"
Alharam Travel,Alharam Travel,alharamtravel.com,https://www.alharamtravel.com,United States,text_hint,North America,com,info@alharamtravel.com,alharamtravel.com,company_domain,yes,no,888-608-1057,+18886081057,email_and_phone,A,email_first,legitimate_interest,email_verified,24.73,"AlHaram Travel is a leading Hajj & Umrah services provider that specializes in designing Hajj & Umrah packages for USA citizens. Select flights from nearest USA airport, choose near Haram hotel & get fast visa processing while booking all-inclusive Hajj & Umrah packages. Avail professional assistance from certified tra"
Al Haram Travel and Tours,Al Haram Travel and Tours,alharamtravelntours.com,https://alharamtravelntours.com,United States,text_hint,North America,com,info@alharamtravelntours.com,alharamtravelntours.com,company_domain,yes,no,+1 (623) 404-4213,+16234044213,email_and_phone,A,email_first,legitimate_interest,email_verified,25.37,"Explore amazing travel packages with Al Haram Travel & Tours in Texas, New York, Michigan, Ohio, Washington, Detroit & Dallas today!"
Al Raad Tours & Travel,Alraad Tours,alraadtours.com,http://www.alraadtours.com/contact-us,United States,text_hint,North America,com,info@alraadtours.com,alraadtours.com,company_domain,yes,no,678-677-2807,+16786772807,email_and_phone,A,email_first,legitimate_interest,email_verified,25.31,"Reach out to Al Raad Tours for Hajj & Umrah inquiries. Call 678-677-2807 or email info@alraadtours.com. Visit us in Atlanta, GA."
Dallas Tour & Travel,Dallas Tour & Travel,dallastourtravel.com,https://www.dallastourtravel.com,United States,text_hint,North America,com,info@dallastourtravel.com,dallastourtravel.com,company_domain,yes,no,+62 812 14 2000 64,+6281214200064,email_and_phone,A,email_first,legitimate_interest,email_verified,24.64,"Dallas Tour & Travel (PT. Delta Laras Wisata) adalah Biro Perjalanan Wisata yang berdiri sejak Tahun 2013 dan telah mendapatkan izin resmi dari Kementerian Agama RI sebagai Penyelenggara Perjalanan Ibadah Umrah dan Penyelanggara Ibadah Haji Khusus . Selain Ticketing, Land Arrangement & Wisata halal , Dallas Tour & Trav"
Hagel Travel & Tours,Hagel Travel & Tours,hageltravel.com,https://www.hageltravel.com,United States,phone,North America,com,sales@hageltravel.com,hageltravel.com,company_domain,yes,no,+65 6296 8644,+6562968644,email_and_phone,A,email_first,legitimate_interest,email_verified,25.20,"With over 25 years of experience, Hagel Travel offers trusted Umrah, Hajj & Muslim-friendly tour packages across Asia, the Middle East & beyond."
"Travel Packages In Chicago, IL",Hajj Makkah Tours,hajjmakkahtours.com,https://www.hajjmakkahtours.com,United States,text_hint,North America,com,hello@hajjmakkahtours.com,hajjmakkahtours.com,company_domain,yes,no,60659 (773) 338-0720,+17733380720,email_and_phone,A,email_first,legitimate_interest,email_verified,26.43,"Welcome to Makkah Tours & Travel Inc. in Chicago, IL offering Tour Packages, Hajj Packages, Umrah Group, Umrah Packages and more."
Holy Travel and Tours,Holy Travel and Tours,holytravelsandtour.com,https://holytravelsandtour.com,United States,text_hint,North America,com,info@holytravelsandtour.com,holytravelsandtour.com,company_domain,yes,no,+1 (415) 791-5351,+14157915351,email_and_phone,A,email_first,legitimate_interest,email_verified,25.25,"Experience the journey of Umrah with unmatched comfort and convenience. Our luxury custom Umrah packages from USA, offer premium accommodations, and personalized services."
