company,domain,url,query,snippet
AL-HADAYA,al-hadaya.com,https://www.al-hadaya.com/,islamic gift shop,"Our gifts carry intention, faith, and love—making them truly unforgettable. From names to special messages, our gifts can be personalised to make every occasion uniquely yours. Whether it’s a gift for yourself or a loved one, find something truly meaningful that reflects your connections to allah."
Home - Al-Badr Islamic Bookstore,albadr.co.uk,https://albadr.co.uk/,muslim bookstore London,"An Islamic Bookstore based in the heart of London , we provide the best of knowledge published in the best of prints to those across the Globe restricted from access to such knowledge. We stock Arabic & English books in the different fields of Islam."
Albalagh Bookstore,albalaghbooks.com,https://www.albalaghbooks.com/,muslim bookstore Chicago,"Nov 2, 2025 · Whether you are a student at a madrasa or a researcher at a university, or just a casual reader looking for Islamic books , we have something for you. We have constantly expanding selections in English, Arabic, Urdu and other languages."
Islamic Book Shop,almuttaqin.co.uk,https://almuttaqin.co.uk/,muslim bookstore Manchester,"Islamic Book Shop | Tafsir, Hadith, Fiqh, Sirah, History & other books available in quality prints at affordable prices | Worldwide Shipping"
Our Stores,amsons.co.uk,https://amsons.co.uk/pages/our-stores,muslim bookstore Birmingham,"Discover Amsons store locations across the UK. Visit us in Birmingham , Leicester, and more for premium Islamic lifestyle products and exceptional service."
Islamic lifestyle boutique,blingcreationsbybb.com,https://blingcreationsbybb.com/,islamic gift shop Mississauga,"We offer you Islamic faith inspired gifts . Shop from our Ramadan and Eid collection of Muslim apparel, islamic mugs, cups, drinkware, Eid decor and stationery. Personalised gifts are a favourite. Based in Mississauga , Ontario. Canada. islamic clothing canada."
Books on Islam - Ahmadiyya Bookstore Canada,booksonislam.org,https://www.booksonislam.org/,muslim bookstore Canada,Ahmadiyya Bookstore Canada Shipping charges are already included in the book prices. Featured Books The Holy Quran Nazira - Large Size
Dar-us-Salam Islamic Bookstore,dar-us-salam.com,https://dar-us-salam.com/,muslim bookstore USA,"Our carefully curated collection is rooted in the Quran and the Sunnah of Prophet Muhammad (peace be upon him), offering a wide range of Islamic literature, children’s books and toys, modest clothing for men and women, attar perfumes, prayer rugs, caps, CDs/DVDs, home décor, and unique gifts."
DAR AL TAQWA ISLAMIC BOOKSHOP,daraltaqwa.com,https://daraltaqwa.com/,muslim bookstore London,"Dar Al Taqwa is a London publishing house, specialising in all Islamic literature including Sufism, Seerah, Hadith, Quran Studies, Fiqh and Shariah, Islamic History, Politics, Economics, Social studies, Women and family, Comparative Religion, Philosophy & Islamic studies We also stock a wide range o"
Dar Makkah,darmakkah.co.uk,https://darmakkah.co.uk/,muslim bookstore UK,"World's biggest islamic bookstore , with over 20,000 available titles."
Islamic Bookstore & Islamic Books Online UK,darussalam.uk,https://darussalam.uk/,muslim bookstore UK,"Shop authentic Islamic books from Darussalam , a trusted Islamic bookstore based in London, UK. Buy Qurans, Hadith, Tafsir, and children’s Islamic books online with fast UK delivery."
Islamic Books In Birmingham,darussalambirmingham.co.uk,http://www.darussalambirmingham.co.uk/,muslim bookstore Birmingham,"We are selling Islamic and Dawah Books in various languages; English Books, Urdu Books, Arabic Books, Bengali Books, French Books, Spanish Books, Indonesian Books, Russian Books, Albani Books, Farsi Books, Pushto Books and Turkish Books."
DARUSSALAM CANADA – Islamic Book Store,darussalamcanada.com,https://darussalamcanada.com/,muslim bookstore Toronto,This book attempts to revive authentic Islamic spirituality based on the Quran and Sunnah by collecting and explaining forty hadiths on the diseases of the heart and the purification of the soul.
Dar-Us-Salam NY - Buy Islamic Books Online,darussalamny.com,https://www.darussalamny.com/,muslim bookstore New York,"Buy authentic Islamic books online. We have large collection of Islamic books like Holy Quran, Hadith, Islamic CD/DVDs, Azan clocks, Non alcohol perfumes, Islamic Men clothing, Scarfs and Abayas for women."
Islamic Bookshops in Australia - by Wazeera,directoryofislamicscholarship.substack.com,https://directoryofislamicscholarship.substack.com/p/islamic-bookshops-in-australia,islamic bookstore Australia,"Oct 2, 2024 · We hope this journey across the globe’s Islamic bookstores has inspired your next read or visit. Each of these shops, with their unique offerings and timeless wisdom, connects us to the enduring legacy of Islamic thought and spirituality."
Darussalam Islamic Bookstore – Darussalam Australia,dsbooks.com.au,https://dsbooks.com.au/,muslim bookstore Sydney,"We have a unique understanding of what the local community expects from their local bookstore and always strive to deliver excellence - whether though our range, customer service or the overall equality of your experience."
"The Islamic Bookstore Australia, 165 Haldon Street, Sydney (2025)",findglocal.com,https://www.findglocal.com/AU/Sydney/141654972569050/The-Islamic-Bookstore-Australia,islamic bookstore Sydney,"Living up to fulfill its promise to become your Islamic knowledge superstore, The Islamic Bookstore stocks over 10,000 different Islamic titles in English, Arabic and selected languages, featuring the latest releases from the world's top Muslim publishers and producers."
firdousbooks,firdousbooks.ca,https://firdousbooks.ca/,islamic bookstore Canada,Receive our latest updates about our products and promotions. © 2026 Firdous Books Canada . All Rights Reserved.
Good Books,goodbooks.melbourne,https://goodbooks.melbourne/,muslim bookstore Melbourne,"Good Books is your local independent bookstore in Melbourne , offering a curated selection of Islamic books, self-development titles, business reads, and children's books — with free local delivery."
Habib Book Store,habibislamicbookstore.com,https://habibislamicbookstore.com/,muslim bookstore Toronto,"Discover the Quran and Islamic books , highlighting the life of the Prophet Muhammad (صلى الله عليه وسلم) This is best place to get Islamic books in Greater Toronto Area. Lots of books on every Islamic or worldly aspects."
Hadiyah Gifting – Shop Best Islamic Gifts Online,hadiyahgifting.com,https://www.hadiyahgifting.com/,islamic gift shop,"Hadiyah Gifting brings you the best Islamic gifts online. Explore our signature collection of unique Islamic gifts, perfect for celebrating every special moment."
Home,hudagifts.com,https://hudagifts.com/,muslim bookstore Manchester,"As a family-run business rooted in the heart of Manchester , we are passionate about serving the Muslim community with a wide range of high-quality essentials and gifts. Whether you’re seeking a beautifully printed Quran, elegant prayer mats, meaningful gifts, or home décor that reflects Islamic art"
IBC,ibcshopping.com.au,https://ibcshopping.com.au/,islamic bookstore Melbourne,Welcome to IBC - Islamic Lifestyle Store FREE DOMESTIC SHIPPING FOR PURCHASES OVER $129 $10 FLAT RATE DELIVERY within Australia
Salafi Bookstore & Islamic Centre Manchester - iRizq.com,irizq.com,https://www.irizq.com/index.php/salafi-bookstore-islamic-centre-manchester,islamic bookstore Manchester,"Salafi Bookstore & Islamic Centre Manchester is a trusted halal retail shop located at 100 Claremont Rd. Specializing in a wide range of Islamic products, this store possibly offers everything from books and gifts to praye"
"Islamic Bookstore .com - Islamic Books, Islamic Audio, Video",islamicbookstore.com,https://www.islamicbookstore.com/,islamic bookstore New York,"We stock and offer next-day dispatch of thousands of products relevant to Islam and Muslims. © 2026 IslamicBookstore .com All rights reserved. Islamic Bookstore .com - Islamic Books , Islamic Audio, Video, Software and more!"
The Islamic Bookstore Australia,islamicbookstore.com.au,https://islamicbookstore.com.au/,islamic bookstore Melbourne,"Australia's 1st Islamic Bookstore , we specialise in Islamic Books , Qur'an in English & Arabic, Islamic Children's Books, Islamic and Arabic Curriculums, Arabic Books, Muslim Lifestyle & Wellbeing Products, Islamic & Educational Toys, Prayer Mats, Dates, Perfumes, Gifts & Decorations."
Islamic Books & Souvenirs,islamicbookstoronto.com,https://islamicbookstoronto.com/,muslim bookstore Toronto,"Discover Imam al-Tirmidhi’s Al-Shama’il al-Muhammadiyya, a timeless collection of 415 Hadiths capturing the beauty and perfection of the Prophet ﷺ. Save $20 today and bring this treasured work into your library while stock lasts. This item is a deferred, subscription, or recurring purchase."
"The Islamic Place - Books, Clothing, Prayer Rugs, Body Oils",islamicplace.com,https://www.islamicplace.com/,muslim bookstore Houston,"Islamic Books , Clothing for Brothers and Sisters (Abaya, Hijab, Jilbab, Thob, Kufi), Prayer Rugs, Attar & Body Oils, Incense, Black Seed, Soaps, Khuff, Henna"
JarirBooks-Arabic Books & More,jarirbooksusa.com,https://jarirbooksusa.com/,muslim bookstore Chicago,"<!--home page for meta description tag only -->Jarir Bookstore specializes in classical and contemporary books in the Arabic language, and offers an extensive selection of children's Arabic books, Islamic Books in Arabic and English, including Quran, Tafsir, Fiqh, Muslim Creed, and More."
Kazi Publications – Foremost Source of Books on Islam and Muslims,kazi.org,https://www.kazi.org/,islamic bookstore Chicago,Our online shop has Islamic books in all categories including books for children and special Muslim books on prayers. Our store (based in Chicago ) is a resource for Muslims and non-Muslims alike. Our books are available to anyone who want to learn more about Islam — a vast subject.
Islamic bookstore in New Zealand and Australia – Mahabbah Books,mahabbahbooks.com,https://www.mahabbahbooks.com/,muslim bookstore Australia,Welcome to our Islamic bookstore . Pick up your order from Central Auckland location. Shipping available to New Zealand and Australia .
Dar-us-Salam Islamic Bookstore - Official MapQuest,mapquest.com,https://www.mapquest.com/us/texas/dar-us-salam-islamic-bookstore-632871992,muslim bookstore Houston,"Dar-us-Salam Islamic Bookstore , established in 1994 in Houston , Texas, is a family-owned business dedicated to providing a wide array of authentic Islamic literature and products."
Contact Us - Marhaba Book Store,marhababookstore.com,https://marhababookstore.com/index.php?route=information/contact,muslim bookstore Mississauga,"Contact Us Our Locations MarhabaBookStore 3465 Platinum Drive Unit 91, Mississauga , ON, L5M 2S1 1010 Dream Crest Rd Unit 11, Mississauga , ON L5V 3A4 2200 Brock Rd Unit A3, Pickering, ON L1X 2R2 Telephone 9052398786"
Marhaba Book Store and Hijab Fashion,marhabaislamicstore.com,https://marhabaislamicstore.com/,islamic gift shop Mississauga,"Welcome to Marhaba Bookstore & Hijab Fashion, your one-stop Islamic Store in Mississauga and Pickering! As an Official Distributor and Dealer of Darussalam Publication, we offer you a wide range of Islamic Books, Azan Clocks, Hijabs, Frames and Decors."
Masjid Taleem Muhammad,masjidtaleemmuhammad.com,https://www.masjidtaleemmuhammad.com/,islamic gift shop Houston,"Check out our gift shop , conveniently located inside the mosque. We offer a wide variety of high-quality products, including Islamic books, prayer mats, clothing, and much more."
All Islamic Books Stores in London City - Muslim Connect,muslimconnect.org,https://muslimconnect.org/services/category/islamic-books-stores/united-kingdom/london-city/,islamic bookstore London,"Minhaj-ul-Quran Publications, located at 298 Romford Rd in London , is an esteemed Islamic bookstore with a robust collection focused on Islamic scholarship and understanding."
Salafi Bookstore & Islamic Centre Birmingham – 5.0★ Reviews,poyst.com,https://www.poyst.com/business/salafi-bookstore-islamic-centre,muslim bookstore Birmingham,"Salafi Bookstore & Islamic Centre in Birmingham is a welcoming hub for Muslims and non-Muslims alike, offering a vast selection of authentic Islamic books in Arabic and English, along with halal foods and religious items."
Home - Salafi Bookstore UK,salafibookstore.com,https://salafibookstore.com/,muslim bookstore Manchester,"Since 1997, we've been curating the most authentic library of Islamic books to be found in the Western world! Buy your Islamic literature here, and feel at peace knowing that what you're reading is free of corruption, deviation, and falsehoods."
the date palm,thedatepalm.com,https://www.thedatepalm.com/,islamic gift shop Toronto,"The Date Palm, a muslim collective. An Islamic Lifestyle store located in Canada featuring halal candy, hijabs, islamic books, fair-trade toys and more."
"World Of Islam – Manchester, 211 Wilmslow Road (3 reviews",unilocal.co.uk,https://unilocal.co.uk/united-kingdom/manchester/world-of-islam,muslim bookstore Manchester,"The World of Islam is Islamic book store in Manchester , 211 Wilmslow Road, your one stop Islamic book shop for your everyday Islamic needs, from books to clothing, Women Swimwear, Audio and video lectures to Digital Qurans, Childrens Books, Ramadan 2011, interactive and History."
Sunni Bookstore,wondrousislam.ca,https://wondrousislam.ca/,islamic bookstore Canada,"We are an online retailer of Islamic books in accordance with the beliefs, practices and methodology of the Ahl al-Sunnah wa'l-Jamā`ah (Sunni Islam). Our focus is on the promotion of Sunni scholarship and tradition in the English language."
Marhaba Book Store & Hijab Fashion - Book Stores - Mississauga,yellowpages.ca,https://www.yellowpages.ca/bus/Ontario/Mississauga/Marhaba-Book-Store-Hijab-Fashion/100894325.html,muslim bookstore Mississauga,"I drove from Hamilton to Mississauga to check out this book store and it did not disappoint. They have a wonderful selection of books , clothing, and any Islamic essential item that you might need, for all ages."
"TOP 10 BEST Islamic Store in Toronto, ON - Updated 2026 - Yelp",yelp.ca,https://www.yelp.ca/search?find_desc=Islamic+Store&find_loc=Toronto%2C+ON,islamic gift shop Toronto,"Top 10 Best Islamic Store in Toronto , ON - Last Updated December 2025 - Yelp - Habib Book Store, Um Anas Islamic Fashion & Book Store, An Noor Islamic Books, Sara Islamic Store , Acadia Art & Rare Books, Queen Books, Windsor, Indigo, Atticus Books, Indigospirit - Royal Bank Plaza"
"TOP 10 BEST Islamic Bookstore in Los Angeles, CA - Yelp",yelp.com,https://www.yelp.com/search?find_desc=islamic+bookstore&find_loc=Los+Angeles%2C+CA,muslim bookstore,"Top 10 Best Islamic Bookstore in Los Angeles, CA - Last Updated July 2025 - Yelp - Jarir Bookstore , Ketabsara Persian Bookstore , Dawah Bookshop, Levantine Cultural Center, Book Alley, Vroman's Bookstore , Vedanta Bookshop, Now Serving, Skylight Books, Children's Book World"
The UK's leading Islamic Department Store — ZamZam Direct,zamzamdirect.com,https://zamzamdirect.com/,muslim bookstore London,About Us Our Heritage Reviews Store Info Address: 388 Green Street | London E13 9AP Opening Times: Mon - Fri: 10:00 to 19:30 Sat - Sunday: 10:00 - 20:30 Contact: ‪+44 7754 440314‬ (WhatsApp Only) info@zamzamdirect.com (email)
