scenario_id,product,buyer_type,queries,discovered_domains,seed_urls,visited_urls,contacts,people,people_with_email,people_with_phone,people_with_both,companies
hajj_kits_wholesale,Hajj and Umrah accessories wholesaler,Hajj and Umrah travel agencies,36,62,28,50,26,0,0,0,0,22
modest_apparel_manufacturer,Modest apparel manufacturer,Hijab and abaya retailers,36,84,28,45,15,0,0,0,0,12
islamic_books_distributor,Islamic books and gifts distributor,Islamic bookstores and Muslim gift shops,36,44,28,45,23,0,0,0,0,15
islamic_school_supplier,School uniforms and classroom furniture manufacturer,Islamic schools and Muslim academies,36,63,28,49,24,1,1,0,0,16
mosque_tech_dealer,Prayer hall audio and digital signage dealer,Mosques and Islamic centers,36,64,28,39,23,0,0,0,0,16
