company,domain,url,query,snippet
Abaya Atelier,abayaatelier.co.uk,https://www.abayaatelier.co.uk/,abaya boutique UK,"Based in the UK and shipping worldwide, we’re proud to connect sisters across the globe with high-quality, stylish abayas that honour tradition while embracing modern trends."
Abayas Boutique,abayasboutique.com,https://abayasboutique.com/blog/our-flagship-store-in-heart-of-manchester/,hijab store Manchester,"Whether you are searching for premium hijabs in Manchester , luxury abayas in Rusholme, or everyday modest essentials, Abayas Boutique and our Rusholme flagship store are here to serve you with elegance and care."
Alalia Boutique,alaliaboutique.net,https://alaliaboutique.net/,abaya boutique Melbourne,"“Shop elegant modest wear at Alalia Boutique. Stylish dresses, sets, and everyday essentials. Based in Melbourne . Fast shipping available.”"
Al Haya London,alhayalondon.com,https://alhayalondon.com/,abaya boutique London,Discover our wide collection of elegant and luxurious abayas to add to your wardrobe.
Hijabs,alisra.ca,https://www.alisra.ca/,hijab store Toronto,"Alisra is your shopping destination for premium hijabs , shawls, modest fashion, and Islamic Clothing products for the modern Muslim."
Alyas Abaya USA,alyasabaya.com,https://alyasabaya.com/,abaya boutique USA,"Alyas Abaya is transforming how Muslim women dress in the USA with trendy abayas . Drawing from global cultures, we blend style, quality, and craftsmanship to enhance the aesthetic value of abayas ."
Finding Hijab Shops in Birmingham,amanis.com,https://www.amanis.com/finding-hijab-shops-in-birmingham-top-recommendations/,hijab store Birmingham,"Sep 23, 2024 · Well, you’ve come to the right place! As a hijabi myself, I know how important it is to find the perfect hijab that complements your style and personality. In this article, I’ll be sharing my top recommendations in Birmingham for all your hijab needs. Let’s dive in!"
Amerati Collection,ameraticollection.com,https://ameraticollection.com/,abaya boutique New York,We wanted to design abayas that not only embrace traditional modesty but also incorporate modern elegance and style. Our goal is to empower women by providing them with clothing that allows them to express their individuality while staying true to their values.
Find Your Perfect Hijab,amirahijabs.co.uk,https://amirahijabs.co.uk/,hijab store UK,"Explore our latest collection of modest Islamic clothing, featuring premium modal fabric hijabs in both traditional and modern designs. Shop now for high-quality fashion with worldwide shipping from our UK -based store ."
Arifas Boutique,arifasboutique.com,https://www.arifasboutique.com/,hijab store Toronto,"Our online store offers a diverse collection of hijabs to cater to the needs of the most influential women worldwide. Our hijabs are not only stunning in design but also incredibly comfortable to wear. We have a vast selection of hijab styles, including squares and prints."
Ayaana,ayaana.ca,https://ayaana.ca/,abaya boutique Canada,"Ayaana is a Canadian based modest fashion brand that brings to you uniquely designed abaya sets produced from the finest of fabrics, suitable for all seasons, and with an exciting intermixture of culture and novelty."
AYNA Modest Boutique,aynausa.com,https://www.aynausa.com/,abaya boutique,Modest fashion featuring abaya 's and hijabs.
Ben Harad – BenHarad,benharad.com,https://benharad.com/,abaya boutique Birmingham,"Discover BenHarad for Abayas , Occasional Dresses, Prom Gowns, Thobes/Jubbas, a wide variety of Hijabs, Prayer Dresses, an extensive selection of high-quality Perfumes, Oud fragrances, and Luxurious Oils."
About Bila Boutique,bilaboutiques.com,https://www.bilaboutiques.com/pages/about-bila-boutique,abaya boutique Houston,"Welcome to Bila Boutique , your go-to for Islamic fashion and goods in Houston, Texas. We specialize in abayas, hijabs, and a curated selection of Islamic products that blend elegance with modern style."
almanaar Islamic Store,bizseek.co.uk,https://www.bizseek.co.uk/almanaar-islamic-store-0121-684-5004,hijab store Birmingham,"Established in 2016 and based in Coventry Road, Birmingham , Almanaar provides a variety of items including women's abayas, hijabs , and dresses, men's thobes and trousers, children's clothing, Hajj and Umrah essentials, perfumes, incense burners, and much more."
"Modest Clothing Stores In Houston, Texas - BPC - Modest",bulletpointchristian.com,https://bulletpointchristian.com/modest-clothing-stores-in-houston-texas/,modest fashion boutique Houston,"Houston ’ s modest fashion scene is every bit as diverse as the city itself. From family-run Islamic boutiques on the southwest side to chic dress shops in the northern suburbs, these brick-and-mortar stores keep style and faith walking hand-in-hand."
"Abayas Boutique in Manchester, eng M14 5WS - (796) 1",chamberofcommerce.uk,https://www.chamberofcommerce.uk/business-directory/england/manchester/miscellaneous/244808-abayas-boutique,abaya boutique Manchester,"Abayas Boutique is located at 7 Grandale St in Manchester , England M14 5WS. Abayas Boutique can be contacted via phone at (796) 114-3083 for pricing, hours and directions."
"Asli Modest Wear is a Boutique in Houston, TX 77083",clothingstorehouston.com,https://www.clothingstorehouston.com/about_us,hijab store Houston,"Our collection includes a wide variety of clothing options, including hijabs , for women and kid's clothing with a modest touch. Our pieces aim to strike the perfect balance between modesty and fashion, providing our customers the best of both worlds."
Home - Deen Modest,deenmodest.ca,https://deenmodest.ca/,modest fashion boutique Toronto,"What started as a family dream in Scarborough, Toronto , is now a space where fashion meets faith, and every piece is designed to make you feel confident, comfortable, and beautifully modest ."
"Tyra's Hajab Boutique in 17 Holmfirth Street, Longsight",directory.manchestereveningnews.co.uk,https://directory.manchestereveningnews.co.uk/company/665164846931968,hijab store Manchester,"Hijab dressing does not mean you have to wear shabby clothes, you can blend with the world in these modern times. Be passionate, modern and a fashionista by wearing trendy HIJAB ."
Magenta Boutique,dressmagenta.com,https://dressmagenta.com/,modest fashion boutique Chicago,Magenta Boutique is a Ladies and Kids modest clothing boutique located in Chicago .
Dubai Abaya Boutique,dubai-abayas.com,https://dubai-abayas.com/,abaya boutique USA,"Discover elegant Dubai-inspired abayas delivered across the USA . Premium quality, modest fashion for everyday elegance and special occasions. Shop now!"
Premium Abayas in Birmingham,elmayagarments.co.uk,https://elmayagarments.co.uk/pages/abayas-birmingham,abaya boutique Birmingham,Shop elegant abayas in Birmingham from ELMAYA GARMENTS. Premium modest fashion with fast delivery across all Birmingham postcodes. Timeless designs for the modern woman.
ENROBE,enrobe.ca,https://www.enrobe.ca/,modest fashion boutique Toronto,Feminine empowerment through modesty and compassion. Designed in Canada. The latest in modest fashion . Shipping Worldwide.
"Modest Wear Canada, 5120 Dixie Road , Unit # 5, Mississauga",findglocal.com,https://www.findglocal.com/CA/Mississauga/106477005320196/Modest-Wear-Canada,modest fashion boutique Mississauga,"Jul 20, 2025 · Discover The Latest Modest Evening Gown, Prom Dress, New Arrival Fashion, And Modest Women’s Dresses Online at modestwearcanada.com, With Great Prices"
Where to buy Affordable Abayas and Dresses in Mississauga,gabaaz.ca,https://gabaaz.ca/blogs/news/where-to-buy-affordable-abayas-and-dresses-in-mississauga,abaya boutique Mississauga,"Mar 9, 2025 · In this article, we’ll explore some of the best places to buy abayas in and around Mississauga , whether you prefer shopping in-store or online. We’ll highlight unique collections, sustainable options, and customer experiences to help you find the perfect abaya ."
Haute Hijab - Hijabs & Accessories for the World's Most,hautehijab.com,https://www.hautehijab.com/,hijab store New York,"Welcome to Haute Hijab ! Our mission is to create a world where every woman feels comfortable and confident. Shop premium hijabs in jersey, chiffon, woven, and satin — plus underscarves, magnets, and more! Free US shipping."
Hayaa Hijab - The Online Hijab Store,hayaahijab.com.au,https://hayaahijab.com.au/,hijab store Australia,"Discover Hayaa Hijab , your go-to online store in Australia & New Zealand for premium hijabs and accessories that blend style with modesty."
Modest Fashion Australia,hidayat.com.au,https://hidayat.com.au/,abaya boutique Australia,"Looking for modest islamic clothing in Australia families can trust? Our online store offers elegant abayas , stylish thobes, comfortable hijabs, and essential prayer wear for women, men, and kids across Australia ."
"Islamic Clothing Chicago, Illinois – Hijab, Arabic Clothing",hijababayajilbab.com,https://www.hijababayajilbab.com/islamic-clothing-usa/islamic-clothing-chicago-illinois-hijab-arabic-clothing-stores-and-shops-information.html,hijab store Chicago,"Islamic Clothing information can be obtained from the following Islamic shops , and mosques in Chicago and surrounding areas. Chicago is the third largest city in the United States, and with more than 2.8 million people, the largest city in the state of Illinois and the Midwestern United States."
Hijab Hive,hijabhive.com,https://hijabhive.com/,hijab store UK,"Shop Hijabs Online from the UK 's leading online Hijab shop . We carry a wide selection of Hijabs from Everyday basics, Limited Edition Hijabs , Dressed an..."
Home - Hijab House,hijabhouse.au,https://hijabhouse.au/,hijab store Sydney,"Elevate your everyday style with the Co-Ord Range, a meticulously curated collection of matching hijabs and caps designed to effortlessly complement your wardrobe."
HIJABI LONDON,hijabilondon.com,https://hijabilondon.com/,hijab store London,"Shop hijabs, abayas, and lifestyle accessories from Hijabi London . Handcrafted for elegance, with worldwide shipping. Find your perfect piece today."
Hijab Store & Modest Fashion USA,hijabistore.com,https://hijabistore.com/,hijab store USA,"Shop hijabs , abayas, modest dresses & Islamic clothing. Free US shipping on orders $75+. Curated from 100+ modest fashion brands. America's modest fashion marketplace."
HIJABSTORE.CO.UK,hijabstore.co.uk,https://www.hijabstore.co.uk/,hijab store UK,"Our shimmer chiffon hijab is a light, airy fabric that's perfect for occasions. Professional, formal and luxury looks. Due to the smooth and soft feels we recommend to wear with under scarf."
Hikmah Boutique,hikmahboutique.com.au,https://hikmahboutique.com.au/,abaya boutique Sydney,"The best hijab shop in Sydney at Hikmah Boutique. Shop Muslim Islamic clothing, Abayas , Thobes, Hijabs, Jilbabs and Modest swimwear in affordable prices!"
HIYA LONDON,hiyalondon.com,https://hiyalondon.com/,abaya boutique London,"HiyaLondon is the UK’s go-to brand for modest fashion, offering a stylish range of Abayas , Hijabs, Shawl, scarf skirt sets and trousers coords for winter and modest clothes for Hijabis."
Amira’s Islamic Boutique Clothing Stores Mississauga Ontario,indianbusinesscanada.com,https://indianbusinesscanada.com/amiras-islamic-boutique/,abaya boutique Mississauga,"Amira's was established in 2000, with the vision of providing Islamic products and South Asian fashion in a single environment. After one successful year of operation, a bigger location was acquired as a response to the increased demands of Amira's clientele."
"The Islamic Place - Books, Clothing, Prayer Rugs, Body Oils",islamicplace.com,https://www.islamicplace.com/,hijab store Houston,"Islamic Books, Clothing for Brothers and Sisters (Abaya, Hijab , Jilbab, Thob, Kufi), Prayer Rugs, Attar & Body Oils, Incense, Black Seed, Soaps, Khuff, Henna"
Jumeirah Boutique,jumeirahboutique.com,https://jumeirahboutique.com/,abaya boutique Australia,"Discover Jumeirah Boutique's exquisite collection of modest abayas , inspired by Dubai and Middle Eastern traditions. Embrace elegance and grace with our premium designs, tailored for women who cherish modesty and style. Explore our range and find your perfect statement piece today."
LAYALI BOUTIQUE,layaliboutique.com,https://www.layaliboutique.com/,abaya boutique New York,"WORLD RENOWNED DRESS DESIGNERS Many Middle Eastern Designers Rule the Red-Capet. LAYALI Boutique is a proud Authorized Retailer for many of the top Middle Eastern fashion houses. Whether it be for a wedding or special event, we have the dress for you!"
Home,laylowladies.com,https://www.laylowladies.com/,modest fashion boutique Chicago,"Based in Chicago , our boutique emphasizes the significance of modest fashion and encourages women from diverse backgrounds to embrace their individuality with grace and confidence."
LOCATIONS – leenashijabs,leenashijabs.com,https://leenashijabs.com/pages/locations,hijab store Mississauga,"We cant wait to get our hijabs in your hands and on your heads! TCC Shop - Mississauga (Canada) We are so proud to finally have our own store in central Mississauga . The address is 5585 McAdam Road, Mississauga , Ontario and is located inside the TCC Business side. Store Hours: Saturdays 12 pm - 4"
Lei's Boutique,leiboutiques.com,https://leiboutiques.com/faq,modest fashion boutique Houston,"Explore Lei's Boutique in Houston , a faith-inspired fashion retailer specializing in elegant, modest dresses. Shop my stylish collection today for church, work, or everyday wear."
MODEST WEAR,loc8nearme.com,https://www.loc8nearme.com/ontario/mississauga/modest-wear-hijab-evening-gowns/6846057/,modest fashion boutique Mississauga,"Modest Wear is a popular boutique in Mississauga that offers a wide selection of modest fashion pieces, including dresses, hijabs, evening gowns, Hajj clothing, and prom dresses. Customers appreciate the beautiful and diverse collection, making it easy to find outfits for various occasions."
Love Olive Co,loveoliveco.com,https://loveoliveco.com/,modest fashion boutique Chicago,"With weekly new arrivals you will want to shop our modest clothing all the time. We are a women's clothing boutique selling a variety of tops, bottoms, dresses, swimwear, & more."
"Abayas Boutique Home of Islamic Libas, Manchester - Cylex",manchester.cylex-uk.co.uk,https://manchester.cylex-uk.co.uk/company/abayas-boutique-home-of-islamic-libas-23804713.html,abaya boutique Manchester,"Nov 20, 2025 · Abayas Boutique Manchester is newly opened Exclusive Boutique in the Heart of the City. Providing Exclusive Designs in Abayas , Kaftans, Hijabs and Mens and Boys Thobes."
Marhaba Book Store and Hijab Fashion,marhabaislamicstore.com,https://marhabaislamicstore.com/,hijab store Mississauga,"Welcome to Marhaba Bookstore & Hijab Fashion, your one-stop Islamic Store in Mississauga and Pickering! As an Official Distributor and Dealer of Darussalam Publication, we offer you a wide range of Islamic Books, Azan Clocks, Hijabs , Frames and Decors."
Greater Toronto Area,medium.com,https://medium.com/@modest-wear/best-modest-clothes-in-mississauga-greater-toronto-area-55ae3c1653ec,modest fashion boutique Mississauga,"With our diverse selection, commitment to quality and comfort, and a focus on ethical and sustainable practices, Modest Wear provides the best modest clothes in Mississauga ."
MH BOUTIQUE – Specialized in Abaya's,mhboutique.co,https://mhboutique.co/,abaya boutique,"MH Boutique! Discover your perfect wardrobe staples! Our premium abayas and dresses are crafted with elegance and comfort in mind, offering versatile styles that blend luxury with practicality."
Luxury Abayas - Shop Handcrafted Abayas Online - MODESQUE,modesque.co.uk,https://modesque.co.uk/,abaya boutique UK,Discover exclusive luxury abayas online at MODESQUE. Browse our curated selection of elegant designs and opulent fabrics.
Modest Molly Women's Clothing Boutique,modestmolly.com,https://modestmolly.com/,modest fashion boutique Chicago,"Wide variety of cute, modest clothing options, including plus sizes, that are well-made and affordable; Informative website with helpful features like ""try on"" videos that make online shopping easier and more enjoyable."
Canada’s Largest Hijab Store,mominahijabs.ca,https://mominahijabs.ca/,abaya boutique Canada,"Shop 400+ hijabs, abayas & modest apparel at Canada ’s largest online hijab store. Discover the latest modest fashion. Free shipping over $99."
Abaya Galore Limited - Muslim Connect,muslimconnect.org,https://muslimconnect.org/services/united-kingdom/birmingham/aston/abaya-galore-limited/,abaya boutique Birmingham,"Abaya Galore Limited is a premier destination for modest fashion, located at 249A Ladypool Rd., Sparkbrook, Birmingham B12 8LF, United Kingdom. This store specializes in offering a wide range of high-quality Islamic clothing and accessories tailored for modern, modest-wear enthusiasts."
Mync Boutique,myncboutique.ca,https://myncboutique.ca/,abaya boutique Canada,"At Mync Boutique , we are dedicated to introducing the rich Khaleeji and Emirati traditions to North America. Our collections blend traditional Arabian fashion with modern trends, all hand-embroidered in the UAE for authentic quality."
Modest Clothing & Hijabs Australia,nasiba.com,https://nasiba.com/,hijab store Melbourne,"Shop Australia's finest modest clothing & hijabs at Nasiba. Family-owned for 35+ years. Browse premium chiffon, modal & jersey hijabs , abayas, modest dresses & more. Free shipping available. Shop online or visit us in Melbourne ."
Noor Boutique - Noor Boutique,noorboutiques.ca,https://noorboutiques.ca/,hijab store Toronto,"Elegant Hijab dresses, perfect for every occasion. Modesty Meets Elegance – Noor Boutique, Your Trusted Source for Hijabs and Modest Fashion for Women in the Greater Toronto Area."
Muslim Clothing,nouralhouda.com.au,https://nouralhouda.com.au/,abaya boutique Australia,"What began with Hijabs and Abayas has grown into a wide collection of pieces for women, men, and children, each made to blend seamlessly into modern life. At BNAH, we believe modest fashion has a place on every runway and in every wardrobe."
OZMAH MODEST CLOTHING,ozmah.com,https://ozmah.com/,hijab store Melbourne,"Experience Luxury in Every Seamless Stitch with Sydney Abayas. Transform your wardrobe with stunning abayas that elevate modesty. Experience Effortless Elegance this Spring with Our Stunning Sema Dresses. Comes in three colours black, white and beige. See our Insta Stories in Real Time..."
Modest Luxury Abayas & Hijabs Online,qalbi.com.au,https://www.qalbi.com.au/,abaya boutique Sydney,"Qalbi offers modest luxury abayas , hijabs & accessories designed in Sydney . Soulful modest wear for women. Up to 30% off launch offer and Australia-wide shipping. Shop today!"
Premium Luxury Hijabs,ruwayda.ca,https://www.ruwayda.ca/,hijab store Canada,"RUWAYDA was established on the foundations of elegance, modesty, and quality. With you in mind, RUWAYDA was born to bring forth a wide range of Hijabs in your favorite colors, making them a versatile addition to your wardrobe."
Sajdah Couture l Where Modesty Meets Luxury,sajdahcouture.com,https://sajdahcouture.com/,modest fashion boutique,"Discover stylish abayas, modest clothing, and luxurious perfumes at Sajdah Couture in Los Angeles, California. Embrace modest fashion that blends elegance with comfort."
Sanaa's Boutique – Sanaa's Boutique,sanaasboutique.com,https://sanaasboutique.com/,abaya boutique Chicago,Sanaa's Boutique Home About Us Hijabs Accessories More USD
SexyModest Boutique - Modest Fashion For Women,sexymodest.com,https://www.sexymodest.com/,modest fashion boutique,"Online store for stunning, comfy, and Modest Fashion for Women. See our collection of modest clothing for women. All original designs by talented Brigitte Brianna."
Shakerabazaar,shakerabazaar.com,https://shakerabazaar.com/,abaya boutique Houston,Shop By Fabric Indo-Western Fusion Men's Collection Kurtis Abaya Hijabs Clearance Contact Us
Modest Islamic Clothing by Sunnah Style,sunnahstyle.com,https://sunnahstyle.com/ca/,hijab store Canada,"Sunnah Style is an Islamic clothing company specializing in modest abaya, hijab , khimar, niqab, jilbab and thobe styles."
The Abaya Company London - The Ummahs Everyday Uniform,theabayacompany.london,https://theabayacompany.london/,abaya boutique London,I am very happy with my recent purchase of the classic A line abaya . The fabric is soft and flowy and a perfect fit. I highly recommend this abaya and the company's excellent service. I will definitely be a repeat customer.
Deen City,thedeencity.com,https://thedeencity.com/,hijab store Mississauga,"Our store is your one-stop destination for everything you need to embrace and express your faith. From modest clothing to essential prayer items and home decor, we provide a wide range of products to enrich your Islamic lifestyle."
The Hijab Room – The Hijab Room,thehijabroom.co.uk,https://thehijabroom.co.uk/,hijab store UK,"EMBRACE ELEGANCE AND MODESTY WITH EVERY HIJAB ! Step into elegance at The Hijab Room! Your destination for stylish, elegant hijabs that elevate your everyday look. Hijab store uk , chiffon, crinkle chiffon, satin, satin shimmer, modal cotton, modal prints, jersey, silk, hijab caps, accessories, hija"
The Hijab Shop Online,thehijabshoponline.com.au,https://thehijabshoponline.com.au/,hijab store Sydney,"We are proud to offer the finest fabrics, curated colours and on trend modest outfits and accessories to make wearing hijab a breeze."
The Hijab Store,thehijabstore.com.au,https://thehijabstore.com.au/,hijab store Melbourne,"The Hijab Store | Online Hijabs & Accessories – Melbourne Shop a beautiful range of hijabs and accessories at The Hijab Store , an online boutique based in Melbourne . Explore a large range of high-quality hijabs and accessories."
The Hijab Vault – TheHijabVault,thehijabvault.com,https://thehijabvault.com/,abaya boutique Chicago,"Chicago based online hijab store, providing women up to date trends at an affordable price.With the latest hijab prints & designs & fabrics. Shop TheHijabVault."
Meet Abayas Boutique,themanc.com,https://themanc.com/style/meet-abayas-boutique-manchesters-leading-luxury-house-of-hijab/,abaya boutique Manchester,"Ready to transform your body or lay the foundations for lifelong health, and feeling pretty serious about it? Ok, game on. Ultimate Performance is the gym in Manchester to join if you want to stick to your plan and achieve whatever goals you set yourself, from fat loss to muscle building to general"
Trendy Nisa,trendynisa.ca,https://trendynisa.ca/,modest fashion boutique Toronto,"Trendy Nisa is a Toronto based exclusive women's clothing boutique bringing elegance to everyday modest wear. Located at 55 Lebovic Ave, Scarborough."
TWINVEIL,twinveil.com,https://twinveil.com/,hijab store Canada,"Elevate your style with premium, high quality hijabs . Canada 's top online hijab store offering matching hijab sets. Free shipping available. Chiffon Hijab sets, jersey hijab sets, & modal hijab sets."
Urban Modesty,urbanmodesty.com,https://urbanmodesty.com/,abaya boutique New York,"Discover the perfect level of modesty and elegance without compromise! Shop timeless modest clothing, abayas , and hijabs online or visit our store today."
Veil & Co,veilandco.ca,https://veilandco.ca/,abaya boutique Canada,"Discover timeless abayas and khimar sets crafted with care. Veil & Co is a Canadian modest fashion brand offering breathable, ethically made abayas inspired by simplicity, faith, and elegance."
VEILED,veiled.com,https://veiled.com/,hijab store,"Shop Veiled — Shop Veiled's sustainably made modest women’s clothing, hijabs and accessories. Shop affordable modest women’s & men's fashion and unique exclusive designs."
Online Hijab Store,voilechic.com,https://voilechic.com/,hijab store,"Premium quality hijabs & underscarves in elegant, comfortable fabrics. Shop instant & premium jersey, non-slip chiffon, breathable modal & bamboo. Free fast shipping."
Wild and Free Boutiques - Modest Women's Clothes for all,wildandfreeboutiques.com,https://www.wildandfreeboutiques.com/,modest fashion boutique,Wild and Free Boutiques was created to help women find modest clothing to make them wildly happy and free to express their unique style. We hope you love the variety of modest pieces we offer in sizes XS-3X. Each piece is chosen with you in mind.
"TOP 10 BEST Muslim Clothing in Mississauga, ON - Yelp",yelp.ca,https://www.yelp.ca/search?find_desc=Muslim+Clothing&find_loc=Mississauga%2C+ON,abaya boutique Mississauga,"""They have a few armless ones as well. They also have a selection of Abayas , Afghan Wear, Hijabs and..."" more"
"TOP 10 BEST Abaya Store in Mississauga, ON, Canada - Yelp",yelp.com,https://www.yelp.com/search?find_desc=Abaya+Store&find_loc=Mississauga%2C+ON,abaya boutique Mississauga,"Top 10 Best Abaya Store in Mississauga , ON, Canada - Last Updated November 2025 - Yelp - Modest Wear, Um Anas Islamic Fashion & Book Store, Glamour U - Ladies Fashion Casual Apparel & Party Wear, Famous Canada, Voluptuous, Professional Sew & Fit, Mango, Silk & Gold Boutique, Simons, Mountain Equipm"
Modest Clothing Chicago,zadinaabayas.com,https://www.zadinaabayas.com/us/modest-clothing-chicago,abaya boutique Chicago,Zadina Abayas Chicago have been established since 2014 and are designed to showcase the latest Abayas clothing fashion around the world. The label has become known for its fusion of modest to contemporary style and affordable high end fashion.
Zahraa The Label - Leading Hijab & Modest Fashion Label,zahraathelabel.com,https://www.zahraathelabel.com/,hijab store,Shop Zahraa for high-quality hijabs and modest fashion. Enjoy fast & free shipping on U.S. orders over $150 and easy returns. Explore our newest collections now.
