company,contact_name,role,email,phone,domain,source_url,source_label,consent_status,verification_status,overall_score,raw_text_snippet
American HVAC Corp,,,info@americanhvaccorp.com,11101 (347) 862-9594,americanhvac.nyc,https://americanhvac.nyc,Public website crawl,legitimate_interest,email_verified,27.25,"American HVAC Corp is one of the best HVAC Contractor in New York, NY having specialisation in repair, maintenance, and installation services. Book Now!"
Lions Heating & Air Conditioning,,,info@lionshvac.com,866) 430-3950 9415,lionshvac.com,https://lionshvac.com,Public website crawl,legitimate_interest,email_verified,27.25,"Lions Heating & Air is a leading HVAC contractor in Los Angeles, CA. We offer Air Conditioning installation, repair & maintenance of all major brands!"
"Commercial HVAC Services in New York, NY",,,solutions@abm.com,10006 212-297-0200,locations.abm.com,https://locations.abm.com/ny/newyork/hvac-services-newyork-ny-1411.html,Public website crawl,unknown,email_verified,25.19,"ABM provides HVAC and mechanical solutions in New York. Learn how we help you improve occupant comfort and reduce energy consumption.
New York ABM Office"
Christian Brothers Mechanical Services,,,sales@cbhvac.com,1-800-605-2247,cbhvac.com,https://cbhvac.com,Public website crawl,legitimate_interest,email_verified,23.44,"For a full-service commercial heating & cooling contractor, give Christian Brothers Mechanical Services a call at 1-800-205-2247."
Christian Brothers Mechanical Services,,,hr@cbhvac.com,1-800-605-2247,cbhvac.com,https://cbhvac.com,Public website crawl,unknown,email_verified,23.44,"For a full-service commercial heating & cooling contractor, give Christian Brothers Mechanical Services a call at 1-800-205-2247."
Christian Brothers Mechanical Services,,,service@cbhvac.com,1-800-605-2247,cbhvac.com,https://cbhvac.com,Public website crawl,unknown,email_verified,23.44,"For a full-service commercial heating & cooling contractor, give Christian Brothers Mechanical Services a call at 1-800-205-2247."
HVAC Contractors in Toronto,Ads Building,,,416-904-7212,trustedpros.ca,https://trustedpros.ca/on/toronto/hvac,Public website crawl,unknown,phone_verified,14.67,"Ads Building 5.0 3 Reviews ( 1 Heating & Air Conditioning Related ) 885 Progress Ave Scarborough ON M1H 3G3 | Service area includes Toronto Bathroom Renovations , Kitchen Renovations , Heating & Air Conditioning Vathanan of Scarborough said: ""Recently a new Heat pump and attic installation was done by Ads Building. Out"
HVAC Contractors in Toronto,Rockstar Mechanical,,,647-581-4751,trustedpros.ca,https://trustedpros.ca/on/toronto/hvac,Public website crawl,unknown,phone_verified,14.65,"Rockstar Mechanical 5.0 7 Reviews ( 5 Heating & Air Conditioning Related ) 23-104 George Henry Blvd Toronto ON M2J 1E7 Heating & Air Conditioning , Gas Lines , Plumbing gina of toronto said: ""Andrew from Rockstar Mechanical replaced our old furnace and air conditioner and did a great job. He was one of three quotes tha"
HVAC Contractors in Toronto,Afrusun Inc,,,647-782-7000,trustedpros.ca,https://trustedpros.ca/on/toronto/hvac,Public website crawl,unknown,phone_verified,14.57,"Afrusun Inc 5.0 1 Review ( 1 Heating & Air Conditioning Related ) 7161 Yonge St Thornhill ON L3T 0C8 | Service area includes Toronto Heating & Air Conditioning , Fireplaces , Gas Lines Sid  of Mississauga said: ""I've been thinking for a quite while about who will replace my home heating and A/C system until I come to k"
American HVAC Corp,,,,347) 862-9594,americanhvac.nyc,https://americanhvac.nyc/about-us,Public website crawl,unknown,phone_verified,13.84,"American HVAC offers best designs, installation, maintenance & repair of HVAC systems for residential and commercial clients across NYC."
Inven,,,,5001-10000 1934,inven.ai,https://www.inven.ai/company-lists/top-25-hvac-companies-in-california,Public website crawl,unknown,phone_verified,11.86,"Explore top HVAC companies in California, including CoolSys and Air-Tro, offering cutting-edge heating and cooling solutions."
HVAC Specialist,,,,0161 410 1310,hvac-specialist.co.uk,https://hvac-specialist.co.uk,Public website crawl,unknown,phone_verified,11.50,"We are HVAC Specialists who can offer you the best rates on your project. Voted the Top Rated Company for heating, ventilation,  in the UK."
"Commercial HVAC Services in New York, NY",,,,10006 212-297-0200,locations.abm.com,https://locations.abm.com/ny/newyork/production-support-newyork-ny-1411.html,Public website crawl,unknown,phone_verified,8.27,"With ABM’s New York material handling services, you can streamline your operations. Here’s how we support your warehouse or distribution center.
New York ABM Office"
Register Your Business,,,,855-890-7767,trustedpros.ca,https://trustedpros.ca/register-company,Public website crawl,unknown,phone_verified,7.50,Register Your Business
