company,contact_name,role,email,phone,domain,source_url,source_label,consent_status,verification_status,overall_score,raw_text_snippet
Manuela,,,info@manuela-la.com,323) 849-0480,manuela-la.com,https://manuela-la.com,Public website crawl,legitimate_interest,email_verified,21.25,"A unique restaurant in LA uniting chefs, farmers and artists, and winner of Wine Spectator’s 2024 Award of Excellence. Perfect for brunch, lunch, & dinner."
Restaurant Business,,,swirth@winsightmedia.com,,restaurantbusinessonline.com,https://www.restaurantbusinessonline.com/top-100-independents,Public website crawl,unknown,email_verified,20.61,List of 100 top-grossing independent restaurants in America based on restaurant data like restaurant sales and average restaurant check
Alinea,Press Inquiries,,press@thealineagroup.com,,alinearestaurant.com,https://www.alinearestaurant.com,Public website crawl,unknown,email_verified,20.00,Press Inquiries: press@thealineagroup.com
Zehnders,,,,844) 207-7309,zehnders.com,https://www.zehnders.com/top-100-independent-restaurants-in-the-united-states,Public website crawl,unknown,phone_verified,12.95,Top 100 Independent Restaurants in the United States
Tasting Table,,,,908) 514-8038,tastingtable.com,https://www.tastingtable.com/about,Public website crawl,unknown,phone_verified,8.40,"Breaking food industry news, cooking tips, recipes, reviews, rankings, and interviews - since 2008."
Tasting Table,,,,213) 514-5724 2121,tastingtable.com,https://www.tastingtable.com/1499586/best-restaurants-los-angeles-large-groups,Public website crawl,unknown,phone_verified,8.27,Say goodbye to the struggles of finding a restaurant in LA that can accommodate large parties. Your next big outing can happen at any of these eateries.
Eater LA,,,,+12132643303,la.eater.com,https://la.eater.com/maps/best-big-party-group-dining-restaurant-los-angeles,Public website crawl,unknown,phone_verified,7.50,Where to bring a crew and enjoy a big meal in LA
LSE Summer School,,,,+44 (0)20 7405 7686,lse.ac.uk,https://www.lse.ac.uk/study-at-lse/summer-schools/summer-school/content-hub/8-of-the-best-independent-restaurants-in-london,Public website crawl,unknown,phone_verified,7.50,A blog article from Summer School student Brian Chen.
